id,Sentence,language,emotion
7465,ꯀꯣꯆ ꯑꯗꯨꯗ ꯁꯥꯟꯅ ꯈꯣꯠꯅꯕ ꯇꯧꯕ ꯃꯤ ꯑꯃꯒꯤ ꯃꯑꯣꯡ ꯃꯇꯧ ꯌꯥꯎꯗꯕ ꯑꯁꯤ ꯌꯥꯝꯅ ꯅꯤꯡꯕ ꯀꯥꯏꯅꯤꯡꯉꯥꯏ ꯑꯣꯏ꯫,Manipuri,disgust
181,"ꯃꯁꯤ ꯑꯩꯒꯤ ꯔꯣꯜ ꯑꯗꯨ ꯂꯧꯕꯒꯤ ꯑꯃꯠꯇ ꯉꯥꯏꯔꯕ ꯇꯥꯟꯖꯥꯅꯤ ꯍꯥꯏꯕ ꯈꯪꯂꯗꯨꯅ, ꯑꯩ ꯀꯥꯁꯇꯤꯡ ꯗꯤꯔꯦꯛꯇꯔꯒꯤ ꯂꯣꯏꯁꯪꯗ ꯆꯪꯂꯛꯄ ꯃꯇꯝꯗ ꯑꯩꯒꯤ ꯃꯤꯍꯨꯟ ꯆꯣꯡꯈꯤ꯫",Manipuri,fear
1990,ᱵᱷᱟᱨᱚᱛ ᱨᱮᱱ ᱡᱚᱠᱷᱚᱱ 98% ᱦᱚᱲ ᱠᱷᱟᱡᱽᱱᱟ ᱵᱟᱝ ᱠᱚ ᱮᱢᱚᱜᱼᱟ ᱮᱱᱠᱷᱟᱱ ᱤᱧ ᱪᱮᱫᱟᱜ ᱤᱧ ᱮᱢᱚᱜᱼᱟ ?,Santali,anger
8616,سٲنس ٹیمس منٛز کمی یِنہٕ سۭتۍ چھ دفترس منٛز عدم تحفظک احساس پٲدٕ گوٚومت۔,Kashmiri,sad
10310,"ꯑꯩꯍꯥꯛꯅ ꯁꯦꯟ ꯌꯥꯝꯅ ꯆꯪꯅ ꯇꯧꯔꯕ ꯃꯇꯨꯡꯗ ꯑꯩꯍꯥꯛꯀꯤ ꯃꯔꯨꯑꯣꯏꯕ ꯂꯝꯕꯥ ꯑꯣꯏꯔꯤꯕ ꯑꯗꯨꯗ ꯌꯥꯝꯅ ꯃꯔꯨꯑꯣꯏꯕ ꯗꯤꯜ ꯑꯁꯤ ꯑꯃꯨꯛꯇꯪ ꯃꯥꯡꯈ꯭ꯔꯕꯗ ꯑꯩꯍꯥꯛꯅ ꯄꯣꯠ ꯌꯣꯜꯂꯤꯕ ꯇꯤꯝ ꯑꯗꯨ ꯀꯔꯤꯒꯤꯗꯃꯛꯇ ꯊꯝꯕ ꯄꯥꯝꯒꯗꯧꯔꯤꯕꯅꯣ?, ꯍꯥꯏꯅ ꯆꯤ.ꯏ.ꯑꯣ.ꯗꯨꯅ ꯍꯥꯏꯈꯤ ꯫",Manipuri,anger
10179,ꯀꯥꯔꯤ ꯍꯥꯏꯕ? ꯑꯩꯈꯣꯏꯅ ꯑꯩꯈꯣꯏꯒꯤ ꯑꯉꯥꯡꯒꯤ ꯀꯂꯥꯒꯤ ꯑꯣꯏꯕ ꯆꯥꯎꯈꯠꯅꯕꯒꯤꯗꯃꯛ ꯇꯉꯥꯏꯐꯗꯕ ꯄꯥꯝꯕꯩꯁꯤꯡ ꯑꯃꯁꯨꯡ ꯈꯨꯗꯣꯡꯆꯥꯕꯁꯤꯡ ꯄꯤꯔꯤꯕꯅꯤ ꯍꯥꯏꯅ ꯑꯩ ꯈꯜꯂꯨꯔꯦ꯫,Manipuri,surprise
10707,ꯇꯣꯗꯥ ꯇ꯭ꯔꯥꯏꯕꯦꯜꯁꯤꯡꯅ ꯃꯐꯝ ꯑꯗꯨꯒꯤ ꯈꯨꯠꯅ ꯁꯥꯕ ꯄꯣꯠꯁꯤꯡ ꯑꯁꯤ ꯇꯣꯞ ꯇꯣꯞꯄ ꯅꯤꯡꯁꯤꯡ ꯈꯨꯗꯝ ꯑꯣꯏꯕ ꯄꯣꯠꯁꯤꯡ ꯑꯣꯏꯍꯜꯂꯤ ꯑꯃꯁꯨꯡ ꯑꯩꯈꯣꯏꯗ ꯄꯣꯖꯤꯇꯤꯕꯤꯇꯤ ꯍꯥꯞꯆꯤꯜꯂꯤ꯫,Manipuri,happy
6810,آہا! ییٚمہ بالہٕ پٮ۪ٹھٕ بوزنہٕ ینہٕ وول نظارٕ چھ دلکش۔,Kashmiri,surprise
2517,یہ وٕچھن چھ کٲفی كم ہمت كرن وول ز وقتس دوران  چھ میٲنۍ بچت  سیٹھاہ کم بڈیمٕژ۔,Kashmiri,sad
2786,مقامی کٲرۍگرن ہنٛز باریکی  تہٕ ہُنر چھےٚ پٔزۍ پٲٹھۍ قٲبل ذکر۔,Kashmiri,surprise
11000,بہٕ ہیکہٕ نہٕ یقینٕی کٔرتھ زِ فٹ بال مقابلس منٛز مخٲلف ٹیمس نش سانِہ کھیلِ ہٕنز حکمت عملی ظٲہر کرنہٕ خٲطرٕ گِریکھ ژٕ یوتاہ ۔,Kashmiri,anger
7693,ᱟᱢ ᱪᱮᱠᱟᱛᱮ ᱱᱚᱝᱠᱟᱱ ᱢᱤᱫᱴᱟᱝ ᱚᱲᱟᱜ ᱨᱮᱢ ᱛᱟᱦᱮᱱ ᱠᱟᱱᱟ  ᱡᱟᱦᱟᱸᱨᱮ ᱫᱚ ᱩᱱᱟᱜ ᱚᱵᱽᱨᱟ ᱟᱨ ᱦᱟᱱᱰᱮᱼᱱᱷᱟᱰᱮ ᱛᱟᱢᱛᱟᱥᱮᱨ ᱢᱮᱱᱟᱜᱼᱟ ? (ᱟᱭᱳ),Santali,disgust
5388,مےٚ اوس نہٕ زانٛہہ سوٗنٛچمت ز سٹریمنگ ایپہٕ نن اکہ دۄہ کیبل ٹی وی ہٕچ جاے۔,Kashmiri,surprise
6822,ییٚلہ تٔمۍ سۄ تنظیم ترٛاو ییٚتہ تٔمۍ ۄہُ ہو ؤریو کھۄتہٕ زیٛادٕ کالس کٲم ٲس کٔرمٕژ، تس اوٗس نہٕ فکری تران زِ تسَ کیٛاہ چھ کَرُن,Kashmiri,sad
973,ꯏꯟꯇꯔꯅꯦꯠ ꯁꯝꯕ ꯇꯞꯄꯅ ꯃꯔꯝ ꯑꯣꯏꯗꯨꯅ ꯑꯣꯐꯤꯁꯀꯤ ꯃꯤꯇꯤꯡ ꯑꯃꯗ ꯋꯥꯔꯤ ꯋꯥꯇꯥꯏ ꯁꯥꯅꯕꯒꯤ ꯄꯔꯤꯡꯗ ꯌꯦꯠꯄꯗꯨꯗ ꯑꯩ ꯌꯥꯝꯅ ꯁꯥꯎꯅꯤꯡꯈꯤ꯫,Manipuri,anger
1925,ꯃꯥꯏꯄꯥꯛꯂꯕ ꯇꯤꯝ ꯑꯗꯨꯅ ꯁꯥꯟꯅꯔꯣꯏ ꯑꯃꯒꯤ ꯃꯋꯣꯡ ꯃꯇꯧ ꯐꯖꯟꯅ ꯎꯠꯇꯕ ꯑꯁꯤ ꯏꯀꯥꯏꯅꯤꯡꯉꯥꯏꯅꯤ ꯫,Manipuri,disgust
4251,پشس پیٹھ  كرٗہٗن كاو سندِ بد شگوُن آسنٕكہِ توہٗم كِنہِ ییلہِ تہِ بہٕ كر٘ہٗن كاو وٗچھہِ بہٕ چھٗس بانبران ۔,Kashmiri,fear
689,"ᱤᱧ ᱪᱮᱫ ᱦᱩᱭᱫᱟᱲᱮᱭᱟᱜᱼᱟ ᱠᱤᱪᱷᱤ ᱡᱟᱹᱥᱛᱤ ᱰᱚᱜᱚᱨ ᱥᱟᱠᱟᱢ ᱨᱮᱭᱟᱜ ᱤᱧ ᱱᱮᱦᱚᱨ ᱫᱟᱲᱮᱭᱟᱜᱼᱟ ? ᱤᱧ ᱵᱚᱛᱚᱨᱚᱜ  ᱠᱟᱱᱟ ᱡᱮ, ᱤᱧ ᱨᱮᱱ ᱜᱷᱟᱨᱚᱸᱡᱽ ᱨᱮᱱ ᱦᱚᱲ ᱠᱚ ᱮᱴᱟᱜ ᱨᱮ ᱠᱚ ᱞᱟᱹᱲᱦᱟᱹᱭᱼᱟ ᱾",Santali,fear
10158,ᱤᱧ ᱟᱸᱡᱚᱢ ᱟᱠᱟᱫᱟ ᱡᱮ ᱦᱮᱯᱨᱟᱣ ᱪᱟᱞᱟᱜ ᱚᱠᱛᱚ ᱟᱹᱰᱤ ᱡᱳᱨᱮ ᱫᱟᱜ ᱮᱫᱟ ᱟᱨ ᱦᱮᱯᱨᱟᱣᱤᱭᱟᱹ ᱢᱮᱹᱱᱮᱡᱟᱨ ᱪᱮᱫ ᱞᱮᱠᱟ ᱠᱟᱛᱮ ᱚᱱᱟᱭ ᱪᱟᱼᱪᱟᱞᱟᱣᱟ ᱚᱱᱟ ᱟᱸᱡᱚᱢᱤᱧ ᱠᱷᱚᱡᱽ ᱠᱟᱱᱟ ᱾,Santali,fear
468,مےٚ چھ یہ عجیب احساس ز از چھ کینٛہہ خراب گژھن وول۔,Kashmiri,fear
5564,ꯉꯁꯤ ꯃꯤꯌꯥꯝꯒꯤ ꯕꯁ ꯑꯗꯨ ꯇꯣꯡꯒꯦ ꯍꯥꯏꯅ ꯑꯩꯍꯥꯛꯅ ꯀꯥꯈꯠꯂꯨꯕ ꯃꯇꯝꯗ ꯕꯁ ꯑꯗꯨ ꯃꯅꯝ ꯌꯥꯝꯅ ꯅꯝꯊꯤꯈꯤ ꯑꯃꯁꯨꯡ ꯅꯝꯊꯤꯃꯟꯗꯅ ꯈꯥꯡꯕ ꯉꯝꯈꯤꯗꯦ ꯫,Manipuri,disgust
5739,ᱥᱩᱡᱚᱱᱟᱜ ᱠᱤᱥᱠᱤᱥᱟᱹᱣ ᱵᱟᱹᱲᱛᱤᱜᱼᱟ ᱡᱚᱠᱷᱚᱱ ᱩᱱᱤ ᱟᱡ ᱨᱮᱱ ᱥᱚᱨᱮᱥ ᱠᱷᱮᱞᱳᱰᱤᱭᱟᱹ ᱢᱤᱫᱴᱟᱝ ᱟᱹᱰᱤ ᱱᱟᱯᱟᱭ ᱡᱤᱛᱠᱟᱹᱨ ᱨᱮᱭᱟᱜ ᱩᱫᱜᱟᱹᱣ ᱮ ᱮᱢᱟᱭᱟ ᱾,Santali,happy
2951,بہٕ گوس پریشان ییٚلہ نہٕ مےٚ ژوچِہ ہنٛد سُہ قسم وچھ یس بہٕ بیکری ہنٛدس مینوس منٛز ژھاران اوسس۔,Kashmiri,sad
7204,ꯃꯁꯤꯒꯤ ꯆꯥꯛꯁꯪ ꯑꯁꯤꯒꯤ ꯁꯤꯡꯛ ꯑꯁꯤ ꯐꯨꯟꯖꯤꯜꯂꯦ ꯑꯗꯨꯒ ꯃꯅꯝ ꯅꯝꯊꯤꯕ ꯂꯩꯅꯥꯡꯅ ꯊꯜꯂꯦ꯫,Manipuri,disgust
5393,ᱨᱟᱡᱟᱹᱨᱤ ᱟᱹᱜᱩᱣᱟᱹᱱ ᱮ ᱜᱚᱡ ᱞᱮᱱ ᱠᱷᱟᱱ ᱫᱚᱠᱟᱱᱫᱟᱨ ᱠᱚᱫᱚ ᱵᱚᱛᱚᱨ ᱛᱮ ᱟᱠᱚᱣᱟᱜ ᱥᱟᱱᱟᱢ ᱥᱟᱴᱟᱨ ᱠᱚ ᱟᱲᱜᱳᱭᱟ ᱟᱨ ᱟᱡᱨᱮᱱ ᱜᱩᱱᱰᱟᱹ ᱩᱱᱠᱩ ᱪᱟᱯ ᱠᱚ ᱮᱢᱟ ᱠᱚᱣᱟ ᱾,Santali,fear
3704,ᱡᱟᱹᱛᱤᱭᱟᱹᱨᱤ ᱜᱟᱫᱮᱞ ᱨᱮ ᱵᱟᱪᱷᱟᱣ ᱞᱟᱹᱜᱤᱫ ᱦᱚᱲᱠᱚ ᱪᱮᱫ ᱞᱮᱠᱟᱛᱮ ᱢᱩᱲᱩᱫ ᱠᱷᱮᱞᱚᱰ ᱠᱟᱹᱢᱤᱭᱟ ᱦᱚᱲ ᱠᱚ ᱪᱮᱛᱟᱱ ᱨᱮᱠᱚ ᱫᱚᱱ ᱠᱷᱟᱫᱞᱮ ᱞᱮᱱᱟ ᱚᱱᱟ ᱧᱮᱞ ᱫᱚ ᱵᱟᱝᱵᱮᱥ ᱛᱟᱦᱮᱸ ᱠᱟᱱᱟ ᱾,Santali,disgust
798,ᱤᱧ ᱟᱹᱰᱤ ᱠᱩᱥᱤᱧ ᱵᱩᱡᱷ ᱮᱫᱟ ᱡᱮ ᱦᱟᱞᱚᱛ  ᱵᱚᱱᱚᱫᱚᱞ ᱨᱮᱭᱟᱜ ᱢᱤᱫᱴᱟᱝ ᱩᱯᱟᱹᱭ ᱢᱮᱱᱟᱜᱼᱟ ᱾,Santali,happy
9233,ᱤᱧ ᱨᱩᱣᱟᱹ ᱩᱛᱟᱹᱨ ᱞᱤᱱᱟᱹᱧ  ᱡᱚᱠᱷᱮᱡ ᱤᱧ ᱢᱮᱱᱮᱡᱟᱨ ᱟᱡᱨᱮᱱ ᱦᱮᱯᱨᱟᱣᱤᱭᱟᱹ ᱟᱜ ᱨᱚᱲ ᱧᱮᱞ ᱞᱟᱹᱜᱤᱫ ᱟᱡᱨᱮᱱ ᱠᱞᱟᱭᱮᱱᱴᱟᱜ ᱚᱲᱟᱜ ᱨᱮ ᱵᱚᱞᱚᱜ ᱤᱧ ᱧᱮᱞ ᱞᱮᱫᱮᱭᱟ ᱾,Santali,disgust
5705,بہٕ چھس کھوژان کیکہٕ خٲطرٕ غلط ذائقہ ژارنہٕ سۭتۍ۔,Kashmiri,fear
10178,"ᱢᱮᱱᱠᱷᱟᱱ ᱢᱮᱰᱟᱢ, ᱱᱩᱱᱟᱹᱜ ᱦᱚᱲ ᱥᱟᱢᱟᱝ ᱨᱮ ᱠᱟᱛᱷᱟ ᱨᱚᱲ ᱤᱧ ᱫᱚ ᱵᱚᱛᱚᱨᱤᱧ ᱵᱩᱡᱷᱦᱟᱹᱣ ᱜᱮᱭᱟ ᱾ ᱩᱝᱠᱩ ᱫᱚ ᱡᱟᱹᱱᱤᱡ ᱤᱧ ᱠᱚ ᱢᱚᱡᱟ ᱫᱟᱲᱮᱭᱟᱹᱧᱟ ᱾",Santali,fear
1986,"ꯑꯩ ꯃꯐꯝ ꯑꯁꯤꯗ ꯑꯃꯨꯛ ꯍꯟꯅ ꯆꯤꯟꯖꯥꯛ ꯆꯥꯕ ꯉꯝꯂꯣꯏ ꯍꯥꯏꯅ ꯈꯜꯂꯤ, ꯑꯩꯒꯤ ꯆꯥꯛꯇ ꯈꯔꯃꯤ ꯑꯃ ꯌꯥꯎꯏ꯫",Manipuri,disgust
10249,ᱯᱮᱢᱮᱱᱴ ᱦᱚᱨᱟ ᱫᱚ ᱟᱹᱰᱤ ᱟᱡᱷᱟᱴ ᱜᱮ ᱛᱟᱸᱦᱮ ᱠᱟᱱᱟ ᱟᱨ ᱠᱩᱨᱤᱭᱟᱨ ᱠᱳᱢᱯᱟᱱᱤ ᱦᱚᱛᱮᱛᱮ ᱵᱮᱜᱚᱨ ᱡᱟᱦᱟᱱ ᱯᱩᱥᱴᱟᱹᱣ ᱛᱮ ᱞᱟᱜᱟᱣ ᱟᱠᱟᱱ ᱵᱟᱹᱲᱛᱤ ᱪᱟᱨᱡ ᱨᱮ ᱵᱟᱹᱧ ᱯᱟᱹᱛᱭᱟᱹᱣ ᱫᱟᱲᱮᱭᱟᱫᱟ ᱾,Santali,disgust
5167,كٗٹھِس منز گاشٗك نہٕ آسٗن اوس دم كران ، زن تہِ انہِ گٹِس بزات خۄد  اكھ موُجوُدِیت ٲس ۔,Kashmiri,fear
1736,بریک چھنہ کٲم کران۔اسہ کیاہ پزِ کرُن؟,Kashmiri,fear
3290,ᱤᱧ ᱫᱚ ᱟᱨ ᱱᱤᱭᱟᱹ ᱞᱮᱞᱦᱟ ᱠᱷᱮᱞ ᱫᱚ ᱵᱟᱹᱧ ᱠᱷᱮᱞ ᱫᱟᱲᱮᱭᱟᱜᱼᱟ ᱾ ᱱᱤᱭᱟᱹ ᱫᱚ ᱵᱳᱵᱟ ᱟᱹᱨᱤᱛᱮ ᱯᱮᱨᱮᱡ ᱟᱠᱟᱱᱟ ᱡᱟᱦᱟ ᱠᱷᱟᱹᱛᱤᱨᱛᱮ ᱤᱧ ᱫᱚ ᱛᱤᱥ ᱦᱚᱸ ᱵᱟᱹᱧ ᱡᱤᱛᱠᱟᱹᱨ ᱟᱠᱟᱱᱟ ᱾,Santali,anger
8771,ᱪᱚᱞᱚᱛ ᱪᱤᱛᱟᱹᱨ ᱨᱮ ᱟᱭᱢᱟ ᱯᱞᱚᱴ ᱴᱣᱤᱥᱴ ᱛᱟᱦᱮ ᱠᱟᱱᱟ ! ᱤᱧ ᱫᱚ ᱚᱱᱟᱠᱩ ᱦᱤᱡᱩᱜ ᱵᱟᱹᱧ ᱧᱮᱞ ᱟᱠᱟᱫᱟ ᱾,Santali,surprise
232,ꯈꯨꯟꯅꯥꯏ ꯑꯗꯨꯒꯤ ꯃꯤꯌꯥꯝꯅ ꯁꯦꯟꯖꯥ ꯊꯨꯝꯖꯥ ꯇꯧꯕ ꯄꯨꯂꯤꯁꯀꯤ ꯃꯥꯢꯌꯣꯛꯇ ꯏꯔꯥꯡ ꯍꯧꯒꯠꯂꯛꯈꯤ ꯑꯃꯁꯨꯡ ꯃꯈꯣꯏꯕꯨ ꯅꯝꯊꯦꯛꯈꯤ꯫,Manipuri,anger
9244,ꯔꯦꯗꯤꯃꯦꯗ ꯐꯔꯅꯤꯆꯔ ꯂꯩꯕꯒꯤ ꯑꯣꯏꯊꯣꯛꯄ ꯌꯥꯕ ꯑꯗꯨꯗ ꯑꯩ ꯑꯁꯦꯡꯕ ꯌꯥꯝꯅ ꯅꯨꯡꯉꯥꯏꯔꯦ ꯫,Manipuri,surprise
2685,"ꯎ ꯁꯨꯕ ꯃꯤꯑꯣꯏ ꯑꯗꯨꯅ ꯑꯍꯥꯟꯕꯗ ꯍꯥꯏꯅꯈꯤꯕꯗꯨꯗꯒꯤ ꯍꯦꯟꯅ ꯁꯥꯡꯕ ꯎꯄꯨ ꯑꯃ ꯊꯤꯂꯛꯄ ꯃꯇꯝꯗ ꯑꯩꯍꯥꯛ ꯉꯛꯃꯟꯈꯤꯗꯅ ꯋꯥꯒ ꯑꯝꯇ ꯉꯥꯡꯕ ꯉꯝꯈꯤꯗꯦ, ꯑꯗꯨꯕꯨ ꯑꯩꯉꯣꯟꯗꯒꯤ ꯍꯥꯟꯅ ꯍꯥꯏꯅꯈꯤꯕ ꯃꯃꯟ ꯑꯗꯨ ꯑꯗꯨꯝ ꯂꯧꯈꯤ꯫",Manipuri,surprise
6896,ᱤᱧ ᱱᱩᱭ ᱯᱚᱨᱟᱢᱚᱥ ᱮᱢᱚᱜᱤᱡᱽ ᱨᱮ ᱠᱩᱥᱤᱧ ᱛᱟᱦᱮᱸ ᱠᱟᱱᱟ ᱪᱮᱫᱟᱜ ᱥᱮ ᱩᱱᱤ ᱫᱚ ᱟᱡᱟᱜ ᱯᱷᱤ ᱴᱟᱲᱟᱝ ᱯᱤᱪᱷᱤ ᱨᱮ ᱵᱟᱝ ᱠᱟᱛᱮᱜ ᱧᱟᱢ ᱟᱠᱟᱱ ᱚᱨᱡᱚ ᱪᱮᱛᱟᱱ ᱴᱮᱦᱟᱴ ᱠᱟᱛᱮᱭ ᱪᱟᱨᱡᱽᱼᱮ ᱦᱟᱛᱟᱣ ᱞᱮᱫᱟ ᱾,Santali,happy
7716,"ꯑꯩ ꯑꯐꯕ ꯃꯍꯧꯁꯥꯒꯤ ꯑꯣꯏꯕ ꯃꯩ ꯉꯥꯟꯕ ꯌꯨꯝ ꯑꯃ ꯄꯥꯝꯃꯤ, ꯃꯩ ꯏꯃꯝ ꯃꯝꯕ ꯃꯐꯝꯁꯤꯡꯗ ꯑꯩ ꯈꯔ ꯅꯨꯡꯉꯥꯢꯇꯕ ꯐꯥꯎꯏ꯫",Manipuri,fear
10369,تہۍ کیٛازِ چھوٕ مےٚ کن یتھ پٲٹھۍ وٕچھان میڈم؟,Kashmiri,disgust
7923,ᱱᱚᱣᱟ ᱫᱚ ᱤᱧ ᱫᱩᱠᱮ ᱮᱢᱟᱧᱟ ᱡᱮ ᱟᱢ ᱵᱟᱨᱼᱵᱟᱨ ᱤᱧ ᱥᱟᱞᱟᱜ ᱵᱟᱹᱲᱤᱡ ᱮᱢ ᱵᱮᱣᱦᱟᱨᱟ ᱾,Santali,anger
4807,ꯑꯩꯈꯣꯏꯅ ꯂꯧꯕꯨꯛꯇ ꯊꯕꯛ ꯇꯧꯔꯤꯉꯩ ꯃꯇꯝꯗ ꯑꯩꯈꯣꯏꯒꯤ ꯂꯟꯆ ꯕ꯭ꯔꯦꯛꯁꯤꯡꯒꯤꯗꯃꯛꯇ ꯅꯨꯡꯉꯥꯏꯕ ꯑꯃꯁꯨꯡ ꯎꯔꯨꯝ ꯂꯥꯡꯕ ꯃꯐꯝ ꯑꯃ ꯐꯪꯕꯗ ꯑꯩꯅ ꯊꯥꯒꯠꯆꯕ ꯎꯠꯂꯤ ꯫,Manipuri,happy
3189,مےٚ گٔیہ میٹرو مسافرن ہٕنٛز کھٔر ییٚلہ تم لوکن ہنٛدس بۄن وسنس پیٛارنہٕ ورٲیی ڈبس منٛز اژان ٲسۍ۔,Kashmiri,disgust
10432,ᱱᱚᱣᱟ ᱫᱚ ᱠᱚᱨ ᱟᱹᱢᱟᱹᱞᱤᱭᱟᱹ ᱼᱟᱜ ᱢᱤᱫᱴᱟᱝ ᱵᱷᱩᱞ ᱛᱟᱦᱮᱸ ᱠᱟᱱᱟ ᱟᱨ ᱤᱧ ᱫᱩᱠᱷᱼᱤᱧ ᱥᱚᱫᱚᱨ ᱮᱫᱟ ᱡᱮ ᱟᱢ ᱟᱨᱦᱚᱸ ᱠᱚᱨ ᱮᱢᱚᱜ ᱠᱚ ᱢᱮᱛᱟᱢᱼᱟ ᱾,Santali,sad
5101,یہ سٹاک مارکیٹ کریش چھ پوٗرٕ پٲٹھۍ شرمناک تکیاز یہ ہیٚکہ ہا رکاونہٕ یتھ۔,Kashmiri,anger
9073,"ᱟᱢᱮᱢ ᱵᱟᱰᱟᱭ, ᱤᱧ ᱟᱭᱢᱟ ᱥᱮᱨᱢᱟ ᱠᱷᱚᱱ ᱢᱤᱫ ᱥᱚᱛ ᱜᱟᱦᱟᱠ ᱠᱟᱹᱱᱟᱹᱧ , ᱟᱨ ᱮᱱᱴᱮᱦᱚᱸ ᱡᱚᱠᱷᱚᱱ ᱤᱧ ᱠᱷᱚᱵᱚᱨ ᱠᱟᱜᱚᱡ ᱵᱟᱝ ᱮᱢ ᱦᱩᱭᱩᱜᱼᱟ ᱩᱱ ᱤᱧ ᱟᱹᱰᱤ ᱫᱷᱟᱣ ᱠᱩᱞᱤ ᱦᱩᱭᱩᱜ ᱛᱤᱧᱟᱹ ᱱᱚᱣᱟ ᱛᱮᱫᱚ ᱤᱧᱤᱧ ᱟᱹᱲᱤᱥᱚᱜᱼᱟ ᱾",Santali,anger
10567,سٹیجِكہِ مٲفی نہٕ دِنہٕ وٲلہِ جایہ گاشن باسنوو مے٘ زن بہٕ سخت تہٕ فٲصلہٕ ساز دوُر بینہِ تل اوسٗس ۔,Kashmiri,fear
727,ꯑꯩꯅ ꯉꯔꯥꯡ ꯂꯐꯣꯏ ꯑꯗꯨ ꯂꯩꯔꯛꯈꯤ ꯑꯗꯨꯕꯨ ꯃꯗꯨ ꯄꯠꯁꯤꯜꯂꯛꯈ꯭ꯔꯦ꯫,Manipuri,sad
10789,مےٚ چھ بیم ز یہ موسیقی ہیٚکہ میانہ خٲطرٕ واریاہ سخت ٲستھ تہٕ ہیکہ کیٚنٛہہ نا پسند یادٕ  وۄتلٲوِتھ۔,Kashmiri,fear
8853,ᱟᱢ ᱠᱤᱢ ᱧᱮᱞ ᱮᱫᱟ ᱡᱮ ᱢᱩᱪᱟᱹᱫ ᱠᱞᱟᱥ ᱛᱟᱭᱚᱢ ᱠᱞᱟᱥ ᱨᱩᱢ ᱫᱚ ᱛᱤᱱᱟᱹᱜ ᱦᱤᱨᱤᱡ ᱯᱟᱹᱥᱤᱨ ᱛᱟᱦᱮᱸ ᱠᱟᱱᱟ ? ᱱᱚᱣᱟᱫᱚ ᱟᱹᱰᱤ ᱜᱷᱤᱱᱟᱱ ᱜᱮᱭᱟ ᱾,Santali,disgust
9889,سایکل سٹورس منٛز زیٛادٕ قٲمتھ وٲلہِ سایکل ؤچھتھ گوٚو مے٘ میٛادس تلٗک پٮ۪ٹھ ۔ تمو کوٚرہس بہٕ بٮ۪مار۔,Kashmiri,disgust
11570,"ꯀꯝꯄꯅꯤ ꯑꯗꯨꯅ ꯁꯦꯟꯗꯣꯡ ꯑꯃ ꯐꯪꯂꯕꯁꯨ, ꯆꯍꯤ ꯑꯁꯤꯗ ꯑꯩꯒꯤ ꯆꯍꯤꯒꯤ ꯑꯣꯏꯕ ꯕꯣꯟꯁ ꯍꯟꯊꯔꯛꯄꯒꯤ ꯃꯇꯥꯡꯗ ꯑꯩ ꯌꯥꯝꯅ ꯊꯝꯃꯣꯏ ꯁꯣꯛꯏ꯫",Manipuri,sad
2000,ᱚᱱᱟ ᱢᱮᱭᱟᱫ ᱪᱟᱵᱟ ᱟᱠᱟᱱ ᱫᱟᱦᱮ ᱧᱩᱣᱟᱜ ᱡᱟᱦᱟᱸᱫᱚ ᱤᱧ ᱵᱟᱝ ᱦᱩᱫᱤᱥ ᱠᱟᱛᱤᱧ ᱧᱩ ᱞᱮᱫᱟ ᱚᱱᱟᱛᱮ ᱤᱧ ᱫᱚᱭᱚᱜ ᱤᱧ ᱠᱷᱚᱡ ᱠᱟᱱᱟ ᱾,Santali,disgust
11087,"ꯑꯩ ꯇꯁꯦꯡꯅ ꯁꯥꯎꯅꯤꯉꯉꯤ! ꯑꯩ ꯍꯣꯇꯦꯜꯗ ꯆꯪꯂꯛꯄꯗꯒꯤ ꯋꯥꯏ ꯐꯥꯏꯗ ꯁꯝꯅꯕ ꯍꯣꯠꯅꯔꯒ ꯂꯥꯛꯂꯤ, ꯑꯗꯨꯒ ꯑꯩꯅ ꯐꯪꯂꯤꯕ ꯑꯁꯤ ꯑꯦꯔꯔ ꯃꯦꯁꯦꯖꯁꯤꯡ ꯈꯛꯇꯅꯤ꯫ ꯃꯇꯤꯛ ꯆꯥꯕ ꯏꯟꯇꯔꯅꯦꯠ ꯁꯝꯕ ꯑꯃ ꯌꯥꯎꯗꯅ ꯊꯕꯛ ꯑꯃꯠꯇ ꯇꯧꯕ ꯅꯠꯇ꯭ꯔꯒ ꯄꯣꯊꯕ ꯐꯥꯎꯕ ꯑꯣꯏꯊꯣꯛꯇꯦ꯫",Manipuri,anger
3391,رولر کوسٹر تہٕ آبہٕ جولہٕ منٛزٕ اکھ دیو مےٚ کنۍ سٕے زٔنس ژارنہٕ، تہۍ ہیٚکو نہٕ میانہ باپت کانٛہہ تہٕ فیصلہٕ کٔرتھ،بوٚڈ نیٚچُو,Kashmiri,anger
11150,"ᱤᱧ ᱱᱚᱶᱟ ᱜᱚᱴᱟ ᱦᱟᱞᱚᱛ ᱛᱮ ᱠᱷᱟᱹᱛᱤᱨᱛᱮ ᱥᱟᱹᱨᱤᱜᱮᱧ ᱩᱫᱟᱹᱥ ᱟᱠᱟᱱᱟ ᱾ ᱤᱧᱟᱹᱜ ᱯᱮᱠᱮᱡ ᱥᱩᱢᱩᱝ ᱠᱷᱩᱛᱤ ᱠᱟᱛᱮᱜ ᱥᱮᱴᱮᱨ ᱟᱠᱟᱱᱟ ᱫᱚ ᱵᱟᱝ,ᱚᱱᱟᱫᱚ ᱞᱟᱦᱟ ᱨᱮᱦᱚᱸ ᱡᱷᱤᱡ ᱦᱩᱭ ᱟᱠᱟᱱᱟ ᱾",Santali,anger
10454,ٹورسٹ آپریٹر سٕنٛد طرفہٕ بک کرنہٕ آمتس ہوٹلس منٛز ٲسۍ کٹھۍ ؤٹلو سۭتۍ بٔرتھ۔,Kashmiri,disgust
6204,ᱤᱧ ᱡᱤᱱ ᱵᱤᱰᱟᱹᱣ ᱠᱷᱚᱱ ᱵᱟᱲᱟᱭ ᱛᱟᱭᱚᱢ ᱤᱧ ᱦᱟᱦᱟᱲᱟᱜ ᱩᱛᱟᱹᱨ ᱞᱤᱱᱟᱹᱧ ᱡᱮ ᱟᱞᱮᱭᱟᱜ ᱜᱷᱟᱸᱨᱚᱧᱡᱽ ᱫᱚ ᱒᱕᱐᱐᱐ ᱥᱮᱨᱢᱟ ᱞᱟᱦᱟ ᱥᱟᱭᱵᱮᱨᱤᱭᱟᱨ ᱨᱮᱭᱟᱜ ᱢᱟᱞᱴᱟ ᱵᱚᱭ ᱴᱷᱮᱱ ᱠᱷᱚᱱ ᱠᱚ ᱦᱮᱡ ᱟᱠᱟᱱᱟ ᱾,Santali,surprise
5352,ᱤᱧᱟᱹᱜ ᱵᱤᱱᱤᱭᱳᱜ ᱫᱚ ᱤᱧ ᱢᱤᱫᱴᱟᱝ ᱟᱨᱟᱢ ᱟᱱᱟᱜ ᱯᱮᱥᱤᱵᱷ ᱟᱨᱡᱟᱹᱣᱮ ᱮᱢ ᱟᱠᱟᱫᱟ ᱾,Santali,happy
10424,"ꯑꯩꯈꯣꯏꯅ ꯅꯍꯥꯛꯀꯤ ꯁꯣꯐ꯭ꯠ ꯁ꯭ꯀꯤꯜꯁꯤꯡ ꯑꯗꯨ ꯍꯦꯟꯅ ꯐꯒꯠꯍꯟꯅꯕ ꯃꯇꯝ ꯌꯥꯝꯅ ꯊꯥꯗꯈ꯭ꯔꯦ, ꯑꯗꯨꯒ ꯍꯧꯖꯤꯛꯇꯤ ꯅꯍꯥꯛꯅ ꯃꯁꯤꯒꯤ ꯍꯩꯁꯤꯡꯕ ꯑꯁꯤ ꯑꯇꯣꯞꯄ ꯃꯐꯝ ꯑꯃꯗ ꯁꯤꯖꯤꯟꯅꯕ ꯄꯥꯝꯂꯤꯕꯅꯤꯅꯦ ? ꯃꯁꯤ ꯌꯥꯝꯅ ꯁꯥꯎꯅꯤꯡꯉꯤ ꯫",Manipuri,anger
6493,حیرت انگیز! مےٚ اوس نہٕ از تام  پتاہ زِ بہٕ ہٮ۪کہ  ایئر پورٹ پٮ۪ٹھہٕ ترٔہن منٹن منٛز پنن گھرٕ وٲتتھ,Kashmiri,surprise
7500,"ꯑꯩꯍꯥꯛꯅ ꯍꯦꯜꯊ ꯁꯦꯟꯇꯔꯗ ꯑꯩꯍꯥꯛꯀꯤ ꯍꯛꯆꯥꯡꯒ ꯃꯔꯤ ꯂꯩꯅꯕ ꯃꯊꯧ ꯇꯥꯕ ꯃꯤꯠꯌꯦꯡ ꯆꯪꯕꯤꯔꯛꯅꯕ ꯍꯣꯠꯅꯔꯤ, ꯑꯃꯁꯨꯡ ꯑꯩꯍꯥꯛꯀꯤ ꯍꯛꯁꯦꯜꯒꯤ ꯃꯇꯥꯡꯗ ꯂꯨꯅ ꯂꯧꯕꯤꯗꯕꯒꯨꯝ ꯑꯩꯉꯣꯟꯗ ꯐꯥꯎꯋꯤ ꯫",Manipuri,sad
6973,ᱤᱧᱨᱮᱱ ᱜᱤᱫᱽᱨᱟ ᱟᱹᱰᱤ ᱰᱷᱮᱨ ᱫᱚ ᱯᱷᱩᱴᱵᱚᱞ ᱵᱟᱭ ᱞᱷᱮᱞᱚᱰᱟ ᱢᱮᱱᱠᱷᱟᱱ ᱠᱷᱮᱞᱚᱰ ᱵᱟᱵᱚᱫᱛᱮ ᱩᱱᱤ ᱡᱟᱦᱟ ᱛᱤᱱᱟᱹᱜ ᱜᱮᱭᱟᱱᱮ ᱩᱫᱩᱜᱟ ᱚᱱᱟᱛᱮ ᱤᱧᱤᱧ ᱪᱚᱢᱠᱟᱣ ᱟᱠᱟᱱᱟ ᱾,Santali,surprise
6641,ᱤᱧ ᱡᱚᱠᱷᱮᱡ ᱢᱤᱫᱴᱟᱝ ᱵᱟᱝ ᱧᱟᱢᱚᱜ ᱢᱟᱨᱮᱱ ᱡᱤᱱᱤᱥ ᱴᱷᱤᱠ ᱥᱟᱹᱦᱤᱡ ᱜᱚᱱᱚᱝ ᱛᱮᱧ ᱟᱹᱠᱷᱨᱤᱧ ᱠᱮᱫ ᱠᱷᱟᱱ ᱤᱧ ᱟᱹᱰᱤᱧ ᱠᱩᱥᱤᱭᱮᱱᱟ ᱾,Santali,happy
3095,ꯃꯃꯜ ꯑꯗꯨ ꯂꯨꯄꯥ ꯀꯨꯟ ꯍꯟꯊꯍꯟꯅꯕ ꯂꯥꯏꯔꯕ ꯄꯣꯠ ꯌꯣꯟꯕ ꯑꯃꯒ ꯃꯟꯇꯤꯛꯅꯈꯤꯕ ꯃꯇꯨꯡꯗ ꯑꯩꯒꯤ ꯃꯔꯤ ꯃꯇꯥꯗ ꯌꯥꯝꯅ ꯁꯥꯎꯈꯤ꯫,Manipuri,anger
1577,ꯏꯂꯦꯛꯇ꯭ꯔꯤꯁꯤꯇꯤ ꯕꯣꯔꯗꯀꯤ ꯁꯤꯟꯃꯤꯁꯤꯡ ꯑꯗꯨꯅ ꯂꯩꯃꯥꯏꯗꯒꯤ ꯐꯤꯠ ꯌꯥꯡꯈꯩ ꯋꯥꯡꯅ ꯂꯩꯕ ꯄ꯭ꯂꯦꯠꯐꯣꯔꯝ ꯑꯃꯗ ꯌꯥꯝꯅ ꯆꯦꯛꯁꯤꯟꯅ ꯆꯠꯄ ꯎꯔꯨꯕꯗꯒꯤ ꯑꯩ ꯇꯔꯪ ꯆꯠꯈꯤ꯫,Manipuri,fear
5738,ꯑꯩꯍꯥꯛ ꯈꯡꯉꯦ ꯫ ꯑꯗꯣ ꯑꯩꯗꯤ ꯉꯛꯏ ! ꯅꯍꯥꯛꯅ ꯑꯦꯀꯥꯎꯟꯠ ꯑꯗꯨ ꯀꯔꯤꯒꯤꯗꯃꯛꯇ ꯀ꯭ꯂꯣꯁ ꯇꯧꯅꯕꯒꯤ ꯋꯥꯔꯦꯞ ꯂꯧꯔꯤꯕꯅꯣ ꯍꯥꯏꯅ ꯑꯩꯍꯥꯛꯅ ꯑꯃꯨꯛꯇ ꯍꯪꯖꯕ ꯌꯥꯒꯗ꯭ꯔꯥ꯫,Manipuri,surprise
7554,مےٚ چھ سٹاک مارکیٹک ببل کہِ  امکان كِنہِ ہنا فرتھ ہِیوٗ ۔,Kashmiri,fear
1005,ꯑꯩꯈꯣꯏꯒꯤ ꯂꯂꯣꯟ ꯏꯇꯤꯛꯇ ꯑꯀꯥꯏꯕ ꯄꯤꯒꯗꯕ ꯏꯔꯥꯡꯁꯤꯡ ꯊꯣꯛꯍꯟꯅꯕ ꯂꯩꯉꯥꯛꯂꯣꯟ ꯑꯁꯤ ꯀꯥꯡꯂꯨꯞꯀꯤ ꯋꯥꯊꯣꯛꯀ ꯌꯥꯟꯁꯤꯟꯅꯕꯒꯤ ꯃꯇꯥꯡꯗ ꯑꯩꯍꯥꯛꯅ ꯅꯨꯡꯅꯥꯡꯕ ꯐꯥꯎꯢ꯫,Manipuri,fear
6568,جگن ہیوک نہٕ پنٗن جوش رٗكٲوِتھ  ییلہٕ تمۍ سٕندۍ   ٹیمن ٲخٕری منٹس منٛز گول کوٚر ۔,Kashmiri,happy
3852,منیجر درٛاو تمہ وزِ مینٛگن میٔژ بٔرتھ ییٚلہ أمۍ سٕنٛدۍ ٹیمن کمپنی ہندس قیادتس پیش کرنہٕ برٛۄنٛہہ اکھ خراب پراجیکٹ رپورٹ پیش کوٚر۔,Kashmiri,anger
2021,گرِ ہٗند ٹِك ٹِك چھٗ لگاتار گٗزروٗن مِنٹ یاد پاوان ۔,Kashmiri,fear
9988,اکھ زنانہٕ یوسہٕ ماسٹرس ڈگری خٲطرٕ امریکہ گیہ ، سڑکن پیٹھ فاقہ کشی كران وٗچھِنۍ اوس وودٲسۍ كران ۔,Kashmiri,sad
10364,تہنٛدس دکانس منٛز چِھنہٕ تم چیز زانہہ آسان یمن ہُند مےٚ ساروی کھوتہٕ زیادٕ ضرورت چھُ۔  یِہ چھ مےٚ تکلیف دوان۔,Kashmiri,anger
11860,ꯃꯣꯗ꯭ꯌꯨꯂꯔ ꯀꯤꯆꯟ ꯑꯁꯤꯒꯤ ꯑꯔꯣꯏꯕ ꯃꯑꯣꯡ ꯑꯁꯤ ꯑꯩꯅ ꯑꯣꯏꯍꯟꯅꯤꯡꯕꯒ ꯆꯥꯟꯅꯔꯣꯏ ꯑꯃꯁꯨꯡ ꯑꯩꯅ ꯑꯩꯒꯤ ꯄꯥꯝꯖꯕ ꯅꯠꯇ꯭ꯔꯒ ꯃꯊꯧ ꯇꯥꯕꯒ ꯆꯥꯟꯅꯗꯕ ꯀꯔꯤꯒꯨꯝꯕ ꯑꯃ ꯑꯣꯏꯅ ꯐꯪꯒꯅꯤ ꯍꯥꯏꯅ ꯑꯩꯉꯣꯟꯗ ꯄꯨꯛꯅꯤꯡꯗ ꯐꯥꯎꯕ ꯑꯃ ꯂꯩ꯫,Manipuri,fear
7187,ییٚلہ سون ہمسایہ گریلوچیزن    ہُند دٗکان کاربار نہ آسنہٕ کنہ بنٛد گوٚو مےٚ پھٗٹ دل ۔,Kashmiri,sad
6994,ꯃꯐꯝ ꯑꯗꯨꯕꯨ ꯁꯨꯝꯍꯠꯅꯤꯡꯉꯥꯏ ꯑꯣꯏꯕ ꯃꯐꯝ ꯑꯃꯗ ꯇꯁꯦꯡꯅ ꯑꯣꯟꯊꯣꯛꯈꯤꯕ ꯊꯧꯔꯝ ꯑꯗꯨꯒꯤ ꯊꯤꯝ ꯑꯗꯨꯗ ꯏꯚꯦꯟꯠ ꯃꯦꯅꯦꯖꯔ ꯑꯗꯨꯒꯤ  ꯀ꯭ꯔꯤꯑꯦꯇꯤꯕ ꯑꯣꯏꯕ ꯃꯑꯣꯡ ꯃꯇꯧ ꯑꯗꯨ ꯑꯩ ꯌꯥꯝꯅ ꯄꯥꯝꯖꯈꯤ꯫,Manipuri,happy
3813,ꯀꯔꯤꯒꯨꯝꯕ ꯑꯩꯅ ꯑꯩꯒꯤ ꯑꯥꯙꯥꯔ ꯀꯥꯔ꯭ꯗ ꯄꯤꯗ꯭ꯔꯕꯗꯤ ꯃꯍꯥꯛꯅ ꯑꯩꯒꯤ ꯑꯦꯄ꯭ꯂꯤꯀꯦꯁꯟ ꯑꯗꯨ ꯄ꯭ꯔꯣꯁꯦꯁ ꯇꯧꯔꯣꯏ ꯍꯥꯏꯅ ꯑꯣꯐꯤꯁꯤꯌꯦꯜ ꯑꯗꯨꯅ ꯍꯥꯏꯈꯤ꯫ ꯑꯩ ꯍꯌꯦꯡ ꯍꯟꯅ ꯂꯥꯛꯄ ꯇꯥꯏ꯫,Manipuri,sad
330,ᱫᱤᱱ ᱠᱮ ᱫᱤᱱ ᱱᱚᱸᱰᱮ ᱡᱚᱢᱟᱜ ᱫᱚ ᱵᱟᱹᱲᱤᱡᱚᱜ ᱠᱟᱱᱟ ᱾ ᱤᱧ ᱫᱚ ᱟᱨ  ᱵᱟᱹᱧ ᱥᱟᱦᱟᱣ ᱫᱟᱲᱮᱭᱟᱜ ᱠᱟᱱᱟ ᱟᱨ ᱠᱟᱹᱢᱤᱭᱟᱹ ᱢᱩᱠᱷᱭᱟᱹ ᱠᱚ ᱴᱷᱮᱱ ᱨᱤᱯᱳᱨᱴ ᱮᱢᱚᱜ ᱞᱟᱹᱜᱤᱫᱚᱜ ᱠᱟᱹᱱᱟᱹᱧ ᱾,Santali,anger
5813,ریسٹورانٹ کس کچنس منز صفایی ہنٛز کٔمی وچھِتھ گوس بہٕ سیٹھاہ پریشان۔ گندٕ بانہٕ تہٕ ملٕتۍ کاؤنٹر وٕچھن چھ سیدِ سیود ناقابل قبول۔,Kashmiri,anger
11203,بہٕ گوس فرانسس منٛز أکِس ٹیمَس سۭتۍ فٹ بال ٹورنامنٹ زیننہٕ پتہٕ سیٹھاہ خوش ییتِہ بہٕ گول کیپر اوسُس ۔,Kashmiri,happy
10924,ᱟᱢ ᱞᱮᱠᱟᱱ ᱩᱫᱜᱟᱹᱣᱟᱱ ᱟᱨ ᱠᱟᱛᱷᱟ ᱫᱚᱦᱚᱣᱟᱱ ᱟᱹᱥᱩᱞ ᱡᱤᱭᱟᱹᱞᱤ ᱠᱚᱨᱮᱱ ᱢᱟᱹᱞᱤᱠ ᱠᱚ ᱥᱟᱶ ᱠᱟᱹᱢᱤᱭ ᱫᱚ ᱥᱟᱱᱟᱢ ᱚᱠᱛᱚ ᱜᱮ ᱨᱟᱹᱥᱠᱟᱹᱣᱟᱱᱟᱜ ᱠᱟᱱᱟ ᱾,Santali,happy
6352,ᱵᱤᱠᱨᱚᱢ ! ᱛᱮᱦᱮᱧ ᱟᱢ ᱫᱚ ᱩᱥᱩᱞ ᱯᱤᱸᱰᱟᱹ ᱨᱮ ᱟᱹᱰᱤ ᱯᱟᱹᱛᱭᱟᱹᱣ ᱥᱟᱞᱟᱜ ᱠᱟᱛᱷᱟᱢ ᱨᱚᱲ ᱠᱮᱫᱟ !,Santali,surprise
10637,ᱤᱧᱟᱜ ᱴᱷᱤᱠᱟᱹᱱ ᱵᱟᱹᱱᱩᱧᱟ ᱡᱮ ᱤᱧ ᱟᱢᱤᱧ ᱜᱚᱲᱚ ᱫᱟᱲᱮ ᱟᱢᱟ ᱡᱩᱫᱤ ᱟᱢ ᱟᱯᱱᱟᱨ ᱛᱮ ᱜᱚᱲᱚ ᱮᱢ ᱵᱟᱢ ᱠᱩᱥᱤᱭᱟᱜ ᱠᱷᱟᱱ ᱾,Santali,disgust
5614,ᱤᱧ ᱵᱟᱹᱧ ᱥᱟᱦᱟᱣ ᱫᱟᱲᱮᱭᱟᱜᱼᱟ ᱡᱮ ᱩᱱᱠᱩ ᱪᱮᱫᱞᱮᱠᱟ ᱠᱟᱛᱮ ᱵᱤᱨᱤᱫ ᱨᱮᱭᱟᱜ ᱞᱟᱵᱷ ᱞᱟᱹᱜᱤᱫ ᱞᱟᱭᱚᱝ ᱟᱱᱟᱜ ᱟᱹᱱ ᱠᱚᱠᱚ ᱰᱷᱤᱞᱟᱹᱣ ᱟᱠᱟᱫᱟ ᱾,Santali,anger
1543,مےٚ کھیٚیہ پٔتۍمہِ ہفتہٕ ریستورانس منٛز پنٕنۍ پسندیدٕ کٲج ضیافت، تہٕ امہ سۭتۍ میول مےٚ مزٕ۔,Kashmiri,happy
869,ᱤᱧ ᱵᱷᱟᱹᱲᱩᱢᱵᱟᱜ ᱮᱱᱟ ᱡᱮ ᱱᱚᱶᱟ ᱠᱚᱢᱮᱱᱴ ᱫᱚ ᱦᱚᱲᱠᱚ ᱩᱫᱩᱜ ᱞᱟᱹᱜᱤᱫ ᱟᱲᱟᱜ ᱦᱩᱭ ᱟᱠᱟᱱᱟ ᱡᱟᱦᱟᱨᱮ ᱵᱟᱹᱲᱛᱤ ᱱᱤᱨᱚᱲ ᱠᱚᱢᱮᱱᱴ ᱠᱚ ᱞᱚᱜᱚᱱ ᱢᱩᱪᱷᱟᱹᱣ ᱜᱤᱰᱤ ᱦᱩᱭᱟᱠᱟᱱᱟ ᱾,Santali,surprise
4472,حالانکہ ڈرائیونگ سکولن کوٚر اضٲفی سبق  تجویز، گندٕ ڈرائیونگ  سایمولیٹر  اوس  بغاوتس لایق ۔,Kashmiri,disgust
9648,"ꯀꯁꯇꯃꯔ ꯑꯃꯕꯨ ꯃꯈꯣꯏꯒꯤ ꯐꯤꯔꯣꯜ ꯑꯗꯨ ꯃꯄꯨꯡ ꯐꯥꯍꯟꯅꯕ ꯆꯠꯆꯕ ꯑꯦꯛꯁꯦꯁꯔꯤ ꯑꯗꯨ ꯊꯤꯕꯗ ꯑꯩꯅ ꯃꯇꯦꯡ ꯄꯥꯡꯈꯤ, ꯑꯃꯁꯨꯡ ꯄꯦꯟꯕ ꯐꯥꯎꯈꯤ꯫",Manipuri,happy
7411,ᱤᱧ ᱫᱚ ᱩᱱᱤ  ᱨᱟᱹᱥᱠᱟᱹᱛᱮ ᱰᱟᱦᱟᱨ ᱨᱮ ᱮᱱᱮᱡ ᱤᱧ ᱧᱮᱞ ᱟᱠᱟᱫᱮᱭᱟ ᱾,Santali,happy
10287,ییٚلہ مے٘ ڈنر خٲطرٕ تازٕ سبزی انٕنۍ مشِتھ گیہ بہٕ گوس مویوُس ۔,Kashmiri,sad
1369,بہٕ کر واتہٕ پننس منزلس تام؟ یہ میٹنگ کرِ میانِہ مستقبلک فیصلہٕ۔,Kashmiri,fear
10760,ᱤᱧᱫᱚ ᱤᱥᱤᱱ ᱚᱲᱟᱜ ᱨᱮ ᱪᱟᱹᱯᱲᱤ ᱧᱮᱞ ᱠᱟᱛᱤᱧ ᱦᱟᱦᱟᱲᱟᱜ ᱞᱮᱱᱟ ᱡᱚᱠᱷᱚᱱ ᱠᱟᱹᱢᱤᱭᱟᱹ ᱠᱚ ᱢᱚᱰᱩᱞᱟ ᱤᱥᱤᱱ ᱚᱲᱟᱜ ᱪᱟᱹᱞᱩᱭ ᱞᱟᱹᱜᱤᱫ ᱛᱮ ᱚᱸᱰᱮ ᱢᱮᱱᱟᱜ ᱟᱞᱢᱟᱨᱤᱠᱚ ᱨᱟᱹᱯᱩᱫ ᱞᱮᱫᱟ ᱾,Santali,surprise
2989,ꯑꯌꯥ ꯅꯠꯇꯤꯌꯦ... ꯆꯥꯟꯕꯤꯗꯨꯅ ꯑꯩꯈꯣꯏꯗ ꯂꯩꯕꯤꯌꯨ ꯑꯃꯁꯨꯡ ꯅꯍꯥꯛꯅ ꯂꯩꯕꯗ ꯍꯦꯟꯅ ꯅꯨꯡꯉꯥꯏꯍꯟꯅꯕ  ꯑꯩꯈꯣꯏꯗ ꯈꯨꯗꯣꯡꯆꯥꯕ ꯑꯗꯨ ꯄꯤꯕꯤꯌꯨ꯫,Manipuri,fear
5820,بہٕ چھس مانان ز مےٚ چھےٚ گرس منٛز سی سی ٹی وی کیمرا انسٹال نہٕ کٔرتھ غلطی کٔرمٕژ تہٕ بہٕ چھس وۄنۍ امیک خمیازٕہ  تُلان ،شہری,Kashmiri,sad
9469,ᱵᱟᱝ ᱥᱤᱜᱤᱞᱟᱱ ᱨᱮᱭᱟᱜ ᱩᱭᱦᱟᱹᱨ ᱤᱧ ᱞᱟᱹᱜᱤᱫ ᱥᱟᱱᱟᱢᱟᱜ ᱛᱮ ᱵᱟᱹᱲᱤᱡ ᱜᱮᱭᱟ ᱟᱨ ᱚᱱᱟ ᱚᱠᱛᱮ ᱜᱮ ᱤᱧ ᱤᱧ ᱪᱮᱛᱟᱱᱤᱧ ᱟᱹᱲᱤᱥ ᱡᱚᱝᱼᱟ ᱾,Santali,disgust
2384,کوچ سند ٹیمس پیٹھ نظم و ضبط تہٕ قابوٗوچ کمی چھ قابل نفرت۔,Kashmiri,disgust
11251,ꯀꯩꯊꯦꯜꯗ ꯕꯥꯏꯖꯨꯒꯤ ꯑꯃꯥꯡꯕꯁꯤꯡ ꯑꯗꯨꯅ ꯍꯣꯗꯣꯛꯂꯤꯕ ꯃꯤꯑꯣꯢ ꯑꯗꯨꯕꯨ ꯇꯥꯎꯟꯍꯣꯜ ꯃꯤꯐꯝ ꯑꯃꯗ ꯐꯝꯕꯥꯛꯇ ꯐꯣꯡꯅ ꯀꯥꯞꯍꯟꯈꯤ꯫,Manipuri,sad
