id,Sentence,language,emotion
11723,ꯃꯊꯧ ꯇꯥꯗꯕ ꯕꯦꯡꯛꯀꯤ ꯐꯤꯁꯤꯡꯗ ꯆꯥꯗꯤꯡ ꯇꯧꯈꯤꯕ ꯁꯦꯟꯐꯝ ꯑꯗꯨꯅ ꯑꯩꯍꯥꯛꯄꯨ ꯌꯥꯝꯅ ꯉꯛꯍꯜꯂꯤ ꯫,Manipuri,surprise
1555,ꯅꯍꯥꯛꯅ ꯑꯩꯕꯨ  ꯀꯛꯊꯠꯄꯒꯤ ꯍꯩꯅꯕꯤ ꯑꯁꯤꯅ ꯑꯩꯈꯣꯏꯒꯤ ꯃꯔꯤꯗ ꯑꯀꯥꯏꯕ ꯄꯤꯔꯤ ꯍꯥꯏꯕꯁꯤ ꯀꯃꯥꯏꯅ ꯅꯍꯥꯛꯅ ꯎꯗ꯭ꯔꯤꯅꯣ  ꯍꯥꯏꯕꯗꯨ ꯑꯩ ꯈꯪꯅꯕ ꯍꯣꯠꯅꯕꯗ ꯑꯔꯨꯕ ꯑꯣꯏ ꯫,Manipuri,surprise
8612,ꯑꯩꯅ ꯇ꯭ꯔꯥꯐꯤꯛꯇ ꯂꯦꯞꯄ ꯃꯇꯝꯈꯨꯗꯤꯡꯗ ꯇꯨꯡꯗ ꯆꯦꯟꯅꯥꯏ ꯁꯤꯇꯤ ꯕꯁ ꯑꯃ  ꯈꯥꯝꯗꯨꯅ  ꯂꯩꯔꯝꯕꯗ ꯑꯩ ꯀꯤꯕ ꯐꯥꯎꯏ꯫ ꯍꯥꯏꯔꯤꯕ ꯕꯁꯁꯤꯡ ꯑꯁꯤꯒꯤ ꯕ꯭ꯔꯦꯛ ꯌꯥꯝꯅ ꯌꯥꯎꯒꯟꯗꯦ꯫,Manipuri,fear
1912,ᱟᱞᱮ ᱵᱤᱡᱽᱞᱤ ᱪᱟᱹᱞᱩ ᱫᱚᱦᱚᱭ ᱞᱟᱹᱜᱤᱫ ᱡᱚᱛᱷᱟᱛ ᱞᱮ ᱨᱤᱠᱟᱹ ᱮᱫᱟ ᱢᱮᱱᱠᱷᱟᱱ ᱥᱚᱨᱠᱟᱨ ᱱᱟᱶᱟ ᱡᱚᱱᱛᱚᱨᱼᱯᱟᱹᱛᱤ ᱨᱮ ᱥᱟᱹᱠᱭᱟᱹᱛ ᱮᱢᱚᱜ ᱵᱟᱭ ᱨᱮᱵᱮᱱ ᱠᱟᱱᱟ ᱾,Santali,disgust
1099,امہ کرایہ مکانک  پہاڑن ہنٛد نظارٕ وچھِتھ چھُس بہ حیرتن ۔ یہ چھٗ نہایت خوبصورت!,Kashmiri,surprise
1321,بولن وٲلِس ووت  تمہِ سندِس تقریرس دوران   منتظمینو دٕسہِ تمہِ سندِس تقریرس دوران مایك بند كرنس پیٹھ صدمہٕ ۔,Kashmiri,surprise
5111,ᱠᱤᱪᱷᱩ ᱴᱤᱵᱷᱤ ᱥᱤᱨᱤᱭᱟᱞ ᱱᱩᱱᱟᱹᱜ ᱵᱟᱹᱲᱤᱡᱟ ᱟᱨ ᱛᱟᱭᱚᱢ ᱯᱟᱸᱡᱟᱣᱟᱱᱼᱟ ᱮᱱᱛᱮᱦᱚᱸ ᱦᱚᱲ ᱚᱱᱟ ᱠᱚ ᱧᱮᱞᱟ ᱾,Santali,disgust
6837,گارڈن ووٚن ز از چھ کم برٕ۔ توے دیہ سہ اسہ ییٚتہ زیٛادٕ کالس روزنہٕ۔,Kashmiri,happy
11161,بہٕ چھس ہمیشہٕ پننس پتۍمہ پاسہ ٲنس وٕچھان روزان، خاص طور ییٚلہ مےٚ پتہٕ شہر بس آسہ۔ تمن چھ مشکلن بریک آسان۔,Kashmiri,fear
494,بہٕ چھس امہ سۭتۍ خۄش گژھان ز طٲلب علم چھ وٕنہ تہ مےٚ نش توقع تھوان تکیازِ بہ چھُس تہنز راے تسلیم کران۔,Kashmiri,happy
4632,"ᱦᱚᱭᱫᱟᱜ ᱚᱠᱛᱚ, ᱢᱤᱫᱴᱟᱝ ᱢᱟᱨᱟᱝ ᱫᱟᱨᱮ ᱵᱷᱤᱸᱫᱟᱹᱲ ᱮᱱᱟ, ᱡᱟᱦᱟᱸᱛᱮ ᱤᱧᱟᱹᱜ ᱚᱲᱟᱜ ᱢᱩᱥᱠᱤᱞ ᱛᱮ ᱵᱟᱧᱪᱟᱣ ᱮᱱᱟ ᱟᱨ ᱤᱧ  ᱵᱚᱛᱚᱨ ᱨᱮᱭᱟᱜ  ᱜᱟᱹᱦᱤᱨ ᱵᱷᱟᱵᱱᱟᱛᱮᱭ ᱯᱮᱨᱮᱡ ᱠᱤᱫᱤᱧᱟ ᱾",Santali,fear
6670,ꯌꯨ.ꯀꯦ.ꯗ ꯂꯩꯕ ꯂꯥꯏꯁꯪꯁꯤꯡꯒꯤ ꯃꯄꯥꯟꯗ ꯍꯤꯟꯗꯨꯁꯤꯡꯒꯤ ꯃꯥꯌꯣꯛꯇ ꯇꯝꯊꯤꯕ ꯏꯍꯧ ꯆꯠꯊꯕ ꯑꯁꯤ ꯈꯨꯗꯛꯇ ꯊꯤꯡꯕ ꯃꯊꯧ ꯇꯥꯏ ꯫,Manipuri,anger
4560,ꯃꯁꯤꯒꯤ ꯃꯌꯦꯛ ꯆꯪꯕ ꯁꯅꯥꯒꯤ ꯈꯨꯖꯤ ꯑꯁꯤ ꯄꯨꯛꯅꯤꯡ ꯁꯨꯝꯍꯠꯅꯤꯉꯥꯏ ꯑꯣꯏꯕꯇ ꯅꯠꯇꯅ ꯑꯩꯒꯤ ꯕꯗꯖꯦꯠꯀꯤ ꯃꯅꯨꯡꯗꯁꯨ ꯆꯞ ꯆꯥꯏ꯫,Manipuri,happy
10811,ᱯᱩᱛᱷᱤ ᱟᱠᱷᱨᱤᱧᱤᱡ ᱡᱟᱦᱟ ᱞᱮᱠᱟ ᱟᱡᱟᱜ ᱫᱳᱠᱟᱱ ᱨᱮ ᱛᱤᱨᱞᱟᱹ ᱠᱚ ᱥᱟᱣ ᱵᱟᱹᱲᱤᱡᱼᱮ ᱵᱮᱣᱦᱟᱨᱮᱫ ᱛᱟᱦᱮᱸᱜᱼᱟ ᱚᱱᱟᱛᱮ ᱤᱧ ᱵᱷᱟᱜᱮ ᱵᱟᱹᱧ ᱵᱩᱡᱷᱟᱹᱣ ᱮᱫ ᱛᱟᱦᱮᱸᱜᱼᱟ ᱾,Santali,disgust
5880,ꯂꯩꯕꯥꯛ ꯈꯔꯗ ꯂꯩꯉꯥꯛꯅ ꯇꯣꯜꯂꯤꯕ ꯁꯦꯟꯗꯣꯟꯒꯤ ꯆꯥꯡ ꯑꯁꯤꯗ ꯑꯩꯍꯥꯛ ꯄꯨꯡꯉꯛ ꯉꯛꯈꯤ ꯫,Manipuri,surprise
7244,ᱱᱚᱶᱟ ᱫᱚ ᱞᱟᱡᱟᱣ ᱟᱱᱟᱜ ᱠᱟᱱᱟ ᱡᱮ ᱛᱷᱟᱹᱱᱤᱛ ᱡᱟᱹᱫᱩ ᱚᱲᱟᱜ ᱩᱫᱩᱜ ᱥᱚᱫᱚᱨ ᱞᱟᱹᱜᱤᱫ ᱡᱟᱦᱟᱱ ᱤᱝᱨᱮᱡᱤ ᱛᱚᱨᱡᱚᱢᱟ ᱵᱟᱝ ᱛᱟᱦᱮᱸ ᱠᱟᱱᱟ ᱾,Santali,sad
2562,ꯂꯝꯕꯤꯁꯤꯡꯗ ꯊꯧꯔꯝ ꯄꯥꯡꯊꯣꯛꯈꯤꯕ ꯑꯃꯁꯨꯡ ꯑꯇꯤꯡꯕ ꯊꯧꯔꯤ ꯑꯗꯨꯗ ꯏꯔꯥꯏ ꯂꯥꯏꯅ ꯆꯠꯈꯤꯕ ꯑꯄꯤꯛꯄ ꯅꯨꯄꯤꯃꯆꯥ ꯑꯗꯨꯗ ꯑꯩꯕꯨ ꯌꯥꯝꯅ ꯉꯛꯍꯟꯈꯤ꯫,Manipuri,surprise
1670,ꯑꯩꯒꯤ ꯀꯥꯔꯒꯤꯗꯃꯛ ꯃꯦꯀꯥꯅꯤꯛꯅ ꯁꯦꯝꯗꯣꯛ ꯁꯦꯝꯖꯤꯟ ꯇꯧꯅꯕꯒꯤ ꯄꯥꯎꯇꯥꯛꯁꯤꯡ ꯑꯗꯨꯗ ꯑꯩ ꯌꯥꯝꯅ ꯅꯨꯡꯉꯥꯏꯔꯦ꯫ ꯍꯧꯖꯤꯛꯇꯤ ꯃꯁꯤꯒꯤ ꯑꯩꯉꯣꯟꯗ ꯃꯄꯨꯡꯐꯥꯅ ꯆꯨꯅꯕ ꯇꯣꯞꯇꯣꯞꯄ ꯃꯒꯨꯟ ꯑꯃ ꯂꯩꯔꯦ꯫,Manipuri,happy
767,بیرٕ بارٕ وٲلِس بازرس  منز دہشت ناک  کریکو کر  ژلہ لار  پیدٕہ تکیازِ لوکھ ٲسۍ امہ افراتفری نشہ زُو بچاوُن یژھان۔,Kashmiri,fear
8390,ꯑꯩꯅ ꯑꯩꯈꯣꯏꯒꯤ ꯍꯤꯟꯗꯨ ꯂꯥꯏꯅꯤꯡꯒꯤ ꯏꯄꯥ ꯏꯄꯨꯁꯤꯡꯅ ꯃꯤꯖꯥꯔ ꯑꯃꯁꯨꯡ ꯑꯜꯀꯣꯔꯕꯨ ꯊꯋꯥꯟꯃꯤꯆꯥꯛ ꯖꯨꯔꯥ ꯑꯣꯏꯅ ꯈꯪꯂꯝꯕꯗ ꯑꯃꯁꯨꯡ ꯃꯈꯣꯏꯕꯨ ꯂꯨꯍꯣꯡꯂꯕ ꯃꯇꯩ ꯃꯅꯥꯎꯁꯤꯡꯗ ꯊꯤꯟꯗꯨꯅ ꯇꯥꯛꯂꯝꯕꯒꯤ ꯑꯆꯨꯝꯕ ꯑꯁꯤꯗ ꯑꯉꯛꯄ ꯐꯥꯎꯏ ꯫,Manipuri,surprise
5728,ꯑꯩ ꯋꯥ ꯉꯥꯡꯕ ꯌꯥꯒꯗ꯭ꯔꯥ?,Manipuri,anger
2652,"ᱤᱧ ᱱᱚᱣᱟ ᱵᱟᱰᱟᱭ ᱠᱟᱛᱮᱜ ᱥᱩᱠ ᱤᱧ ᱵᱩᱡᱷᱟᱹᱣᱟ ᱡᱮ ᱤᱧ ᱯᱚᱨᱟᱢᱚᱥ ᱛᱟᱞᱟᱛᱮ, ᱤᱧ ᱤᱧᱟᱹᱜ ᱪᱟᱯ ᱟᱨ ᱪᱤᱱᱛᱟᱹᱧ ᱠᱚ ᱥᱟᱢᱲᱟᱣ ᱨᱮᱭᱟᱜ ᱮᱥᱮᱨᱟᱱ ᱦᱚᱨᱟ ᱠᱚᱧ ᱪᱮᱫ ᱮᱫᱟ ᱾",Santali,happy
2663,ᱱᱟᱣᱟ ᱵᱮᱱᱟᱣ ᱯᱟᱱᱛᱷᱟ ᱨᱮᱭᱟᱜ  ᱦᱩᱭᱫᱟᱲᱮᱭᱟᱜ ᱥᱟᱪᱟᱨᱤᱭᱟᱹ ᱚᱨᱥᱚᱝ ᱟᱵᱚ ᱞᱟᱹᱜᱤᱫ ᱪᱤᱱᱛᱟᱹ ᱨᱮᱭᱟᱜ ᱢᱤᱫ ᱢᱩᱲᱩᱫ ᱯᱷᱮᱰᱟᱛ ᱠᱟᱱᱟ ᱾,Santali,fear
11129,ᱤᱧ ᱟᱹᱰᱤᱧ ᱨᱟᱹᱥᱠᱟᱹᱜ ᱠᱟᱱᱟ ᱡᱮ ᱤᱧᱨᱮᱱ ᱠᱚᱲᱟ ᱜᱤᱫᱽᱨᱟᱹ ᱛᱮᱦᱮᱧ ᱟᱭᱟᱜ ᱰᱨᱟᱭᱵᱷᱤᱝ ᱞᱟᱭᱥᱮᱱᱥ ᱧᱟᱢ ᱟᱠᱟᱫᱟ ᱟᱨ ᱱᱤᱛ ᱩᱱᱤ ᱯᱷᱩᱨᱜᱟᱹᱞ ᱥᱟᱹᱦᱤᱡ ᱜᱟᱹᱰᱤᱭ ᱪᱟᱹᱞᱩ ᱫᱟᱲᱮᱭᱟᱜᱼᱟ ᱾,Santali,happy
11309,ᱱᱚᱶᱟ ᱫᱚ ᱤᱧᱮ ᱵᱷᱟᱵᱱᱟ ᱦᱚᱪᱚ ᱤᱧᱟᱹ ᱡᱮ ᱟᱭᱢᱟ ᱫᱤᱱ ᱠᱷᱚᱱᱟᱜ ᱡᱟᱦᱟᱸ ᱯᱚᱛᱚᱵ ᱤᱧ ᱛᱚᱞᱟᱥ ᱮᱫ ᱠᱟᱱ ᱛᱟᱦᱮᱸ ᱚᱱᱟ ᱫᱚ ᱱᱚᱶᱟ ᱫᱚᱠᱟᱱ ᱨᱮ ᱦᱚᱸ ᱵᱟᱝ ᱧᱟᱢᱚᱜ ᱠᱟᱱᱟ ᱾,Santali,sad
11748,ᱤᱧ ᱤᱧᱟᱹᱜ ᱜᱟᱹᱰᱤ ᱞᱟᱹᱜᱤᱫ ᱢᱮᱠᱟᱱᱤᱠ ᱟᱜ ᱵᱚᱱᱚᱫᱚᱞ ᱨᱮᱭᱟᱜ ᱯᱚᱨᱟᱢᱚᱥ ᱛᱮᱧ ᱪᱚᱢᱠᱟᱣ ᱟᱠᱟᱱᱟ  ᱾ ᱱᱤᱛ ᱱᱚᱣᱟ ᱨᱮᱭᱟᱜ ᱢᱤᱫ ᱵᱷᱮᱜᱟᱨ ᱯᱟᱨᱥᱳᱱᱟᱞᱤᱴᱤ ᱢᱮᱱᱟᱜ ᱟᱠᱟᱫᱟ ᱡᱟᱦᱟᱸ ᱫᱚ ᱤᱧ ᱥᱟᱞᱟᱜ ᱟᱹᱰᱤ ᱢᱟᱱᱟᱜᱼᱟ ᱾,Santali,happy
9329,ꯔꯦꯁꯇꯣꯔꯦꯟ ꯑꯗꯨꯒꯤ ꯆꯥꯛꯁꯪꯗꯨ ꯂꯨ ꯅꯥꯟꯅ ꯂꯩꯇꯕ ꯑꯗꯨꯗ ꯑꯩ ꯇꯁꯦꯡꯅ ꯅꯨꯡꯉꯥꯏꯇꯦ꯫ ꯇꯩꯁꯜꯂꯕ ꯀꯣꯟꯂꯤꯛꯁꯤꯡ ꯑꯃꯁꯨꯡ ꯁꯦꯡꯗꯣꯛꯇ꯭ꯔꯤꯕ ꯀꯥꯎꯟꯇꯔꯁꯤꯡ ꯎꯔꯨꯕꯗꯨ ꯇꯁꯦꯡꯅ ꯌꯥꯅꯤꯡꯗꯦ ꯫,Manipuri,anger
11007,مےٚ باسیے مےٚ یی اُلٹی ییلِہ میٲنۍ أکۍ کلاس میٹن نستِہ تٔچِتھ سۄے اۄنگٕج ٲسس بٔر۔,Kashmiri,disgust
1205,ꯁꯃꯤꯇꯥꯅ ꯇꯦꯅꯤꯁ ꯀꯣꯔꯠꯇ ꯑꯀꯤꯕ ꯂꯝꯕ ꯑꯗꯨꯒ ꯃꯌꯣꯛꯅꯈꯤꯕ ꯃꯇꯝꯗ ꯃꯁꯥ ꯅꯤꯛꯄ ꯑꯃ ꯐꯥꯎꯈꯤ ꯫,Manipuri,fear
8259,سَہ ایکسپیر زامت دۄد یَس مےٚ وشفن چیوٚو کوٚرُس بہٕ وُلٹی اننس پیٹھ مجبور ۔,Kashmiri,disgust
9167,کمپنی ہندِ نفع کماونہٕ باوجود میٲنِس سالانہٕ بونسس منز ییمہِ ورییہِ كمی سپدنہٕ كِنۍ چھٗس بہٕ پزۍ پٲٹھۍ مایوس ۔,Kashmiri,sad
2674,ᱡᱚᱠᱷᱚᱱ ᱤᱧᱨᱮᱱ ᱚᱴᱚᱢᱳᱵᱟᱭᱤᱞ ᱜᱟᱹᱠᱷᱩᱲᱤᱭᱟᱹ ᱤᱧ ᱡᱚᱛᱷᱟᱛ ᱜᱚᱱᱚᱝᱛᱮ ᱥᱮᱠᱮᱱᱫ ᱦᱮᱱᱰ ᱠᱤᱨᱤᱧ ᱞᱟᱹᱜᱤᱫ ᱢᱤᱫᱴᱟᱝ ᱱᱟᱯᱟᱭ ᱜᱟᱹᱰᱤᱭ ᱯᱟᱸᱡᱟ ᱟᱹᱫᱤᱧᱟ ᱩᱱᱫᱚ ᱤᱧ ᱟᱹᱰᱤᱧ ᱨᱟᱹᱥᱠᱟᱹ ᱞᱮᱱᱟ ᱾,Santali,happy
7788,کنُۄہُ شیتھ ترےشیٖتھ کِس ورلڈ کپ کِس فاینلس منٛز ییٚلہ ہنٛدستانن ویسٹ انڈیزس شکست دیُت، ہندوستٲنۍ تماشٲیی ژایِہ خوشی سان میدانس منٛز,Kashmiri,happy
5924,ꯑꯀꯨꯞꯄ ꯃꯔꯣꯜ ꯄꯨꯝꯅꯃꯛ ꯄꯤꯗꯅ ꯇꯦꯛꯅꯤꯀꯦꯜ ꯋꯥꯏꯠ ꯄꯦꯄꯔ ꯑꯗꯨ ꯑꯩꯅ ꯂꯣꯏꯁꯤꯟꯒꯅꯤ ꯍꯥꯏꯅ ꯀ꯭ꯂꯥꯑꯦꯟꯠ ꯑꯗꯨꯅ ꯈꯜꯂꯝꯒꯅꯤ ꯍꯥꯏꯅ ꯑꯩꯅ ꯈꯪꯈꯤꯗꯦ꯫,Manipuri,surprise
10509,ꯅꯪꯅ ꯑꯩꯉꯣꯟꯗ ꯁꯤꯙꯔꯤꯕ ꯈꯣꯜ ꯑꯗꯨꯅ ꯑꯔꯣꯏꯕꯗ ꯑꯩ ꯌꯦꯛꯅꯕ ꯑꯣꯏꯍꯜꯂꯤ ꯫,Manipuri,anger
5779,ᱵᱟᱪᱷᱱᱟᱣ ᱨᱮᱭᱟᱜ ᱚᱨᱡᱚ ᱞᱟᱹᱜᱤᱫ ᱛᱟᱺᱜᱤᱨᱮ ᱛᱟᱦᱮᱱ ᱫᱚ ᱡᱟᱦᱟᱸᱭ ᱟᱹᱨᱡᱤᱼᱤᱡ ᱞᱟᱹᱜᱤᱫ ᱢᱤᱫᱴᱟᱝ ᱥᱱᱟᱭᱚᱵᱤᱠ ᱵᱩᱡᱩᱱ ᱠᱟᱱᱟ ᱾,Santali,fear
10110,مےٚ کۄر ہوٹٕل انتطامیہ ہس سٕتہِ بٗتھہِ  مقابلہٕ ییٚلہ تمو مےٚ اکی خدماتہٕ  باپتھ دۄیہ لٹہ پونٛسہٕ كھٲلہِ  ۔,Kashmiri,anger
8346,ᱪᱮᱱᱱᱟᱭ ᱨᱮ ᱨᱩᱣᱟᱹᱲ ᱠᱟᱛᱮ ᱱᱟᱯᱟᱭ ᱵᱩᱡᱷᱟᱹᱜ ᱠᱟᱱᱟ ᱾ ᱟᱢᱟᱜ ᱚᱴᱳ ᱪᱮᱫ ᱩᱛᱛᱚᱨ ᱪᱮᱱᱱᱟᱭ ᱪᱟᱞᱟᱜ ᱞᱟᱹᱜᱤᱫ ᱛᱮᱭᱟᱨ ᱢᱮᱱᱟᱜᱼᱟ ?,Santali,happy
7549,مےٚ کھوٚت شرارت ییٚلہ گیس اجنسی پیٹھ لوکو مےٚ سۭتۍ بتھ پھرتھ کتھ کٔر تہٕ اکھ اضٲفی سلنڈر بک کرنہٕ نش کوٚر نکار ییٚمیک بہٕ قانونی طور حقدار اوسس۔,Kashmiri,anger
1964,"ᱤᱧ ᱥᱟᱱᱟᱢ ᱥᱟᱦᱟᱨ ᱨᱮ ᱠᱷᱩᱪᱨᱟᱹ ᱫᱚᱠᱟᱱ ᱠᱚ ᱨᱮᱭᱟᱜ ᱱᱟᱣᱟ ᱪᱮᱱ ᱧᱮᱞ ᱠᱟᱛᱮᱧ ᱵᱷᱟᱵᱽᱱᱟ ᱟᱠᱟᱱᱟ, ᱪᱮᱫᱟᱜ ᱥᱮ ᱩᱱᱠᱩ ᱴᱷᱮᱱ ᱟᱞᱮᱨᱮᱱ ᱥᱚᱨᱮᱥ ᱠᱟᱹᱢᱤᱭᱟᱹ ᱠᱚ ᱟᱫ ᱨᱮᱭᱟᱜ ᱵᱚᱛᱚᱨ ᱢᱮᱱᱟᱜᱼᱟ ᱾",Santali,fear
6905,ᱤᱧ ᱦᱚᱲᱟᱜ ᱵᱷᱟᱵᱱᱟᱠᱚ ᱟᱜᱷᱟᱛ ᱞᱟᱹᱜᱤᱫ ᱥᱟᱢᱠᱟᱥᱟᱹᱴᱤ ᱨᱚᱲᱠᱚ ᱵᱟᱦᱟᱱᱟ ᱵᱮᱱᱟᱣ ᱠᱟᱛᱮᱜ ᱵᱮᱣᱦᱟᱨᱚᱜ ᱤᱧ ᱧᱮᱞ ᱟᱠᱟᱫᱟ ᱟᱨ ᱚᱱᱠᱟᱜᱮ ᱟᱢᱟᱜ ᱠᱟᱛᱷᱟ ᱦᱚᱸ ᱤᱧ ᱚᱨᱩᱪᱤ ᱜᱮᱧ ᱵᱩᱡᱷᱟᱹᱣᱟ ᱾,Santali,disgust
7325,ꯂꯂꯣꯟ ꯏꯇꯤꯛ ꯇꯧꯕꯒꯤ ꯋꯥꯊꯣꯛ ꯑꯃꯅ ꯑꯣꯏꯊꯣꯛꯄ ꯌꯥꯕ ꯏꯊꯤꯜ ꯑꯗꯨꯒꯤ ꯃꯇꯥꯡꯗ ꯑꯩ ꯋꯥꯈꯜ ꯋꯥꯕ ꯍꯦꯟꯒꯠꯂꯛꯂꯤ꯫,Manipuri,fear
7312,مےٚ کھوٚت ریلوے بنکنٛگ کلرک سنٛد شرارت ییٚلہ تٔمۍ ٹکٹن ہنٛز دٔستیٲبی متعلق بحث کرنہٕ پتہٕ میون بکنگ فارم دار کنۍ نیبر لوے۔,Kashmiri,anger
1322,ᱱᱚᱣᱟ ᱫᱚ ᱟᱯᱚᱛᱛᱤ ᱟᱱᱟᱜ ᱠᱟᱱᱟ ᱡᱮ ᱩᱱᱠᱩ ᱠᱚᱨᱯᱳᱨᱮᱥᱚᱱ ᱠᱚ ᱠᱚᱨ ᱯᱷᱟᱹᱠᱤ ᱨᱮᱭᱟᱜ ᱪᱷᱟᱹᱲ ᱠᱚ ᱮᱢᱚᱜ ᱠᱟᱱᱟ ᱾,Santali,anger
6328,میٛون مول آسنہٕ کِنۍ اوسکھ نہٕ ژٕ برۄنہہ میانہ مۄکھٕ وۄنۍ کیٛاز پیوٚے ژےٚ ییتۍ ؤری گٔژھتھ یہ یاد؟ نیٚچو,Kashmiri,surprise
697,ژےٚ کر چھُتھ زانہہ میٲنِس ہِندی كلاسس منز جان كوٚرمٗت؟ تۄہہ سٹوڈنٹن منز چھنہٕ كانسہِ زبانہ  ہنز فکر ،ٹیچر,Kashmiri,disgust
5898,دنیا چھےٚ یوٗت وسیع تہٕ بہٕ چھس وٕنۍ کین کنے زوٚن گرس منٛز بہتھ۔ ہاے!,Kashmiri,sad
11241,ꯑꯗꯣꯝꯒꯤ ꯆꯤꯟꯗꯒꯤ ꯂꯥꯛꯄ ꯑꯍꯤꯡꯕ ꯇꯤꯜꯍꯧꯒꯤ ꯃꯅꯝ ꯑꯗꯨꯅ ꯑꯩꯕꯨ ꯑꯣꯅꯤꯡꯍꯜꯂꯦ ꯫,Manipuri,disgust
8376,مےٚ گیہ مایوٗسی ییٚلہ نہٕ مےٚ پندہَ اگستَس پیٹھ چننے پیٹھٕ دلہ تام تمام ٹرٛیننو  منزٕ کانٛہہ تہ ٹرٛین ٹکٹ دٔستیاب ٲس,Kashmiri,sad
8423,"ᱤᱧ ᱡᱩᱝᱞᱤ ᱩᱭᱦᱟᱹᱨ ᱵᱷᱟᱵᱱᱟᱣᱟᱱ ᱦᱚᱲ ᱠᱚ ᱪᱮᱛᱟᱱ ᱟᱹᱲᱤᱥ ᱢᱮᱱᱟᱜ ᱛᱤᱧᱟᱹ, ᱡᱟᱦᱟᱸᱭ ᱠᱚ ᱜᱚᱴᱟᱼᱵᱩᱴᱟᱹ ᱥᱟᱹᱵᱩᱫᱽ ᱵᱟᱝ ᱫᱚᱦᱚ ᱠᱟᱛᱮ ᱵᱷᱩᱛᱟᱜ ᱠᱟᱛᱷᱟ ᱠᱚ ᱯᱟᱥᱱᱟᱣᱼᱟ ᱾",Santali,disgust
8647,ᱟᱢ ᱪᱮᱫ ᱤᱧ ᱥᱟᱶ ᱞᱟᱹᱲᱦᱟᱹᱭᱮᱢ ᱠᱷᱚᱡ ᱠᱟᱱᱟ ? ᱤᱧ ᱫᱚ ᱢᱤᱫ ᱦᱚᱲ ᱠᱩᱥᱛᱤᱜᱤᱨ ᱠᱟᱹᱱᱟᱹᱧ ! ᱟᱢᱟᱜ ᱢᱟᱸᱭᱟᱸᱢ ᱵᱟᱝ ᱡᱚᱨᱚᱜ ᱫᱷᱟᱵᱤᱡ ᱤᱧ ᱫᱚ ᱟᱢᱤᱧ ᱜᱩᱥᱟᱹᱣ ᱫᱟᱲᱮᱭᱟᱢᱟ ᱾,Santali,anger
10837,ᱡᱟᱦᱟᱸᱛᱤᱱ ᱠᱚᱨᱮ ᱱᱚᱶᱟ ᱫᱚ ᱵᱚᱛᱚᱨᱮ ᱥᱤᱨᱡᱟᱹᱣᱟ ᱡᱚᱠᱷᱚᱱ ᱤᱧ ᱠᱟᱹᱢᱤ ᱴᱷᱟᱶᱨᱮ ᱟᱨ ᱚᱲᱟᱜ ᱨᱮ ᱤᱧ ᱪᱟᱪᱟᱞᱟᱣ ᱦᱩᱭᱩᱜ ᱛᱤᱧᱟᱹ ᱱᱚᱝᱠᱟᱱ ᱡᱤᱱᱤᱥ ᱠᱚ ᱤᱫᱤ ᱠᱟᱹᱛᱤᱧ ᱩᱭᱦᱟᱹᱨᱟ ᱾,Santali,fear
6970,45 ᱴᱤᱲᱤᱡ ᱞᱟᱹᱜᱤᱫ ᱤᱧᱟᱹᱜ ᱞᱤᱱᱟᱭᱤᱱ ᱵᱚᱱᱚᱫᱚᱞ ᱫᱚᱦᱚ ᱛᱟᱭᱚᱢ ᱟᱢ ᱪᱮᱫ ᱮᱢ ᱢᱮᱱ ᱮᱫᱟ ᱡᱮ ᱟᱢ ᱤᱧ ᱜᱚᱲᱚ ᱵᱟᱝ ᱮᱢ ᱫᱟᱲᱮᱭᱟᱜᱼᱟ?,Santali,anger
978,تہنٛد کھین اٗوس شاندار،گراکھ,Kashmiri,happy
5968,اسہ کوٚر اکھ سہل آن لاین آرڈر کرنک نظام متعارف یس خریدارن خۄش لوٚگ۔,Kashmiri,happy
1955,بہٕ چھس نہٕ یژھان امہ آن لاین سروس پیٹھ تحفہٕ آرڈر کرن تکیاز تم چھ چیزٕ بدلہٕ سیر سوزنہٕ خٲطرٕ زانٛنہٕ یوان۔,Kashmiri,fear
1806,ᱪᱮᱱᱱᱟᱭ ᱠᱷᱚᱱ ᱫᱤᱞᱞᱤ ᱦᱟᱹᱵᱤᱡ ᱑᱕ ᱟᱜᱚᱥᱴ ᱨᱮᱭᱟᱜ ᱥᱟᱱᱟᱢ ᱴᱨᱮᱱ ᱨᱮᱜᱮ ᱢᱮᱱᱟᱜ ᱴᱤᱠᱤᱴ ᱵᱟᱹᱧ ᱧᱟᱢ ᱞᱮᱫᱛᱮ ᱤᱧᱤᱧ ᱠᱟᱺᱦᱤᱥ ᱞᱮᱱᱟ ᱾,Santali,sad
1150,ꯃꯍꯥꯛꯅ ꯑꯩꯉꯣꯟꯗ ꯐꯨꯅꯕ ꯍꯣꯠꯅꯔꯛꯄꯗꯨꯗꯒꯤ ꯑꯩ ꯏꯁꯥ ꯄꯨꯝꯅꯃꯛ ꯅꯤꯛꯂꯤ ꯫,Manipuri,fear
3610,ᱴᱚᱢ ᱡᱚᱠᱷᱚᱱ ᱟᱡ ᱨᱮᱱ ᱥᱚᱨᱮᱥ ᱠᱷᱮᱞᱳᱰᱤᱭᱟᱹ ᱦᱮᱴᱴᱨᱤᱠ ᱠᱚᱨᱟᱣ ᱮ ᱧᱮᱞ ᱠᱮᱫᱮᱭᱟ ᱩᱱ ᱩᱱᱤ ᱟᱹᱰᱤᱭ ᱨᱟᱹᱥᱠᱟᱹᱭᱮᱱᱟ ᱾,Santali,happy
2077,ꯚꯥꯔꯠꯀꯤ ꯐꯨꯠꯕꯣꯜ ꯇꯤꯝ ꯑꯁꯤ ꯑꯦꯁ꯭ꯌꯥꯗꯇ ꯊꯥꯕꯒꯤ ꯃꯇꯥꯡꯗ ꯑꯥꯏ.ꯑꯣ.ꯑꯦ. ꯑꯃꯁꯨꯡ ꯑꯦ. ꯑꯥꯏ. ꯑꯦꯐ. ꯑꯦꯐ. ꯀꯤ ꯃꯔꯛꯇ ꯌꯦꯠꯅꯕ ꯑꯁꯤ ꯎꯕꯗ ꯌꯥꯝꯅ ꯁꯥꯎꯅꯤꯡꯕ ꯐꯥꯎꯋꯤ ꯫,Manipuri,anger
3230,"ᱤᱧ ᱯᱷᱨᱤᱡᱽ ᱠᱷᱚᱱ ᱦᱮᱡ ᱟᱠᱟᱱ ᱡᱳᱨ  ᱟᱨ ᱚᱥᱟᱹᱵᱤᱠ ᱥᱟᱰᱮ ᱤᱫᱤ ᱠᱟᱛᱮ ᱥᱟᱹᱨᱤᱜᱮᱧ ᱵᱷᱟᱵᱱᱟᱜ ᱠᱟᱱᱟ, ᱱᱚᱝᱠᱟ ᱢᱚᱱᱮ ᱦᱩᱭᱩᱜᱼᱟ ᱡᱮ ᱠᱤᱪᱷᱤ  ᱜᱟᱹᱦᱤᱨᱛᱮ ᱡᱟᱦᱟᱱ ᱵᱟᱹᱲᱤᱡ ᱦᱩᱭ ᱫᱟᱲᱮᱭᱟᱜᱼᱟ ᱾",Santali,fear
3102,ییٚلہ أسۍ سری نگر وٲتہِ، مےٚ گوٚو تازٕ ہواہ سۭتہِ تازٕ گژھنُک احساس۔,Kashmiri,happy
1740,مےٚ کٔر غلطی ز مےٚ اوٚن غلط دوا، مےٚ چھ وۄنۍسخ پھیران۔,Kashmiri,sad
7902,"ᱟᱞᱮᱭᱟᱜ ᱠᱩᱨᱤᱭᱟᱨ ᱰᱮᱞᱤᱵᱷᱟᱨᱤ ᱠᱟᱹᱢᱤᱭᱟᱹ ᱨᱟᱹᱥᱤᱭᱟᱹ ᱫᱚ ᱟᱞᱮᱭᱟᱜ ᱴᱨᱮᱠᱤᱝ ᱥᱤᱥᱴᱮᱢ ᱨᱮ ᱢᱤᱫᱴᱟᱝ ᱱᱳᱴᱮ ᱵᱮᱱᱟᱣ ᱟᱠᱟᱫᱟ ᱡᱮ ᱩᱱᱤ ᱪᱤᱴᱷᱤ ᱮᱢ ᱞᱟᱹᱜᱤᱫ ᱟᱢᱟᱜ ᱚᱲᱟᱜ ᱛᱮ ᱯᱮ ᱫᱷᱟᱣ ᱮ ᱦᱮᱡ ᱞᱮᱱᱟ, ᱢᱮᱱᱠᱷᱟᱱ ᱟᱢ ᱚᱸᱰᱮ ᱵᱟᱢ ᱛᱟᱦᱮᱸ ᱠᱟᱱᱟ ᱾ (ᱠᱩᱨᱤᱭᱟᱨ)",Santali,surprise
6547,"ᱟᱢ ᱱᱩᱱᱟᱹᱜ ᱥᱮᱨᱢᱟ ᱠᱷᱚᱱ ᱚᱱᱠᱟᱜᱮ ᱢᱮᱱᱟᱢᱟ ᱟᱨ ᱱᱤᱛ ᱪᱮᱫᱦᱚᱸ ᱵᱟᱝ ᱵᱚᱫᱚᱞ ᱟᱠᱟᱱᱟ, ᱛᱟᱦᱚᱞᱮ ᱟᱢᱟᱜ ᱪᱮᱫᱟᱜ ᱢᱚᱱᱮ ᱦᱩᱭᱩᱜ ᱠᱟᱱᱟ ᱡᱮ ᱟᱞᱤᱧ ᱟᱢ  ᱵᱳᱰᱤᱝ ᱤᱥᱠᱩᱞ ᱨᱮ ᱫᱚᱦᱚᱭ ᱨᱮᱭᱟᱜ ᱠᱟᱛᱷᱟ ᱞᱤᱧ ᱵᱤᱪᱟᱹᱨᱟ ? (ᱟᱭᱳ)",Santali,surprise
6451,"ꯗ꯭ꯔꯥꯏꯚꯤꯡ ꯁ꯭ꯀꯨꯜ ꯑꯁꯤꯅ ꯑꯍꯦꯟꯕ ꯃꯍꯩꯁꯤꯡ ꯇꯥꯛꯂꯕꯁꯨ, ꯑꯃꯣꯠꯄ ꯗ꯭ꯔꯥꯏꯚꯤꯡ ꯁꯤꯃꯨꯂꯦꯇꯔ ꯁꯤꯖꯤꯟꯅꯕꯒꯤ ꯋꯥꯈꯜꯂꯣꯟ ꯑꯗꯨ ꯄꯥꯝꯈꯤꯗꯦ ꯫",Manipuri,disgust
7305,ꯁ꯭ꯄꯥꯝꯃꯔ ꯑꯃꯅ ꯊꯥꯔꯛꯈꯤꯕ ꯑꯦꯞ ꯑꯃꯗ ꯁꯣꯏꯗꯅ ꯅꯝꯂꯨꯕ ꯃꯇꯨꯡꯗ ꯑꯩ ꯄꯨꯡꯈꯥꯏ ꯑꯃꯔꯣꯝ ꯊꯛꯀꯠꯄꯒꯤ ꯐꯤꯚꯝꯗ ꯂꯩꯈꯤ ꯫,Manipuri,fear
9790,"ꯍꯩꯃꯥ, ꯑꯩꯍꯥꯛꯀꯤ ꯑꯅꯧꯕ ꯌꯨꯝꯒꯤꯗꯃꯛ  ꯏꯂꯦꯛꯇ꯭ꯔꯤꯛ ꯐꯤꯇꯤꯡꯁꯤꯡꯒꯤ ꯃꯈꯜ ꯌꯥꯝꯅ ꯂꯩꯔꯝꯒꯅꯤ, ꯍꯥꯏꯕ ꯈꯜꯂꯨꯗꯦ, ꯃꯁꯤ ꯑꯅꯧꯕ ꯑꯣꯞꯁꯟꯁꯤꯡ ꯃꯔꯥꯡ ꯀꯥꯏꯅ ꯐꯪꯕ ꯑꯅꯧꯕ ꯃꯐꯝ ꯑꯃꯒꯨꯝꯕꯅꯤ !",Manipuri,surprise
6649,ꯑꯩꯒꯤ ꯏꯟꯁꯨꯔꯦꯟꯁ ꯑꯁꯤꯅ ꯑꯥꯌꯨꯔꯕꯦꯗꯤꯛ ꯂꯥꯏꯌꯦꯡ ꯀꯣꯚꯔ ꯇꯧꯗꯕ ꯃꯔꯝꯅ ꯑꯩ ꯃꯁꯤꯃꯛ ꯍꯥꯏꯕ ꯉꯝꯃꯝꯃꯗꯤ ꯈꯜꯂꯦ ꯫,Manipuri,sad
2579,ᱥᱚᱨᱠᱟᱨ ᱡᱚᱠᱷᱚᱱ ᱒᱐᱐᱐ ᱴᱟᱠᱟ ᱨᱮᱭᱟᱜ ᱱᱳᱴ ᱪᱟᱹᱞᱩ ᱠᱷᱚᱱ ᱮ ᱵᱟᱹᱛᱤᱞ ᱞᱮᱫᱟ ᱩᱱᱫᱚ ᱥᱟᱫᱷᱟᱨᱚᱱ ᱫᱤᱥᱩᱣᱟᱹ ᱠᱚ ᱟᱨ ᱠᱟᱹᱭᱫᱤ ᱠᱚ ᱫᱚ ᱠᱚ ᱦᱟᱦᱟᱲᱟ ᱞᱮᱱᱟ  ᱾,Santali,surprise
4289,ꯏꯁꯩ ꯅꯣꯡꯃꯥꯏꯒꯤ ꯑꯣꯖꯥ ꯑꯗꯨ ꯂꯝꯆꯠꯀꯤ ꯃꯇꯥꯡꯗ ꯌꯥꯝꯅ ꯆꯦꯛꯁꯤꯟꯈꯤ ꯑꯃꯁꯨꯡ ꯅꯍꯥ ꯑꯣꯏꯔꯤꯕ ꯃꯅꯤꯡ ꯇꯝꯕ ꯃꯍꯩꯔꯣꯏ ꯑꯗꯨꯅ ꯃꯁꯥꯕꯨ ꯍꯣꯡꯗꯣꯛꯆꯗ꯭ꯔꯕꯗꯤ ꯃꯍꯥꯛ ꯑꯐꯕ ꯑꯃ ꯃꯥꯡꯅꯤ ꯍꯥꯏꯅ ꯑꯩ ꯄꯥꯈꯠꯈꯤ  ꯫,Manipuri,fear
9093,ᱤᱧ ᱥᱟᱹᱨᱤᱜᱮ ᱥᱟᱱᱟᱢ ᱠᱚ ᱞᱟᱹᱜᱤᱫ ᱥᱚᱨᱯᱷᱟ ᱜᱚᱱᱚᱝ ᱛᱮ ᱥᱟᱶᱟᱨ ᱥᱮᱵᱮᱫ ᱮᱴᱟᱜᱟᱜ ᱨᱮᱭᱟᱜ ᱫᱟᱨᱟᱭ ᱛᱮ ᱥᱤᱞᱜᱟᱹᱣᱟ ᱾,Santali,anger
2537,ᱤᱧ ᱥᱟᱹᱨᱤᱜᱤᱧ ᱟᱥᱚᱜ ᱠᱟᱱ ᱛᱟᱦᱮᱸ ᱡᱮ ᱤᱧᱟᱹᱜ ᱢᱮᱰᱤᱼᱳᱭᱮᱞ ᱵᱤᱢᱟᱹ ᱠᱷᱚᱨᱚᱪ ᱨᱮᱭᱟᱜ ᱢᱤᱫᱴᱟᱝ ᱢᱟᱨᱟᱝ ᱦᱤᱸᱥᱮ ᱠᱚᱵᱷᱟᱨᱟ ᱾ᱱᱚᱶᱟ ᱫᱚ ᱟᱹᱰᱤ ᱵᱟᱝ ᱟᱥᱚᱜ ᱟᱨ ᱵᱷᱟᱵᱱᱟ ᱟᱱᱟᱜ ᱠᱟᱱᱟ  ᱡᱟᱦᱟᱸ ᱫᱚ ᱱᱚᱶᱟ ᱟᱹᱰᱤ ᱢᱟᱨᱟᱝᱛᱮ ᱵᱟᱭ ᱠᱟᱵᱷᱟᱨ ᱮᱫᱟ ᱾,Santali,surprise
6729,ᱪᱮᱫ ᱟᱢ ᱵᱟᱢ ᱵᱟᱲᱟᱭ ᱠᱟᱱ ᱛᱟᱦᱮᱸᱜ ᱡᱮ ᱵᱤᱞᱟᱹᱛᱤ ᱨᱮᱭᱟᱜ ᱫᱟᱢ ᱰᱷᱮᱨ ᱟᱠᱟᱱᱟ ? ᱪᱮᱫ ᱟᱢ  ᱯᱟᱨᱚᱢᱮᱱ ᱠᱤᱪᱷᱩ ᱦᱟᱯᱛᱟ ᱫᱷᱩᱨᱤᱭᱟᱹ ᱫᱷᱤᱨᱤ ᱞᱟᱛᱟᱨ ᱨᱮᱢ ᱛᱟᱦᱮᱸᱠᱟᱱᱟ ᱾,Santali,disgust
106,ꯃꯁꯤꯒꯤ ꯀꯦꯃꯦꯔꯥ ꯑꯁꯤꯅ ꯑꯁꯤꯒꯨꯝꯕ ꯐꯖꯔꯕ ꯃꯆꯨꯁꯤꯡ ꯑꯁꯤ ꯀꯔꯝꯅ ꯂꯧꯕ ꯉꯝꯕꯒꯦ ꯍꯥꯏꯕꯁꯤꯗ ꯑꯩꯍꯥꯛ ꯑꯉꯛꯄ ꯐꯥꯎꯏ!,Manipuri,surprise
2889,ꯁꯦꯟꯒꯤꯒꯗꯃꯛꯇ ꯁꯥꯟꯅꯕ ꯃꯁꯥꯟꯅꯁꯤꯡꯗ ꯀꯥ ꯍꯦꯟꯅ ꯁꯦꯟꯗꯥꯟ ꯂꯝꯕꯤ ꯑꯣꯟꯊꯣꯛꯄ ꯑꯃꯁꯨꯡ  ꯀꯔꯥꯝ ꯆꯥꯎꯕ ꯑꯁꯤ ꯇꯨꯀꯠꯆꯅꯤꯡꯉꯥꯏ ꯑꯣꯏ ꯫,Manipuri,disgust
2796,لوکو کٔر سڑکن پیٹھ پولیسس سٕتۍ لڑٲیۍ ییلہ تہنزٕ نوکریہٕ مشینو سٕتہ بدلاونہٕ آیہ۔,Kashmiri,anger
8121,ꯚꯥꯔꯠ ꯃꯆꯥꯁꯤꯡꯅ ꯃꯈꯣꯏꯒꯤ ꯉꯝꯈꯩ ꯂꯥꯟꯁꯤꯟꯂꯛꯄꯒꯤ ꯊꯧꯑꯣꯡ ꯑꯗꯨ ꯊꯦꯡꯅꯅꯕ ꯄꯥꯠ ꯑꯗꯨꯒꯤ ꯃꯊꯛꯇ ꯂꯩꯕ ꯑꯋꯥꯡꯕ ꯃꯐꯝꯁꯤꯡꯗ ꯇꯦꯡꯛꯁꯤꯡ ꯄꯨꯁꯤꯜꯂꯛꯄ ꯃꯇꯝꯗ ꯆꯥꯏꯅꯥꯒꯤ ꯂꯥꯟꯃꯤꯁꯤꯡ ꯑꯗꯨ ꯇꯨꯝꯗꯨꯅ ꯂꯩꯔꯝꯕ ꯊꯦꯡꯅꯈꯤ꯫,Manipuri,surprise
4782,اچانك واوٕ سٕتہِ دارین الہٕ الہٕ سٕتہِ بڈییہ سٲنہِ پریشٲنی ۔,Kashmiri,fear
10997,ᱤᱧ ᱵᱟᱹᱧ ᱯᱟᱹᱛᱭᱟᱹᱣ ᱫᱟᱲᱮᱭᱟᱜᱼᱟ ᱡᱮ ᱩᱱᱠᱩ ᱟᱵᱚᱣᱟᱜ ᱱᱚᱶᱟ ᱞᱮᱠᱟᱱ ᱢᱟᱨᱮᱱ ᱯᱤ ᱳ ᱮᱥ ᱥᱤᱥᱴᱮᱢ ᱥᱟᱞᱟᱜ ᱠᱟᱹᱢᱤ ᱨᱮᱭᱟᱜ ᱠᱚ ᱟᱥᱚᱜᱼᱟ ᱾,Santali,disgust
4800,ᱦᱟᱢᱟᱞ ᱛᱩᱞ ᱫᱚ ᱤᱧ ᱱᱩᱱᱟᱹᱜᱮ ᱯᱟᱹᱛᱭᱟᱹᱨᱟᱠᱟᱫᱤᱧᱟ ᱡᱮ ᱤᱧ ᱯᱮᱨᱮᱡ ᱯᱩᱨᱩᱱ ᱟᱹᱭᱠᱟᱹᱣᱮ ᱮᱢᱟᱠᱟᱫᱤᱧᱟ ᱾ ᱤᱧ ᱫᱚ ᱚᱱᱟ ᱠᱚᱨᱟᱣᱤᱧ ᱠᱩᱥᱤᱭᱟᱜᱼᱟ ᱾,Santali,happy
5134,ꯃꯤ ꯃꯌꯥꯝꯒꯤ ꯃꯃꯥꯡꯗ ꯀ꯭ꯂꯥꯌꯦꯟꯠ ꯃꯦꯅꯦꯖꯔ ꯑꯗꯨꯅ ꯃꯍꯥꯛꯀꯤ ꯇꯤꯝꯗ ꯀꯣꯏꯂꯥꯎ ꯂꯥꯎꯊꯠꯄꯒꯤꯗꯃꯛ ꯑꯩꯍꯥꯛꯅ ꯃꯍꯥꯛꯄꯨ ꯍꯩꯅꯗꯦ꯫,Manipuri,disgust
4909,پرٲنؠن ڪتابن ہٕنٛد قۭمتس منٛز گزرنک خوف چھ مےٚ پریشان کران۔,Kashmiri,fear
2492,ییٚتہِ موٗجوٗد تۄہہِ سارِنٕے گُڈ مارننگ ییٚمہِ کوارٹرَس منٛز چھِ أسۍ پنٕنۍ فروخت دۄگنہٕ وٕچھمٕژ تہٕ چھِ دہَ لَچھ کھۄتہٕ زِیٛادٕ دُہراونہٕ یِنہٕ,Kashmiri,happy
8632,"ᱤᱧ ᱵᱟᱹᱧ ᱯᱟᱹᱛᱭᱟᱹᱣ ᱫᱟᱲᱮᱭᱟᱜ ᱠᱟᱱᱟ ᱟᱢ ᱫᱚ ᱢᱤᱫ ᱥᱮᱨᱢᱟ ᱫᱷᱩᱨᱭᱟᱹ  ᱛᱷᱤᱨᱮᱢ ᱛᱟᱦᱮᱸ ᱠᱟᱱᱟ ! ᱱᱚᱶᱟ ᱫᱚ ᱢᱤᱫᱴᱟᱝ ᱡᱮᱞᱮᱧ ᱟᱨ ᱠᱚᱴᱷᱤᱱ ᱥᱟᱸᱜᱷᱟᱨ ᱛᱟᱦᱮᱸ ᱠᱟᱱᱟ, ᱢᱮᱱᱠᱷᱟᱱ ᱟᱢ ᱫᱚ ᱚᱱᱟᱢ ᱠᱚᱨᱟᱣ ᱟᱠᱟᱫᱟ !",Santali,surprise
5193,ᱤᱧ ᱫᱚ ᱥᱤᱨᱤᱡ ᱨᱮᱭᱟᱜ ᱛᱟᱭᱚᱢ ᱦᱤᱸᱥ ᱯᱟᱲᱦᱟᱣ ᱮᱛᱚᱦᱚᱯ ᱞᱟᱹᱜᱤᱫ ᱟᱹᱰᱤ ᱪᱦᱟᱴᱯᱟᱴᱟᱣ ᱟᱨ ᱨᱟᱹᱥᱠᱟᱹᱧ ᱵᱩᱡᱷᱮᱫᱟ !,Santali,sad
10843,ꯑꯩꯍꯥꯛ ꯃꯊꯪ ꯁꯦꯃꯦꯁꯇꯔꯒꯤ ꯑꯅꯧꯕ ꯀ꯭ꯂꯥꯁ ꯍꯧꯕ ꯉꯥꯏꯕ ꯉꯝꯗ꯭ꯔꯦ !,Manipuri,happy
568,بہٕ چھٗس چانہِ  زبانہِ سۭتۍ ناخوش تہٕ ہیكہٕ نہٕ مٲنِتھ   ز ژٕ چھٗكھ امہِ  نِشہ غٲفِل زِ  چٲنۍ لفظ كِتھہٕ كٕنۍ چھِ لوُكن پیٹھ اثر تراوان ۔,Kashmiri,anger
9074,ᱩᱱᱤᱭᱟᱜ ᱠᱨᱤᱠᱮᱴ ᱫᱚᱞ ᱢᱮᱪ ᱨᱮ ᱦᱤᱨᱟᱹᱣᱚᱜ ᱚᱠᱛᱚ ᱤᱧ ᱯᱷᱮᱱ ᱠᱚ ᱴᱤᱵᱷᱤ ᱨᱟᱹᱯᱩᱫᱤᱧ ᱧᱮᱞ ᱟᱠᱟᱫ ᱠᱚᱣᱟ ᱾,Santali,anger
7473,اسہ چھ یہ بوٗزتھ افسوس  ز کمۍ تام چھ تہنٛدس گرس ژوٗر کٔرمٕژ تہٕ یہ آسہ تۄہہ خٲطرٕ مشکل ژوٗر کر گٔیہ؟ پلسہٕ,Kashmiri,sad
1407,درجہ حرارتس منز اچانک، ناقابل بیان کمی چھے٘ شہس وٗنل بناوان ،تہ  خوفزدٕ كران ۔,Kashmiri,fear
9070,بہٕ چھس نہٕ وُچھتھٕے ہیکان ز حیاتیات کس کلاسس منٛز کتھ کٔنۍ چھ جانورن ژٹھ کپٹھ یوان کرنہٕ۔,Kashmiri,disgust
9358,ꯑꯩꯒꯤ ꯄꯣꯂꯤꯁꯤ ꯑꯁꯤꯅ ꯑꯥꯌꯨꯔꯕꯦꯗꯤꯛ ꯂꯥꯏꯌꯦꯡ ꯑꯗꯨ ꯌꯥꯎꯍꯟꯔꯣꯏ ꯍꯥꯏꯅ ꯑꯩꯅ ꯈꯟꯈꯤ ꯑꯃꯁꯨꯡ ꯄꯤꯔꯤꯕ ꯃꯤꯑꯣꯏ ꯑꯗꯨꯒ ꯄꯥꯎ ꯐꯥꯎꯅꯈꯤꯗꯦ ꯫ ꯃꯁꯤ ꯃꯌꯦꯛ ꯁꯦꯡꯅ ꯑꯩꯒꯤ ꯏꯔꯥꯟꯅꯤ ꯫,Manipuri,sad
4249,"ᱵᱟᱝ ᱜᱚᱢᱠᱮ, ᱫᱟᱫᱟᱣᱟᱜ ᱦᱚᱲᱢᱚ ᱢᱚᱡ ᱵᱟᱝ ᱠᱷᱟᱹᱛᱤᱨ ᱤᱧ ᱫᱚ ᱦᱚᱞᱟ ᱵᱟᱹᱧ ᱠᱟᱹᱢᱤ ᱫᱟᱲᱮ ᱟᱠᱟᱫᱟ ᱾",Santali,sad
11353,اسہ میلیو یہ بوزِتھ راحت ز تم چھ پننس ٹیکس فائلنگ تجربس سۭتۍ مطمئن۔,Kashmiri,happy
1550,ꯑꯩ ꯂꯝꯍꯥꯡꯅꯔꯦ ꯑꯃꯁꯨꯡ ꯃꯁꯤ ꯁꯍꯔ ꯑꯁꯤꯗ ꯑꯩꯒꯤ ꯑꯍꯥꯟꯕꯅꯤ꯫ ꯑꯩ ꯂꯨꯠ ꯇꯧꯈꯤꯕ ꯄꯥꯝꯗꯦ꯫,Manipuri,fear
3330,نارس پیٹھہٕ كٕنۍ اویزان كمزور كدلس ترٗن چھٗ اكھ خوفناک تجرٗبہٕ۔,Kashmiri,fear
