id,Sentence,language,emotion
1801,رُک، بہٕ چھس صرف یہ یقینی بناونٕچ کوٗشش کران ز مےٚ چھ فراہم کرنہٕ آمتیٚن خدماتن خٲطرٕ معقول قۭمت میلان۔,Kashmiri,disgust
7895,بہٕ چھس مایوس گژھان ییٚلہ بہٕ بٹوار دۄہ شامس ایسٹ کوسٹ روڈس ترنٕچ کوٗشش چھس کران تہٕ کانٛہہ تِہ چھنہٕ مےٚ ترنہٕ دوان۔,Kashmiri,anger
3369,ꯑꯩꯒꯤ ꯑꯉꯥꯡ ꯌꯣꯛꯄꯗ ꯆꯥꯗꯤꯡꯁꯤ ꯀꯌꯥ ꯌꯥꯝꯅ ꯍꯦꯟꯒꯠꯂꯛꯂꯤꯕꯒꯦ ꯍꯥꯏꯕꯗꯨ ꯎꯕꯗ ꯇꯁꯦꯡꯅ ꯄꯨꯛꯅꯤꯡ ꯁꯣꯟꯊꯩ꯫,Manipuri,sad
5191,بہٕ چھس بیٚنٛکس  مٗقابلہٕ جٲتی سودٕکہِ شرح پیش نہٕ کرنس پیٹھ ناراض۔,Kashmiri,anger
7934,کوچ سٕنٛز سپورٹس مینشِپٕچ کٔمی چھےٚ واریاہ مایوس کن۔,Kashmiri,disgust
4704,ꯃꯐꯝ ꯑꯗꯨꯒꯤ ꯄꯥꯔꯛꯁꯤꯡ ꯑꯗꯨꯅ ꯁꯍꯔꯒꯤ ꯏꯔꯥꯡ ꯂꯥꯡꯕ ꯄꯨꯟꯁꯤꯗꯒꯤ ꯏꯪ ꯆꯤꯛꯄ ꯅꯥꯟꯊꯣꯛꯄꯒꯤ ꯈꯨꯗꯣꯡꯆꯥꯕ ꯄꯤꯔꯤ꯫,Manipuri,happy
5381,"ᱟᱨᱦᱚᱸ ᱱᱟᱯᱟᱭ ᱥᱮ ᱵᱟᱝ, ᱤᱧ ᱢᱤᱫᱴᱟᱝ ᱥᱮᱨᱢᱟᱠᱤᱭᱟᱹ ᱤᱱᱴᱟᱨᱱᱮᱴ ᱥᱟᱵᱥᱠᱨᱤᱯᱥᱚᱱ ᱞᱟᱹᱜᱤᱫ ᱥᱮᱱ ᱟᱠᱟᱱᱟ, ᱱᱚᱣᱟ ᱩᱭᱦᱟᱹᱨ ᱵᱤᱨᱩᱫᱷᱨᱮ ᱡᱮ, ᱱᱚᱶᱟ ᱫᱚ ᱤᱧᱟᱹᱜ ᱚᱯᱷᱤᱥ ᱠᱚᱞ ᱫᱚ ᱵᱟᱝ ᱦᱟᱹᱱᱼᱟ ᱾",Santali,fear
8221,مےٚ گو خوف ییٚلہ بہٕ اکہ خطرناک  علاقہٕ مٔنٛزۍ پٔکتھ أکس نوِس ریسٹورانس تام پکان  گوس۔,Kashmiri,fear
3877,ᱩᱱᱤᱭᱟᱜ ᱱᱚᱣᱟ ᱵᱮᱭᱟᱢ ᱠᱚᱨᱟᱣ ᱦᱚᱨᱟ ᱫᱚ ᱱᱩᱱᱟᱹᱜ ᱜᱮ ᱦᱟᱦᱟᱲᱟᱣᱟᱱ ᱟᱨ ᱵᱟᱹᱲᱤᱡ ᱡᱮ ᱚᱱᱟ ᱫᱚ ᱦᱤᱨᱠᱷᱟᱹ ᱜᱮ ᱧᱮᱞᱚᱜ ᱠᱟᱱᱟ ᱾,Santali,disgust
9728,ᱛᱷᱟᱹᱱᱤᱭᱚ ᱠᱟᱹᱨᱜᱚᱞ ᱠᱚᱣᱟᱜ ᱱᱤᱯᱷᱩᱴ ᱠᱟᱹᱢᱤ ᱟᱨ ᱦᱩᱱᱟᱹᱨ ᱥᱟᱹᱨᱤ ᱜᱮ ᱧᱮᱞᱡᱚᱝ ᱞᱮᱠᱟ ᱾,Santali,surprise
5946,"ꯅꯍꯥꯛꯀꯤ ꯐꯤꯗꯕꯦꯛ ꯑꯁꯤ ꯑꯩꯈꯣꯏꯒꯤꯗꯃꯛꯇ ꯌꯥꯝꯅ ꯃꯃꯜ ꯌꯥꯝꯃꯤ, ꯑꯃꯁꯨꯡ ꯑꯩꯈꯣꯏꯒꯤ ꯁꯤꯟꯃꯤꯁꯤꯡꯅ ꯃꯇꯝ ꯄꯨꯝꯅꯃꯛꯇ ꯏꯀꯥꯏ ꯈꯨꯝꯅꯕ ꯑꯃꯁꯨꯡ ꯄ꯭ꯔꯣꯐꯦꯁꯁꯟꯅꯦꯜ ꯑꯣꯏꯅ ꯊꯕꯛ ꯇꯧꯅꯕ ꯑꯩꯈꯣꯏꯅ ꯆꯦꯛꯁꯤꯟꯅꯕ ꯍꯣꯠꯅꯒꯅꯤ ꯫",Manipuri,happy
9798,"ꯄꯣꯠ ꯊꯤꯟꯕ ꯃꯤꯑꯣꯏ ꯑꯗꯨꯅ ꯂꯥꯛꯄ ꯃꯇꯝ ꯈꯨꯗꯤꯡꯃꯛꯇ, ꯑꯩꯅ ꯃꯍꯥꯛꯄꯨ ꯑꯩꯈꯣꯏꯒꯤ ꯌꯨꯝꯗ ꯆꯪꯍꯟꯕ ꯀꯤꯖꯩ꯫ ꯍꯧꯖꯤꯛꯀꯤ ꯃꯇꯝꯁꯤꯗ ꯍꯨꯔꯥꯟꯕꯒꯤ ꯊꯧꯗꯣꯛ ꯌꯥꯝꯅ ꯍꯦꯟꯅ ꯂꯩꯔꯦ꯫",Manipuri,fear
8321,پننس کاربارس منز نقصانن چھس بہٕ سیٹھاہ زبردست  ویسروومُت۔,Kashmiri,sad
11250,ꯍꯦꯜꯊ ꯁꯦꯟꯇꯔꯅ ꯄꯤꯔꯤꯕ ꯍꯤꯗꯥꯛꯁꯤꯡ ꯑꯁꯤ ꯃꯇꯝ ꯂꯣꯏꯔꯕꯒꯨꯝ ꯇꯧꯋꯤ ꯑꯃꯁꯨꯡ ꯃꯁꯤ ꯀꯤꯅꯤꯡꯉꯥꯏ ꯑꯣꯏ꯫,Manipuri,fear
9184,ꯑꯩ ꯑꯌꯨꯛ ꯈꯨꯗꯤꯡꯒꯤ ꯈꯣꯡꯕꯥꯟ ꯑꯗꯨꯗꯒꯤ ꯌꯥꯝꯅ ꯅꯝꯊꯤꯕ ꯃꯅꯝ ꯑꯃ ꯅꯝꯃꯤ ꯫,Manipuri,disgust
2036,ایکسایز انسپیکٹرس ٲس میٲنیۍ ژران تکیاز مےٚ اوس تس چک پوسٹس پیٹھ پنن ٹرک تراونہٕ باپت رشوت دنس انکار کوٚرمت۔,Kashmiri,anger
5183,ꯚꯤ. ꯄꯤ. ꯑꯁꯤ ꯆꯦꯟꯅꯥꯏꯗ ꯈꯪ ꯍꯩꯔꯕ ꯁꯔꯚꯤꯁ ꯇꯧꯕ ꯃꯤꯑꯣꯏ ꯑꯃ ꯑꯣꯏꯕꯅ ꯑꯩꯒꯤ ꯏꯟꯖꯤꯟ ꯌꯥꯗꯕꯗ ꯃꯇꯦꯡ ꯄꯥꯡꯅꯕ ꯂꯩꯕꯅ ꯑꯩ ꯇꯁꯦꯡꯅ ꯑꯋꯥꯕ ꯀꯣꯛꯂꯦ꯫,Manipuri,happy
7467,مےٚ اوس نہٕ زانہہ سوچمت زِ مےٚ میلِہ اکھ گرٕ یتھ میٲنس خوابن ہٕندس باغس خٲطرٕ کٲفی آنگن آسِہ، تہٕ پتہٕ ژھور درالن میانِہ خٲطرٕ اکھ!,Kashmiri,surprise
934,ᱱᱚᱶᱟ ᱫᱚ ᱦᱩᱭᱩᱜ ᱠᱟᱱᱟ ᱤᱧᱤᱡ ᱢᱤᱥᱨᱟᱧᱼᱟᱜ ᱡᱟᱱᱟᱢ ᱢᱟᱦᱟ ᱞᱟᱹᱜᱤᱫ ᱾ ᱟᱞᱮ ᱫᱚ ᱩᱱᱤ ᱢᱤᱫᱴᱟᱝ ᱥᱟᱨᱯᱨᱟᱭᱤᱡᱽ ᱯᱟᱨᱴᱤ ᱞᱮ ᱮᱢᱟᱭ ᱠᱟᱱᱟ ᱾,Santali,happy
3583,ꯉꯁꯤ ꯃꯐꯝ ꯀꯌꯥꯗ ꯑꯩꯒꯤ ꯀ꯭ꯔꯦꯗꯤꯠ ꯑꯁꯤ ꯁꯤꯖꯤꯟꯅꯕ ꯌꯥꯗꯦ꯫ ꯑꯩꯒꯤ ꯕꯦꯡ꯭ꯛ ꯑꯦꯀꯥꯎꯟꯠꯇ ꯁꯦꯜ ꯃꯔꯥꯡ ꯀꯥꯏꯅ ꯂꯩꯕ꯭ꯔꯥ ꯍꯥꯏꯕꯗꯨ ꯑꯩ ꯈꯪꯗꯦ꯫,Manipuri,sad
3528,ییٚلہ مےٚ پنٛنس پسندیدٕ لوئس لا آمور کتابہٕ مجموعس سۭتۍ وتھ الگ گٔیہ تہ مےٚ پیٚیہ پننہ کتابہٕ سیکنٛڈ ہینڈ کتاب فروشس کٕننہ، مےٚ گیہ زنگہ بہِتھ ۔,Kashmiri,sad
7077,ᱤᱧᱨᱮᱱ ᱩᱢᱮᱨᱟᱱ ᱟᱭᱳᱼᱵᱟᱵᱟ ᱱᱚᱣᱟ ᱟᱸᱡᱚᱢ ᱠᱟᱛᱮᱜ ᱠᱤᱱ ᱠᱩᱥᱤᱭᱮᱱᱟ ᱡᱮ ᱥᱚᱨᱠᱟᱨ ᱩᱢᱮᱨᱟᱱ ᱦᱚᱲᱠᱚ ᱞᱟᱹᱜᱤᱫ ᱮᱯᱷ ᱰᱤ ᱥᱩᱫ ᱥᱟᱣᱴᱮᱭ ᱵᱟᱲᱦᱟᱣ ᱮᱫᱟ ᱾,Santali,happy
11670,ᱤᱧᱤᱧ ᱦᱟᱦᱟᱲᱟᱜ ᱞᱮᱱᱟ ᱡᱚᱠᱷᱚᱡ ᱱᱟᱥᱟ ᱥᱟᱣ ᱤᱥᱨᱳᱼᱟᱜ ᱵᱷᱟᱹᱜᱤᱫᱟᱨ ᱟᱭ ᱮᱥ ᱮᱥᱼᱨᱮ ᱢᱤᱫ ᱦᱚᱲ ᱥᱮᱨᱢᱟ ᱥᱟᱸᱜᱷᱟᱹᱨᱤᱭᱟᱹ ᱠᱳᱞ ᱨᱮᱭᱟᱜ ᱩᱪᱷᱟᱹᱱ ᱦᱩᱭᱞᱮᱱᱟ !,Santali,surprise
11270,ᱳᱦ! ᱱᱚᱶᱟ ᱱᱟᱶᱟ ᱫᱳᱠᱟᱱ ᱟᱹᱨᱤ ᱚᱱᱟᱛᱮ ᱚᱥᱩᱵᱤᱫᱷᱟ ᱜᱮᱭᱟ ᱾ ᱱᱚᱶᱟ ᱫᱚ ᱠᱷᱟᱹᱞᱤ ᱚᱱᱟ ᱨᱮᱭᱟᱜ  ᱦᱟᱱᱛᱮ ᱱᱟᱛᱮ ᱯᱟᱨᱠᱤᱝ ᱟᱨ ᱵᱤᱥᱟᱹᱣ ᱥᱟᱞᱟᱜ ᱥᱩᱨᱥᱩᱯᱩᱨ ᱨᱮ ᱟᱨ ᱦᱚᱸ ᱮᱴᱠᱮᱴᱚᱬᱮᱭ ᱥᱤᱨᱡᱟᱹᱣ ᱮᱫᱟ ᱾,Santali,disgust
3343,ꯑꯩꯒꯤ ꯂꯣꯏꯅꯕꯤꯅ ꯑꯩꯒꯤ ꯃꯇꯦꯡ ꯌꯥꯎꯗꯅ ꯃꯁꯥꯒꯤ ꯑꯣꯏꯅ ꯌꯨꯝꯒꯤ ꯊꯕꯛ ꯄꯨꯝꯅꯃꯛ ꯆꯂꯥꯏꯕ ꯃꯇꯝꯗ ꯑꯩ ꯅꯨꯉꯥꯏꯇꯕ ꯐꯥꯎꯏ ꯫,Manipuri,sad
9645,ᱤᱧᱨᱮᱱ ᱟᱭᱳᱼᱵᱟᱵᱟ ᱠᱤᱱ ᱦᱟᱦᱟᱲᱟᱜ ᱩᱛᱟᱹᱨ ᱞᱮᱱᱟ ᱡᱚᱠᱷᱚᱱ ᱤᱧ ᱛᱟᱞᱟᱧᱤᱫᱟᱹ ᱟᱪᱠᱟ ᱧᱟᱯᱟᱢ ᱞᱟᱹᱜᱤᱫ ᱩᱱᱠᱤᱱᱟᱜ ᱫᱩᱣᱟᱹᱨᱤᱧ ᱠᱷᱟᱴᱼᱠᱷᱟᱴᱟᱣ ᱠᱮᱫᱟ ᱾,Santali,surprise
6338,ꯋꯥꯎ! ꯃꯁꯤꯒꯤ ꯁ꯭ꯃꯥꯔꯠ ꯐꯣꯟ ꯀꯦꯃꯦꯔꯥ ꯑꯁꯤꯅ ꯄ꯭ꯔꯣꯐꯦꯁꯅꯦꯜ ꯑꯣꯏꯕ ꯃꯒꯨꯟ ꯂꯩꯕ ꯐꯣꯇꯣꯁꯤꯡ ꯀꯥꯞꯄꯦ ꯫,Manipuri,surprise
6788,ریسٹورانٹس منٛز سٖست رفتار خدماتو كھور مے٘ شرارتھ ۔ مےٚ پیوٚو پنن آرڈر دنہٕ خٲطرٕ ابدس تام پیٛارٖن۔,Kashmiri,anger
5473,ꯃꯁꯤꯒꯤ ꯋꯥꯐꯝ ꯑꯁꯤ ꯃꯤꯌꯥꯝꯅ ꯌꯦꯡꯅꯕ ꯊꯝꯂꯒ  ꯍꯦꯟꯅ ꯑꯀꯥꯏꯕ ꯌꯥꯎꯗꯕ ꯋꯥꯐꯝꯁꯤꯡ ꯑꯗꯨꯅ ꯊꯨꯅ ꯂꯧꯊꯣꯛꯈꯤꯕ ꯍꯥꯏꯕꯁꯤ ꯑꯩ ꯋꯥ ꯍꯥꯏꯅꯤꯡꯉꯥꯏ ꯂꯩꯇꯔꯦ꯫,Manipuri,surprise
6594,ᱤᱧ ᱤᱧᱟᱹᱜ ᱡᱤᱯᱠᱟᱹᱣᱟᱱ ᱡᱤᱭᱚᱱᱨᱮ ᱟᱫ ᱟᱠᱟᱱ ᱫᱟᱣ ᱨᱮᱭᱟᱜ ᱠᱟᱛᱷᱟᱧ ᱩᱭᱦᱟᱹᱨ ᱞᱮᱠᱷᱟᱱ ᱵᱷᱟᱵᱽᱱᱟ ᱫᱚ ᱵᱟᱹᱧ ᱟᱴᱠᱟᱨᱟ ᱾,Santali,sad
5839,مےٚ چھنہٕ پتہ ز اسہ میلیاہ پنٛنہ پروڑکٹہٕ خٲطرٕ خام مال یُتھ  یہ  وقتس پیٚٹھ ڈلیوری باپت تیار ہیکو  کٔرتھ۔,Kashmiri,fear
8961,ᱤᱧᱨᱮᱱ ᱟᱭᱳᱼᱵᱟᱵᱟ ᱟᱹᱰᱤ ᱠᱤᱱ ᱠᱩᱥᱤ ᱞᱮᱱᱟ ᱡᱚᱠᱷᱚᱱ ᱟᱞᱮ ᱩᱱᱠᱤᱱᱟᱜ ᱵᱟᱯᱞᱟ ᱥᱮᱨᱢᱟ ᱯᱩᱨᱟᱹᱣ ᱢᱟᱱᱟᱣ ᱞᱟᱹᱜᱤᱫ ᱠᱮᱫᱳᱜ ᱡᱚᱢ ᱞᱟᱹᱜᱤᱫ ᱞᱮ ᱤᱫᱤ ᱞᱮᱫ ᱠᱤᱱᱟ ᱾,Santali,happy
1124,"ꯑꯩꯍꯥꯛꯅ ꯉꯔꯥꯡ ꯑꯍꯤꯡ ꯊꯋꯥꯏ ꯅꯨꯡꯉꯥꯏꯇꯕ ꯃꯃꯤ ꯀꯨꯝꯍꯩ ꯑꯃ ꯌꯦꯡꯈꯤ, ꯑꯃꯁꯨꯡ ꯃꯗꯨꯗꯒꯤ ꯑꯩꯍꯥꯛꯀꯤ ꯋꯥꯈꯜꯗ ꯑꯗꯨꯝ ꯀꯤꯍꯟꯗꯨꯅ ꯂꯩꯔꯦ꯫",Manipuri,fear
942,ᱟᱹᱱᱟᱹᱲᱤ ᱦᱚᱲᱟᱜ ᱢᱮᱫᱦᱟ ᱨᱮ ᱵᱚᱛᱚᱨᱟᱱ ᱞᱟᱸᱫᱟ ᱫᱚ ᱩᱱᱤ ᱟᱠᱽᱵᱟᱠᱚᱜ ᱞᱮᱠᱟᱱ ᱵᱚᱛᱚᱨ ᱛᱮᱭ ᱯᱮᱨᱮᱡ ᱠᱮᱫᱮᱭᱟ ᱾,Santali,fear
2499,ڈیٹا راونكہ خدشن کرنٲوِ تِم تہنزٕ اہم فایلہٕ مٗسلسل  بیک اپ ۔,Kashmiri,fear
7459,ꯑꯩꯅ ꯄꯤꯖꯖꯥ ꯑꯗꯨ ꯂꯩꯃꯥꯏꯗ ꯊꯥꯗꯣꯛꯈꯤꯗꯨꯅ ꯁꯣꯏꯗꯅ ꯃꯗꯨꯗ ꯅꯦꯠꯂꯨꯕꯗ ꯑꯩ ꯅꯨꯉꯥꯏꯇꯕ ꯐꯥꯎꯈꯤ꯫,Manipuri,sad
916,"ꯌꯨ. ꯄꯤ. ꯑꯥꯏ. ꯍꯧꯗꯣꯛꯈꯤꯕꯗꯒꯤ ꯍꯧꯅ, ꯑꯩꯅ ꯃꯄꯥꯟꯗ ꯁꯦꯜ ꯌꯥꯝꯅ ꯆꯥꯗꯤꯡ ꯇꯧꯔꯛꯂꯤ ꯑꯃꯁꯨꯡ ꯑꯩꯒꯤ ꯑꯦꯀꯥꯎꯟꯠꯇ ꯕꯦꯂꯦꯟ꯭ꯁ ꯌꯥꯝꯅ ꯅꯦꯝꯅ ꯌꯥꯎꯏ꯫",Manipuri,sad
10962,مےٚ گو ژس ییٚلہ نہ بہٕ واٮٔی فایی جُورِتھ  ہیوٚکُس ۔ از کل چھٗس مستحکم رٲبطس پیٹھ  پژھ كران ۔,Kashmiri,surprise
9666,میانہ سرمایہ کٲری چھ مےٚ رٹایٔرمینٹ باپتھ سیٹھاہ دِیوٗتمٗت ۔,Kashmiri,happy
11564,"ꯃꯁꯤꯒꯤ ꯕ꯭ꯔꯥꯟ ꯑꯁꯤꯅ ꯍꯧꯈꯤꯕ ꯆꯍꯤ ꯃꯉꯥꯗ ꯑꯁꯣꯏ ꯑꯉꯥꯝ ꯑꯃꯇ ꯂꯩꯈꯤꯗ꯭ꯔꯤ, ꯃꯔꯝ ꯑꯗꯨꯅ ꯅꯍꯥꯛꯅ ꯑꯁꯣꯏꯕ ꯊꯦꯡꯅꯩ ꯍꯥꯏꯕꯁꯤ ꯑꯩꯍꯥꯛꯅ ꯊꯥꯖꯕ ꯉꯝꯗꯦ꯫",Manipuri,surprise
11818,ꯋꯥꯟ ꯄ꯭ꯂꯁ ꯇꯤ.ꯚꯤ.ꯒꯤ ꯈꯪꯍꯧꯗꯅ ꯑꯃꯥꯡ ꯑꯇꯥ ꯊꯣꯛꯄꯒꯤꯁꯨ ꯌꯥꯎꯅ ꯀꯣꯟꯕ ꯋꯥꯔꯦꯟꯇꯤ ꯑꯃ ꯂꯩꯔꯝꯒꯅꯤ ꯍꯥꯏꯅ ꯑꯩꯍꯥꯛꯅ ꯊꯥꯖꯔꯨꯗꯦ꯫,Manipuri,surprise
8251,ᱰᱮᱴᱟ ᱯᱷᱟᱥᱟᱣ ᱨᱮᱭᱟᱜ ᱪᱤᱱᱛᱟᱹ ᱠᱷᱟᱹᱛᱤᱨ ᱛᱮ ᱟᱞᱮ ᱠᱟᱛᱮᱜ ᱟᱞᱮ ᱥᱚᱝᱵᱮᱫᱚᱱᱥᱤᱞ ᱵᱟᱰᱟᱭ ᱛᱮᱱᱟᱜ ᱠᱚ ᱮᱱᱠᱨᱤᱯᱴᱮᱰ ᱦᱩᱭᱮᱱ ᱛᱟᱞᱮᱭᱟ ᱾,Santali,fear
5636,ᱤᱧ ᱟᱹᱰᱤᱧ ᱟᱹᱲᱤᱥᱚᱜᱼᱟ ᱡᱚᱠᱷᱚᱱ ᱩᱛᱛᱚᱨ ᱵᱷᱟᱨᱚᱛᱤᱭᱟᱹ ᱠᱚ ᱫᱚᱠᱠᱷᱤᱱ ᱵᱷᱟᱨᱚᱛᱤᱭᱚ ᱠᱚ ᱥᱟᱶ ᱱᱮᱦᱚᱨ ᱥᱟᱞᱟᱜ ᱠᱚ ᱨᱚᱯᱚᱲᱼᱟ ᱟᱨ ᱯᱟᱹᱨᱥᱤ ᱠᱚ ᱱᱤᱥᱲᱟᱹᱣᱟ ᱾,Santali,anger
6033,بہٕ چھس یژھان امہ بدلہٕ بیٚیہ کینٛہہ مگر واریاہ رہنما چھ لوٗکن پیٹھ قلیل مدتی منافس پیٹھ توجہ مرکوٗز کرتھ نوجوان نسلہٕ خٲطرٕ اکھ خراب مثال قٲیم کران۔,Kashmiri,disgust
5713,"ᱤᱧ ᱠᱟᱺᱦᱤᱥ ᱩᱛᱟᱹᱨ  ᱟᱠᱟᱱᱟ ᱟᱨ ᱟᱞᱮ ᱡᱟᱦᱟᱸ ᱞᱮᱠᱟᱱ ᱪᱮᱞᱮᱧᱡᱽ ᱨᱮᱞᱮ ᱥᱟᱢᱟᱝᱼᱫᱟᱯᱨᱟᱢᱚᱜ ᱠᱟᱱᱟ, ᱠᱷᱟᱥᱠᱟᱨᱛᱮ ᱥᱮᱢᱞᱮᱫ ᱢᱩᱫᱽᱨᱮ, ᱚᱱᱟ ᱥᱟᱶᱛᱮ ᱩᱫᱜᱟᱹᱣ ᱛᱟᱦᱮᱱ ᱫᱚ ᱟᱡᱷᱟᱴ ᱜᱮᱭᱟ ᱾",Santali,sad
8556,ᱤᱧ ᱫᱚ ᱪᱟᱞᱟᱣᱮᱱ ᱧᱤᱫᱟᱹ ᱨᱮ ᱵᱟᱹᱝ ᱵᱟᱰᱟᱭ ᱛᱮᱜᱮ ᱦᱳᱥᱴᱮᱞ ᱢᱮᱥ ᱨᱮᱭᱟᱜ ᱢᱤᱫᱴᱟᱝ ᱠᱚᱞᱤᱧ ᱨᱟᱹᱯᱩᱫ ᱟᱠᱟᱫᱟ ᱟᱨ ᱤᱧ ᱫᱚ ᱟᱹᱰᱤᱧ ᱵᱚᱛᱚᱨᱚᱜ ᱠᱟᱱᱟ ᱡᱮ ᱩᱝᱠᱩ ᱫᱚ ᱤᱧ ᱠᱚ ᱮᱜᱮᱨᱤᱧᱟ ᱾,Santali,fear
2209,ᱟᱢ ᱪᱮᱫ ᱟᱹᱰᱤ ᱦᱟᱲᱟᱢ ᱢᱮᱱᱠᱷᱟᱱ ᱟᱢ ᱫᱚ ᱱᱤᱛᱦᱚᱸ ᱫᱤᱱᱜᱮ ᱑᱐ ᱠᱤᱞᱳᱢᱤᱴᱟᱨᱼᱮᱢ ᱛᱟᱲᱟᱢᱮᱫᱟ ᱾,Santali,surprise
7620,ꯃꯐꯝ ꯑꯗꯨꯒꯤ ꯁ꯭ꯔꯤꯂꯪꯀꯥꯒꯤ ꯆꯤꯟꯖꯥꯛꯁꯤꯡꯗ ꯌꯥꯎꯔꯤꯕ ꯃꯍꯥꯎ ꯃꯈꯜ ꯀꯌꯥꯒꯤ ꯑꯄꯨꯟꯕ ꯑꯁꯤ ꯑꯁꯨꯛ ꯍꯥꯎꯔꯝꯒꯅꯤ ꯍꯥꯏꯕ ꯑꯩ ꯊꯥꯖꯔꯨꯗꯦ ꯫,Manipuri,surprise
9065,ᱤᱧ ᱫᱚ ᱨᱟᱸᱜᱟᱣᱤᱧ ᱵᱩᱡᱷᱟ ᱡᱮ ᱠᱤᱪᱷᱩ ᱫᱤᱥᱚᱢ ᱡᱮᱜᱮᱫ ᱥᱮᱨᱢᱟ ᱠᱷᱚᱫᱨᱚᱱ ᱨᱮ ᱱᱩᱱᱟᱹᱜ ᱠᱟᱹᱣᱰᱤ ᱠᱚ ᱮᱢᱮᱫ ᱠᱟᱱᱟ ᱩᱱᱨᱮ ᱫᱷᱟᱹᱨᱛᱤᱨᱮ ᱟᱨᱦᱚᱸ ᱟᱱᱟᱴ ᱥᱟᱛᱟᱢ ᱠᱚᱫᱚ ᱵᱟᱝ ᱠᱚ ᱢᱟᱱᱟᱣᱮᱫ ᱠᱟᱱᱟ ᱾,Santali,anger
9533,"ꯂꯂꯣꯟ ꯏꯇꯤꯛꯁꯤꯡ ꯇꯧꯕꯗ ꯃꯈꯣꯏꯒꯤ ꯀꯁꯇꯃꯔꯁꯤꯡꯒꯤ ꯆꯦꯛꯁꯤꯟ ꯊꯧꯔꯥꯡꯗꯒꯤ ꯁꯦꯟꯗꯣꯡꯅ ꯍꯦꯟꯅ  ꯃꯔꯨ ꯑꯣꯏꯕ ꯋꯥꯐꯝ ꯊꯝꯂꯤꯕ, ꯃꯔꯨꯑꯣꯏꯅ ꯃꯈꯣꯏꯅ ꯃꯒꯨꯟ ꯂꯩꯇꯕ ꯋꯥꯏꯌꯔꯁꯤꯡꯕꯨ ꯑꯋꯥꯡꯕ ꯊꯥꯛꯀꯤ ꯑꯣꯏꯅ ꯎꯠꯄꯗꯨ, ꯑꯩ ꯌꯥꯝꯅ ꯄꯥꯝꯗꯦ ꯫",Manipuri,disgust
3559,ꯑꯩꯅ ꯌꯨ. ꯑꯦꯁ. ꯗ ꯆꯠꯈꯤꯕ ꯃꯇꯝꯗ ꯑꯩꯒꯤ ꯑꯉꯥꯡ ꯑꯗꯨ ꯚꯥꯔꯠꯇ ꯃꯇꯣꯝꯇ ꯍꯨꯟꯗꯣꯛꯂꯝꯈꯤꯕꯒꯤꯗꯃꯛ ꯑꯩ ꯅꯤꯡꯉꯝꯗꯕ ꯐꯥꯎꯈꯤ ꯫,Manipuri,sad
1690,یہ چھ ننہ وانہٕ حیرت انگیز۔,Kashmiri,surprise
1667,فٹ بال کھلٲڑین ہنٛد لگاتار زخٕم لگنٕکۍ الزام دِنۍ چھُ شرمناک۔۔,Kashmiri,disgust
11493,ꯃꯨꯝꯕꯥꯏꯒꯤ ꯃꯅꯥꯛꯇ ꯂꯩꯕ ꯆꯤꯡꯁꯤꯡꯗ ꯑꯁꯤꯒꯨꯝꯕ ꯐꯖꯔꯕ ꯍꯥꯏꯀꯤꯡꯒꯤ ꯂꯝꯕꯤꯁꯤꯡ ꯐꯪꯒꯅꯤ ꯍꯥꯏꯅ ꯑꯩꯅ ꯀꯩꯗꯧꯅꯨꯡꯗ ꯃꯃꯥꯡꯗ ꯈꯟꯈꯤꯗꯦ꯫,Manipuri,surprise
885,اصل، یہ اوس سیٹھاہ تیز میٲنۍ  پونٛسہٕ آیہ زٕ سیکنڈن منٛز ٹرانسفر کرنہٕ,Kashmiri,surprise
11777,ᱤᱧ ᱪᱮᱫᱟᱜ ᱱᱚᱣᱟ ᱯᱚᱛᱚᱵ ᱱᱤᱛ ᱦᱚᱸ ᱵᱟᱹᱧ ᱯᱟᱲᱦᱟᱣ ᱟᱠᱟᱫᱟ ᱚᱱᱟ ᱞᱟᱹᱜᱤᱫ ᱤᱧ ᱫᱚ ᱱᱤᱡ ᱵᱟᱵᱚᱫᱛᱮ ᱟᱹᱲᱤᱥᱤᱧ ᱵᱩᱡᱷᱮᱫ ᱠᱟᱱᱟ ᱾,Santali,disgust
8905,"ꯑꯣꯍ! ꯑꯩ ꯑꯁꯤꯒꯨꯝꯕ ꯁꯦꯟꯗꯣꯏ ꯌꯥꯝꯗꯕ ꯂꯣꯟ ꯑꯃ ꯂꯧꯕ ꯌꯥꯏ ꯍꯥꯏꯕ ꯈꯪꯂꯨꯗꯦ꯫ ꯑꯩꯉꯣꯟꯗ ꯈꯪꯍꯟꯕꯤꯕꯒꯤꯗꯃꯛ ꯊꯥꯒꯠꯆꯔꯤ, ꯃꯤꯁꯇꯔ ꯗꯦꯕꯤꯗ꯫",Manipuri,surprise
853,بہٕ چھس نہٕ یژھان ژٕ گژھکھ مےٚ پرٛیتھ ساتہٕ ونن ز مےٚ کیٛاہ چھ کرن۔ امہ سۭتۍ چھ مےٚ جیرٕ وۄتھان۔,Kashmiri,anger
996,ᱤᱧ ᱤᱧᱟᱹᱜ ᱥᱤᱴ ᱨᱮᱭᱟᱜ ᱟᱨᱢᱨᱮᱥᱴ ᱠᱮᱴᱮᱡ ᱥᱟᱹᱦᱤᱡ ᱤᱧ  ᱥᱟᱵ ᱠᱮᱫᱟ ᱟᱨ ᱜᱚᱴᱟ  ᱯᱷᱞᱟᱭᱤᱴ ᱜᱮ ᱡᱳᱨ ᱛᱮ ᱦᱤᱞᱟᱹᱜ ᱠᱷᱟᱹᱛᱤᱨᱛᱮ ᱤᱧ ᱩᱫᱜᱟᱹᱨᱤᱧ   ᱮᱦᱚᱵ ᱮᱱᱟ ᱾,Santali,fear
6953,بہٕ چُھس بیڈ اسمبلی عملس متعلق واریاہ پریشانی محسوس کران ۔,Kashmiri,fear
2287,ᱩᱱᱤ ᱦᱚᱲᱟᱜ ᱦᱚᱲᱟᱜ ᱱᱚᱝᱠᱟᱱ ᱵᱮᱣᱦᱟᱨᱛᱮ ᱤᱧ ᱟᱹᱰᱤᱧ ᱨᱟᱹᱜᱤᱭᱮᱱᱟ ᱾ ᱤᱧ ᱫᱚ ᱩᱱᱤᱧ ᱛᱷᱟᱯᱟ ᱤᱭᱟ ᱡᱩᱫᱤ ᱩᱱᱤ ᱟᱨᱦᱚᱸ ᱠᱤᱪᱷᱩ ᱴᱤᱲᱤᱡ ᱞᱟᱹᱜᱤᱫ ᱱᱚᱝᱠᱟᱜᱮᱭ ᱵᱮᱣᱦᱟᱨᱼᱟ ᱾,Santali,anger
10029,اگر توہۍ  تہِ ژٲرَیو  یہ نہٕ نوکری ہندس امکانس تہٕ تہنزن دلچسپین سۭتۍ  ہم آہنگ آسِہ ، یہ ہیٚکہ تۄہہ مستقبلس منٛز نقصان واتنٲوِتھ،پروفیسر,Kashmiri,fear
3816,ꯁꯤꯃꯦꯇ꯭ꯔꯤ ꯑꯗꯨꯗꯒꯤ ꯁꯥꯊꯤꯕ ꯑꯀꯤꯕꯒꯤ ꯈꯣꯜꯂꯥꯎ  ꯑꯃ ꯇꯥꯔꯨꯕꯗꯒꯤ ꯑꯩ ꯆꯞ ꯌꯨꯡꯉꯒ ꯂꯩꯈꯤ ꯫,Manipuri,fear
554,مےٚ اوس نہٕ سوچمت ز تمن آسہ یہ ٹوسٹر واریاہن رنگن منٛز تہٕ ییٚلہ تمن اوس بہٕ گوس حیران۔,Kashmiri,surprise
1033,ꯑꯩ ꯌꯥꯝꯅ ꯀꯞꯄ ꯁꯤꯅꯦꯃꯥꯁꯤꯡ ꯌꯦꯡꯗꯦ ꯃꯔꯝꯗꯤ ꯃꯈꯣꯏꯅ ꯑꯩꯉꯣꯟꯗ ꯑꯋꯥꯕ ꯄꯤ ꯫,Manipuri,sad
1558,مےٚ چھ دل سٮ۪ٹھاہ تنٛگ گژھان ییٚلہ بہٕ ایمریكاہس منز  شٗرین گولہِ لاینہِ وٗچھان چھٗس ۔,Kashmiri,anger
8316,ꯑꯣꯖꯥ ꯑꯗꯨꯅ ꯑꯩꯒꯤ ꯏꯆꯥꯒꯤ ꯃꯇꯥꯡꯗ ꯂꯩꯔꯤꯕ ꯃꯤꯠꯌꯦꯡ ꯑꯗꯨꯒꯤ ꯈꯜꯂꯒ ꯑꯩꯅ ꯂꯥꯛꯀꯗꯧꯔꯤꯕ ꯃꯃꯥ ꯃꯄꯥꯒ ꯑꯣꯖꯥꯒꯒꯤ ꯎꯟꯅꯕ ꯑꯁꯤꯒꯤ ꯃꯇꯥꯡꯗ ꯆꯔꯥꯡꯅꯕ ꯐꯥꯎꯏ꯫,Manipuri,fear
7856,بہٕ چھس ناراض تکیاز ژٕ چھکھ  لوکن تھی بے جا بیان دوان تس نوس خریدارس متعلق ییٚمی سیٹھاہ کوشش کٔرِتھ زیون۔,Kashmiri,anger
3379,بہٕ  چھٗس  نار ژاپان  ز زمیندارن  ہنٛد طرفٕ حٮ۪مایت تہٕ مٗنظمیت نہٕ آسنہٕ موكھہٕ  چھےٚ موٚزوٗرن ہٕنٛز ہنٛز محنت ضایع گژھان۔,Kashmiri,anger
9367,ꯑꯣꯔꯗꯔ ꯑꯁꯤꯅ ꯑꯔꯣꯏꯕꯗ ꯑꯣꯏꯔꯛꯂꯤꯕ ꯐꯤꯕꯝ ꯑꯁꯤꯅ ꯑꯩꯉꯣꯟꯗ ꯍꯩꯅꯗꯕ ꯑꯃ ꯐꯥꯎꯍꯜꯂꯦ꯫ ꯑꯩꯍꯥꯛꯅ ꯑꯩꯍꯥꯛꯀꯤ ꯆꯥꯛꯁꯪꯗ ꯐꯥꯎꯕ ꯂꯩꯅꯤꯡꯗꯕꯒꯤ ꯐꯤꯕꯝ ꯑꯃꯗ ꯂꯩꯔꯤ ꯫,Manipuri,disgust
1861,"ꯑꯩꯅ ꯒꯣꯜ ꯀꯌꯥ ꯑꯃ ꯆꯟꯒꯗꯕꯗꯒꯤ ꯉꯥꯛꯊꯣꯛꯈꯤ ꯑꯗꯨꯃꯛꯇꯗ, ꯑꯩꯍꯥꯛꯀꯤ ꯀꯟꯅ ꯍꯣꯠꯅꯖꯕ ꯑꯗꯨ ꯃꯇꯤꯛ ꯆꯥꯕ ꯑꯣꯏꯈꯤꯗꯦ ꯑꯃꯁꯨꯡ ꯑꯇꯣꯞꯄ ꯇꯤꯝ ꯑꯗꯨꯅ ꯃꯥꯏꯄꯥꯛꯈꯤꯔꯝꯃꯤ ꯫",Manipuri,sad
5874,بہٕ چھس یوٗ کے منز موسمہٕ سۭتۍ پرٛیتھ وز پریشان گژھان ییٚتہ کانٛہہ تہ چھنہٕ ؤنتھ ہیکان ز کر لاگہ رُود,Kashmiri,surprise
10103,ꯃꯍꯩꯔꯣꯏ ꯑꯗꯨꯅ ꯃꯍꯥꯛꯀꯤ ꯏꯃꯨꯡ ꯃꯅꯨꯡ ꯑꯗꯨꯕꯨ ꯃꯍꯥꯛꯅ ꯅꯨꯡꯉꯥꯏꯍꯟꯕ ꯉꯝꯗ꯭ꯔꯦ ꯍꯥꯏꯅ ꯃꯍꯥꯛꯅ ꯌꯥꯝꯅ ꯋꯥꯈꯤ ꯫,Manipuri,sad
4416,ᱥᱟᱱᱟᱢ ᱚᱠᱛᱮ ᱟᱹᱰᱤ ᱰᱷᱮᱨ ᱵᱩᱞᱩᱝ ᱮ ᱠᱚᱭᱼᱟ ! ᱟᱢ ᱵᱟᱰᱟᱭᱟ ᱡᱮ ᱱᱚᱶᱟ ᱟᱢᱟᱜ ᱰᱟᱭᱮᱴ ᱞᱟᱹᱜᱤᱫ ᱵᱷᱟᱜᱮ ᱫᱚ ᱵᱟᱝ ᱠᱟᱱᱟ ᱪᱮᱫᱟᱜ ᱥᱮ ᱟᱢᱟᱜ ᱩᱪᱪᱚ ᱢᱟᱭᱟᱝ ᱪᱟᱯ ᱢᱮᱱᱟᱜᱼᱟ ᱾,Santali,anger
5937,ٹور بسہ منز سفر کرنہٕ سۭتۍ گوٚو مےٚ دل خراب تکیاز یہ ٲس نہٕ آرام دہ تہٕ اتھ ٲس نہٕ  زنگن کڈنچ جایی۔,Kashmiri,anger
3567,ᱚᱠᱚᱭᱦᱚ ᱱᱚᱝᱠᱟᱱ ᱚᱵᱷᱚᱫᱨᱚ ᱵᱮᱣᱦᱟᱨ ᱥᱟᱦᱟᱣ ᱵᱟᱝ ᱦᱩᱭᱩᱜ ᱛᱟᱯᱮᱭᱟ ᱟᱨ ᱜᱚᱲᱚ ᱠᱷᱚᱡ ᱚᱠᱛᱮ ᱟᱹᱲᱤᱥ ᱵᱟᱝ ᱟᱹᱭᱠᱟᱹᱣ ᱦᱩᱭᱩᱜ ᱛᱟᱯᱮᱭᱟ ᱾ ᱤᱧ ᱠᱟᱹᱢᱤᱭᱟᱹᱣᱟᱜ ᱱᱤᱨᱜᱷᱤᱱ ᱟᱨ ᱚᱵᱷᱚᱫᱨᱚ ᱵᱮᱣᱦᱟᱨ ᱞᱟᱹᱜᱤᱫ ᱜᱟᱹᱦᱤᱨ ᱥᱟᱹᱦᱤᱡ ᱤᱠᱟᱹᱧ ᱠᱷᱚᱡᱚᱜ ᱠᱟᱱᱟ ᱾,Santali,disgust
1621,ᱵᱷᱤᱰᱤᱭᱳᱼᱠᱚᱱᱯᱷᱟᱨᱮᱱᱥᱤᱝ ᱟᱵᱚᱣᱟᱜ ᱜᱷᱟᱨᱚᱸᱡᱽ ᱠᱚᱭ ᱡᱩᱢᱤᱫ ᱟᱠᱟᱫ ᱵᱚᱱᱟ ᱟᱨ ᱡᱮᱜᱮᱫ ᱨᱮᱭᱟᱜ ᱡᱟᱦᱟᱸ ᱴᱚᱴᱷᱟ ᱨᱮᱜᱮ ᱛᱟᱦᱮᱱ ᱢᱮᱥᱮ ᱡᱚᱛᱚ ᱦᱚᱲᱟᱜ ᱠᱚᱣᱟᱜ ᱢᱚᱪᱟᱨᱮ  ᱨᱟᱹᱥᱠᱟᱹ ᱞᱟᱸᱫᱟ ᱧᱮᱞᱧᱟᱢᱚᱜᱼᱟ,Santali,happy
5556,ᱤᱧ ᱤᱵᱷᱮᱱᱴ ᱪᱟᱞᱟᱣ ᱚᱠᱛᱚ ᱤᱵᱷᱮᱱᱴ ᱢᱮᱱᱮᱡᱟᱨ ᱟᱜ ᱵᱤᱱᱼᱡᱳᱜᱢᱟᱱ ᱚᱡᱮᱛᱮ ᱟᱹᱲᱤᱥ ᱞᱤᱱᱟᱹᱧ ᱡᱟᱦᱟ ᱫᱚ ᱤᱧᱟᱹᱜ ᱯᱩᱨᱟᱹ ᱚᱠᱛᱚᱭ ᱠᱷᱟᱨᱵᱟᱣ ᱞᱮᱫᱟ ᱾,Santali,anger
10410,بڑونہِ جایداد ٹیكسہٕ كِنہِ چھے٘ مے٘ سیٹھاہ مٲلی پریشانی گٲمٕژ ۔,Kashmiri,fear
11222,ꯃꯨꯝꯕꯥꯏꯗ ꯃꯐꯝ ꯑꯗꯨꯒꯤ ꯐꯦꯁꯟꯒꯤ ꯐꯤꯚꯝ ꯌꯥꯝꯅ ꯃꯇꯝꯒ ꯆꯨꯅꯕ ꯑꯃꯁꯨꯡ ꯑꯀꯦ ꯑꯃꯧꯒꯤ ꯃꯥꯑꯣꯡꯒꯤ ꯑꯣꯏ ꯫,Manipuri,happy
9123,میون نیٚچو چھنہٕ فٹ بال زیادٕ گندان مگر بہٕ چھس حیرتس  گژھان ز سہ کوتاہ علم چھ اتھ گیمِہ متعلق  ہاوان۔,Kashmiri,surprise
5208,کھُرۍ لد ٹریفک آسنہٕ کنۍ اوسس بہٕ دلہ پیٹھ منالی تام گٲڑۍ چلاونس خلاف، مگر مےٚ تھووکھ نہٕ کانہہ چارہ۔,Kashmiri,disgust
3849,ꯀꯔꯤꯒꯨꯝꯕ ꯑꯩꯅ ꯋꯥꯐꯝꯁꯤꯡ ꯑꯁꯤ ꯄꯨꯈꯠꯂꯛꯄ ꯇꯥꯔꯕꯗꯤ ꯅꯍꯥꯛꯄꯨ ꯃꯥꯡꯖꯒꯅꯤ ꯍꯥꯏꯅ ꯑꯩ ꯀꯤꯖꯩ꯫,Manipuri,fear
11856,ꯑꯩꯍꯥꯛꯀꯤ ꯇꯤꯀꯦꯠ ꯕꯨꯀꯤꯡ ꯇꯧꯕ ꯃꯇꯝꯗ ꯔꯦꯜꯋꯦꯒꯤ ꯕꯨꯀꯤꯡ ꯀ꯭ꯂꯔꯛ ꯑꯗꯨꯅ ꯑꯩꯉꯣꯟꯗ ꯇꯥꯊꯤ ꯇꯥꯑꯣꯏꯅ ꯇꯧꯔꯛꯄ ꯃꯇꯝꯗ ꯑꯩꯍꯥꯛꯅ ꯌꯥꯝꯅ ꯁꯥꯎꯅꯤꯡꯕ ꯐꯥꯎꯈꯤ꯫,Manipuri,anger
6367,کمپٔنی ہنٛدِ اعلی انتظامیہ كہِ  نیرنہٕ چہ خبرِ سۭتۍ گوٚو ملٲزِمن ہنٛد حوصلہٕ کم۔,Kashmiri,sad
9135,ᱥᱳᱯᱴᱳᱣᱟᱨ ᱜᱚᱲᱵᱚᱲ ᱤᱫᱤ ᱠᱟᱛᱮᱜ ᱞᱮᱛᱟᱲ ᱟᱹᱠᱩᱛ ᱫᱚ ᱨᱮᱜᱩᱞᱟᱨ ᱥᱤᱥᱴᱮᱢ ᱟᱯᱰᱮᱴᱼᱮ ᱩᱢᱟᱴᱟᱹᱣ ᱟᱠᱟᱫᱟ ᱾,Santali,fear
508,مے٘ كو٘ر پنٛنہ كارِ  خٲطرٕ ڈرایور انٛنٗك   فٲصلہٕ خۄش تاكہِ بہٕ ہیكہٕ دوٗر سفرن دوران آرام كرِتھ ۔,Kashmiri,happy
4393,ژٕ چھُکھ  مے زخم دِنہ   پتہ بے عزتی کران ییٚلہ ژٕ اتھ ایپس تابناک تعریف چھُکھ کران یُس نہ میانہ باپت کٲمٕے چھُ کران۔,Kashmiri,anger
4231,ꯑꯩ ꯉꯁꯤ ꯇꯤ. ꯚꯤ. ꯑꯗꯨ ꯁ꯭ꯋꯤꯆ ꯑꯣꯟ ꯇꯧꯅꯕ ꯍꯣꯠꯅꯈꯤ ꯑꯗꯨꯕꯨ ꯑꯩꯅ ꯑꯃꯨꯕ ꯁ꯭ꯀ꯭ꯔꯤꯟ ꯈꯛꯇ ꯎꯕ ꯐꯪꯉꯤ꯫,Manipuri,sad
6629,ꯃꯥꯏꯊꯤꯕꯒꯤ ꯋꯥꯈꯜ ꯑꯗꯨꯅ ꯑꯩꯉꯣꯟꯗ ꯃꯄꯨꯡꯐꯥꯅ ꯍꯩꯅꯗꯕ ꯑꯣꯏ ꯑꯃꯁꯨꯡ ꯃꯗꯨꯒꯤ ꯃꯇꯝ ꯑꯗꯨꯗꯅꯤ ꯑꯩ ꯏꯁꯥꯃꯛꯄꯨ ꯅꯨꯡꯁꯤꯖꯗꯕꯁꯤ꯫,Manipuri,disgust
10662,مےٚ چھُ فلیپکارٹ کہ طرفہٕ پننس آرڈرس پیٹھ لگاتار غلطین سۭتۍ مقابلہٕ پیوان کرُن تہٕ بہٕ کرٕ تمن نشہ خریدٲری  بنٛد۔,Kashmiri,anger
4789,یٗتھٗے گرٛزونِس دریاوس نِش واتان چھِ ،دِل چھٗ بیہ سٕتۍ تیز دوان ۔,Kashmiri,fear
574,ꯇꯥꯃꯤꯜ ꯑꯁꯤ ꯃꯥꯂꯦꯝꯗ ꯈ꯭ꯋꯥꯏꯗꯒꯤ ꯂꯤꯔꯕ ꯂꯣꯟꯅꯤ ꯍꯥꯏꯅ ꯑꯩꯉꯣꯟꯗ ꯍꯥꯏꯔꯛꯄ ꯃꯇꯝꯗ ꯌꯥꯝꯅ ꯅꯨꯡꯉꯥꯏꯕ ꯐꯥꯎꯈꯤ ꯫,Manipuri,happy
4661,کنہہ تاریک دۄہ چھ آسان ییٚلہ بہٕ سونٛچان چھس ز یہ زندگی گزارنک کیا مطلب چھ؟,Kashmiri,sad
4081,ᱤᱧ ᱡᱚᱠᱷᱚᱱ ᱵᱮᱝᱠ ᱨᱮ ᱞᱚᱠᱟᱨ ᱪᱟᱠᱟᱣ ᱤᱧ ᱪᱟᱞᱟᱣ ᱞᱮᱱᱟ ᱩᱱᱫᱚ ᱤᱧᱤᱧ ᱵᱷᱟᱵᱽᱱᱟ ᱩᱛᱟᱹᱨ ᱞᱮᱱᱟ ᱟᱨ ᱢᱤᱫ ᱴᱟᱲᱟᱝ ᱞᱟᱹᱜᱤᱫ ᱛᱮᱦᱚᱸ ᱚᱠᱚᱭ ᱦᱚᱸ ᱤᱧ ᱜᱚᱲᱚ ᱞᱟᱹᱜᱤᱫ ᱛᱮ ᱟᱴᱩᱼᱯᱟᱹᱴᱩ ᱵᱟᱠᱚ ᱩᱫᱩᱜ ᱟᱠᱟᱫᱟ ᱾,Santali,sad
5022,ꯑꯩꯍꯥꯛꯅ ꯍꯧꯖꯤꯛ ꯍꯧꯖꯤꯛꯇꯤ ꯇꯨꯡꯒꯤꯗꯃꯛ ꯇꯁꯦꯡꯅ ꯁꯦꯜ ꯇꯨꯡꯁꯤꯟꯕ ꯉꯝꯗꯕ ꯑꯁꯤꯅ ꯃꯔꯝ ꯑꯣꯏꯔꯒ ꯑꯩꯍꯥꯛ ꯇꯁꯦꯡꯅ ꯊꯋꯥꯏ ꯅꯨꯡꯉꯥꯏꯇꯦ꯫,Manipuri,sad
5303,مےٚ چھےٚ یہ موسیقی بوزنٕچ واریاہ خوشی۔ یہ چھ مےٚ ہمیشہٕ خوش مزازٕ تھاوان۔,Kashmiri,happy
6323,کٔمۍ تام چھےٚ سیٖٹہ پٮ۪ٹھ الٹی ترٛٲومٕژ تہٕ اتھ چھ تیتھ پھکھ یوان۔,Kashmiri,disgust
5300,ᱤᱧ ᱫᱚ ᱦᱟᱢᱟᱞ ᱛᱩᱞᱟᱹ ᱛᱩᱞᱤᱧ ᱵᱚᱛᱚᱨᱚᱜ ᱠᱟᱱᱟ ᱾ ᱤᱧ ᱜᱷᱟᱹᱞ ᱞᱮᱱ ᱠᱷᱟᱱ ᱪᱮᱫ ᱦᱩᱭᱩᱜᱼᱟ ?,Santali,fear
4133,"ᱵᱟᱹᱲᱤᱡ ᱥᱟᱹᱦᱤᱡ ᱥᱟᱯᱲᱟᱣ ᱟᱠᱟᱱ ᱟᱠᱷᱲᱟ ᱥᱮᱢᱞᱮᱫ ᱞᱟᱹᱜᱤᱫ ᱡᱚᱛᱚ ᱦᱚᱲ ᱴᱷᱮᱱ ᱠᱷᱚᱱ ᱥᱟᱨᱦᱟᱣ ᱫᱚ ᱚᱵᱷᱟᱵᱽ ᱟᱱᱟᱜ ᱛᱟᱦᱮᱸ ᱠᱟᱱᱟ, ᱠᱷᱟᱥ ᱠᱟᱨᱛᱮ ᱱᱚᱶᱟ ᱫᱚ ᱮᱛᱚᱦᱚᱵ ᱠᱷᱚᱱ ᱢᱩᱪᱟᱹᱫ ᱫᱷᱟᱹᱵᱤᱡ ᱢᱤᱫᱴᱟᱝ ᱫᱟᱹᱵ ᱛᱟᱦᱮᱸ ᱠᱟᱱᱟ ᱾",Santali,disgust
8563,ᱟᱢ ᱪᱮᱫ ᱵᱟᱢ ᱵᱟᱰᱟᱭᱼᱟ ᱡᱮ ᱤᱧ ᱫᱚ ᱟᱢᱟᱜ ᱵᱮᱝᱠ ᱨᱮᱱ ᱜᱟᱦᱟᱨ ᱠᱟᱹᱱᱟᱹᱧ ? (ᱠᱟᱥᱴᱚᱢᱟᱨ),Santali,disgust
