id,Sentence,language,emotion
2401,بہٕ چھس پریشان ز صحت مرکز چھ غٲر معینہ مدتس تام بنٛد كرنہٕ آمٗت تہٕ مے٘ چھٗ تعجِب زِ  یہ کر گژھِ  سانِہ خٲطرٕ دوبارٕ دٔستیاب۔,Kashmiri,fear
271,"ᱟᱵᱚᱣᱟᱜ ᱥᱮᱪᱮᱫ ᱵᱚᱱᱫᱮᱡ ᱪᱮᱛᱟᱱ ᱨᱮ ᱵᱤᱱᱼᱡᱩᱠᱛᱤᱭᱟᱱ ᱵᱮᱣᱦᱟᱨ ᱠᱷᱟᱹᱛᱤᱨᱛᱮ ᱤᱧ ""᱓ ᱤᱰᱤᱭᱚᱴᱥ ""ᱧᱮᱞ ᱤᱧ ᱠᱩᱥᱤᱭᱟᱜᱼᱟ ᱾",Santali,happy
7340,ꯃꯍꯥꯛꯅ ꯍꯥꯏꯋꯦꯗ ꯁ꯭ꯇꯟꯠꯃꯦꯟ ꯑꯃꯒꯨꯝꯅ ꯒꯥꯔꯤ ꯊꯧꯈꯤꯕ ꯃꯇꯝꯗꯨꯗ ꯑꯩ ꯕꯁ ꯊꯧꯕ ꯃꯤꯑꯣꯏ ꯑꯗꯨꯗ ꯁꯥꯎꯅꯤꯡꯈꯤ꯫,Manipuri,anger
7191,ᱱᱚᱶᱟ ᱜᱮᱢᱨᱮ ᱟᱭᱢᱟ ᱢᱟᱸᱭᱟᱸᱝ ᱟᱨ ᱦᱤᱸᱥᱟᱹᱣᱟᱱᱟᱜ ᱢᱮᱱᱟᱜᱼᱟ ᱾ ᱪᱮᱫᱟᱜ ᱡᱟᱦᱟᱭ ᱱᱚᱣᱟᱠᱚ ᱠᱷᱮᱞᱼᱟ ?,Santali,disgust
4940,مےٚ چھنہٕ بہوانٕے ز تم چھ یمن پلون مفتٕے شیران۔,Kashmiri,surprise
6187,ᱟᱢ ᱢᱤᱫᱴᱟᱝ ᱟᱹᱰᱤ ᱱᱟᱯᱟᱭᱮᱢ ᱠᱟᱹᱢᱤ ᱟᱠᱟᱫᱟ ᱟᱨ ᱟᱜᱟᱢ ᱩᱭᱦᱟᱹᱨᱟᱱ ᱢᱟᱹᱦᱤᱛ ᱢᱟᱲᱟᱝᱨᱮ ᱠᱟᱹᱢᱤᱢ ᱢᱩᱪᱟᱹᱫ ᱟᱠᱟᱫᱟ ᱾,Santali,happy
4243,ꯃꯍꯥꯛꯀꯤ ꯏꯃꯨꯡ ꯃꯅꯨꯡ ꯂꯩꯈꯤꯗ꯭ꯔꯕ ꯃꯇꯨꯡꯗ ꯃꯍꯥꯛ ꯊꯝꯃꯣꯏ ꯁꯣꯛꯈꯤ ꯑꯃꯁꯨꯡ ꯃꯍꯥꯛꯀꯤ ꯄꯨꯟꯁꯤ ꯏꯍꯥꯡ ꯍꯥꯡꯈꯤ ꯫,Manipuri,sad
7873,دوُرِ كٗلہِ لٕنجہِ ہٗند كراف چھٗ مے٘ اكہِ ژیہہِ كِس  گھبراہٹس منز سوزان ۔,Kashmiri,fear
8473,مےٚ چھ ہفتہٕ كین ستن دوہن تھكھہٕ ورٲیہِ كٲم كرنہٕ سٕتہِ پان  تھوٚکمت تہٕ ژھیوٚنمت باسان۔,Kashmiri,sad
1417,ꯑꯅꯧꯕ ꯇꯦꯛ꯭ꯁꯀꯤ ꯑꯥꯏꯟꯁꯤꯡ ꯑꯁꯤ ꯌꯥꯝꯅ ꯐꯖꯩ! ꯑꯩ ꯆꯍꯤ ꯑꯁꯤꯗ ꯍꯦꯟꯅ ꯅꯦꯝꯕ ꯇꯦꯛ꯭ꯁ ꯊꯤꯕ ꯌꯥꯏ!,Manipuri,surprise
4590,یہِ محسوس كرِتھ چھٗ مے٘ سیٹھاہ جان باسان زِ فرجس منز  زیادٕ شین بنن تہٕ آب نیرِتھ ژلٗن ییہ ٹھیک كرنہٕ امیُک مل صاف کرُں چھٗ سیٹھاہ مُشکلِ,Kashmiri,happy
9163,بہٕ گوس سیٹھاہ شاد  ییٚلہ بینک افسرن پونسہٕ كڈنس منز مےٚ مدد کرنہٕ خٲطرٕ مداخلت کٔر ییٚلہ بہٕ بند گژھنہٕ پتہٕ  پانژھ مِنٹ بینک ووتٗس ۔,Kashmiri,happy
30,ᱤᱧᱟᱹᱜ ᱟᱨᱢᱨᱮᱥᱴ ᱡᱟᱨᱯᱟᱣᱟᱱ ᱯᱷᱞᱟᱭᱤᱴ ᱨᱮᱱ ᱵᱟᱨᱭᱟ ᱯᱮᱹᱥᱮᱧᱡᱟᱨ ᱢᱩᱫᱽᱨᱮ ᱥᱭᱟᱱᱰᱣᱭᱤᱪ ᱦᱩᱭ ᱛᱟᱭᱚᱢ ᱤᱧᱫᱚ ᱵᱚᱛᱚᱨᱛᱤᱧ ᱯᱮᱨᱮᱡ ᱞᱮᱱᱟ ᱾,Santali,sad
9053,اسہ گوٚو ایی۔ بی کارکنن سۭتۍ بحث تکیازِ تِم ٲسۍ سون مسلہٕ حل کرنہٕ خٲطرٕ واریاہ پونسہٕ ژھاران۔,Kashmiri,anger
288,مےٚ چھ وُچھمت ز لکن ہنٛدین جذباتن ٹھیس واتاونہٕ خٲطرٕ چھ صاف دلی اکھ اصل بہانہٕ پٲٹھۍ استعمال یوان کرنہٕ تہٕ امی وجہ سۭتۍ چھ مےٚ تہنٛدۍ الفاظ ناگوار باسان۔,Kashmiri,disgust
10440,ꯁꯤꯠ ꯁꯦꯡꯕꯒꯤ ꯁꯨꯄꯔꯕꯥꯏꯖꯔ ꯑꯗꯨꯅ ꯑꯋꯥꯃꯟ ꯄꯤꯕꯒꯤ ꯑꯃꯁꯨꯡ ꯊꯕꯛ ꯆꯂꯥꯏꯕꯒꯤ ꯃꯇꯥꯡꯗ ꯈꯪ ꯍꯩꯕ ꯑꯁꯤꯅ ꯑꯩꯍꯥꯛꯄꯨ ꯌꯥꯝꯅ ꯉꯛꯍꯜꯂꯤ꯫ ꯃꯍꯥꯛꯅ ꯃꯍꯥꯛꯀꯤ ꯇꯤꯝꯒꯤꯗꯃꯛꯇ ꯔꯤꯋꯥꯔ꯭ꯗ ꯃꯣꯗꯦꯜ ꯑꯃ ꯁꯦꯝꯈꯤ꯫,Manipuri,surprise
6799,ᱤᱧ ᱥᱤᱜᱤᱞ ᱞᱮᱠᱟᱛᱮ ᱤᱧᱟᱹᱜ ᱚᱲᱟᱜ ᱨᱤᱱ ᱦᱟᱛᱟᱣ ᱨᱮᱭᱟᱜ ᱒ ᱥᱮᱨᱢᱟ ᱢᱩᱫᱨᱮᱧ ᱮᱢ ᱨᱩᱣᱟᱹᱲ ᱟᱠᱟᱫᱟ ᱟᱨ ᱱᱚᱶᱟ ᱫᱚ ᱤᱧᱟᱹᱜ ᱢᱚᱱ ᱠᱷᱚᱱ ᱢᱤᱫᱴᱟᱝ ᱦᱟᱢᱟᱞ ᱥᱟᱦᱟ ᱟᱠᱟᱱᱟ ᱾,Santali,happy
1250,ᱤᱧ ᱱᱚᱶᱟ ᱥᱳᱯᱴᱚᱣᱮᱭᱟᱨ ᱨᱮᱭᱟᱜ ᱜᱩᱱ ᱧᱮᱞ ᱠᱟᱹᱛᱤᱧ ᱟᱹᱲᱤᱥ ᱪᱟᱵᱟ ᱟᱠᱟᱱᱟ ᱪᱮᱫᱟᱜ ᱥᱮ ᱡᱚᱠᱷᱚᱱ ᱜᱮ ᱤᱧ ᱱᱚᱶᱟᱧ ᱪᱟᱞᱟᱣᱟ ᱮᱱᱠᱷᱟᱱ ᱜᱮ ᱠᱨᱟᱥᱚᱜᱼᱟ ᱾,Santali,disgust
9746,ᱢᱤᱫᱴᱟᱝ ᱟᱫ ᱟᱠᱟᱫ ᱯᱟᱱᱛᱷᱟ ᱯᱨᱚᱥᱛᱟᱵ ᱞᱟᱹᱜᱤᱫᱛᱮ ᱢᱟᱲᱛᱮ ᱟᱡ ᱪᱮᱛᱟᱱ ᱨᱮ ᱟᱹᱰᱤ ᱵᱟᱹᱲᱛᱤ ᱟᱲᱜᱚ ᱦᱮᱡ ᱛᱟᱭᱚᱢ ᱫᱚᱞ ᱨᱮᱱ ᱢᱮᱹᱱᱮᱡᱟᱨ ᱴᱷᱮᱱ ᱠᱷᱚᱱ ᱨᱟᱹᱜᱤ ᱨᱮᱭᱟᱜ ᱥᱤᱨᱡᱟᱹᱣ ᱦᱩᱭ ᱞᱮᱱᱟ ᱾,Santali,anger
8421,بہٕ اوسس أکس پرٛٲنس قلعس کن پکان تہٕ ییٚلہ مےٚ أنٛدۍ پٔکھۍ نصف رٲژ پنن پان کُن زوٚن وُچھ تہٕ مےٚ گوٚو خوفک احساس۔,Kashmiri,fear
8122,مےٚ گوٚو واریاہ دکھ ییٚلہ میون  اکھ پیشہ بوج  اکہ کھۄتہٕ زیادٕ اعضاء فیل گژھنہٕ سۭتۍ  اچانک مُود۔,Kashmiri,sad
1923,شکر خدایس کن  ز ییٚمہ ہفتہٕ پیوٚو روٗد۔ وۄنۍ کھسہ میون فصل رٕتۍ پٲٹھۍ۔,Kashmiri,happy
10943,ꯌꯦꯡꯎ! ꯁꯃꯨꯗ꯭ꯔ ꯇꯣꯔꯕꯥꯟꯒꯤ ꯃꯅꯥꯛꯇ ꯁꯥꯔꯛ ꯑꯃ ꯂꯩꯌꯦ!,Manipuri,surprise
11881,بہٕ اوسُس  ہمیشہٕ  تۄہہ اکھ قدامت پسند سرمایہ کار زانان تہٕ مےٚ اوس نہٕ اندازٕہ ز تہۍ چھو میوچول فنڈن پیٹھ شیئر مارکیٹس منٛز پنن پونسہٕ خطرس منز تراوان۔,Kashmiri,surprise
8397,"ꯐ꯭ꯔꯤꯖꯗꯒꯤ ꯏꯁꯤꯡ ꯌꯨꯕꯒꯤ ꯃꯇꯥꯡꯗ ꯑꯩ ꯋꯥꯈꯜ ꯈꯔ ꯋꯥꯗꯕ ꯉꯝꯗꯦ, ꯃꯁꯤꯅ ꯑꯩꯒꯤ ꯆꯥꯛꯁꯪꯒꯤ ꯂꯩꯃꯥꯏ ꯅꯠꯇ꯭ꯔꯒ ꯈꯨꯠꯂꯥꯏ ꯑꯗꯨ ꯐꯥꯎꯕ ꯃꯥꯡꯍꯟ ꯇꯥꯛꯍꯟꯕ ꯉꯝꯒꯗꯔꯥ?",Manipuri,fear
2225,ꯑꯩꯒꯤ ꯏꯟꯁꯇ꯭ꯔꯛꯇꯔꯅ ꯑꯩꯒꯤ ꯒꯥꯔꯤ ꯊꯧꯕꯒꯤ ꯍꯩꯁꯤꯡꯕꯁꯤꯡ ꯑꯗꯨ ꯀꯥꯟꯅꯕ ꯃꯑꯣꯡꯗ ꯌꯦꯡꯁꯤꯟꯕꯤꯈꯤꯕ ꯃꯇꯝꯗ ꯑꯩ ꯌꯥꯝꯅ ꯅꯨꯡꯉꯥꯏꯕ ꯐꯥꯎꯈꯤ ꯫ ꯑꯩ ꯒꯥꯔꯤ ꯊꯧꯕꯒꯤ ꯁꯪꯁꯥꯔ ꯑꯁꯤ ꯑꯅꯧꯕ ꯃꯑꯣꯡꯗ ꯎꯈꯤ ꯫,Manipuri,surprise
5073,ᱡᱟᱦᱟᱱ ᱵᱤᱫᱮᱥᱤ ᱥᱟᱦᱟᱨ ᱨᱮ ᱟᱫᱚᱜ ᱨᱮᱭᱟᱜ ᱵᱚᱛᱚᱨ ᱫᱚ ᱤᱧ ᱢᱤᱫᱴᱟᱝ ᱱᱟᱵᱷᱤᱜᱮᱥᱚᱱ ᱮᱯ ᱰᱟᱣᱩᱱᱞᱳᱰ ᱞᱟᱹᱜᱤᱫ ᱮ ᱵᱚᱲᱦᱮ ᱠᱤᱫᱤᱧᱟ ᱾,Santali,fear
5305,ꯃꯃꯤꯔꯣꯏ ꯑꯗꯨꯅ ꯃꯉꯣꯟꯗ ꯉꯥꯎꯖꯕ ꯃꯤ ꯑꯃꯅ ꯐꯣꯇꯣ ꯑꯃ ꯅꯝꯅꯕ ꯍꯣꯠꯅꯕꯗ ꯂꯥꯛꯇꯅ ꯏꯟꯈꯤ ꯑꯃꯁꯨꯡ ꯃꯍꯥꯛꯀꯤ ꯐꯣꯟ ꯑꯗꯨ ꯊꯨꯒꯥꯏꯈꯤ ꯫,Manipuri,anger
7421,از چھُ  خوبصورت دۄہ!,Kashmiri,happy
10117,مےٚ ہسا کھوٚت شرارت ییٚلہ ہنٛدوستٲنۍ حکومتن ہنٛدوستٲنۍ فٹ بال ٹیمس ایشیٲیی کھیلن منٛز گنٛدنٗک اجازت دیت نہٕ۔,Kashmiri,sad
999,فرانسٕکۍ شہری ٲسۍ تمہ وز شرارتس منٛز ییٚلہ حکوٗمتن سبکدوش گژھنہٕ چہ وٲنٛسہ منٛز اضافہٕ کوٚر۔,Kashmiri,anger
10148,ᱫᱚᱞ ᱨᱮᱭᱟᱜ ᱢᱚᱱᱫᱟᱲᱮ ᱱᱩᱱᱟᱹᱜ ᱜᱮ ᱞᱤᱪᱟᱹᱲ ᱟᱠᱟᱱᱟ ᱪᱮᱫᱟᱜ ᱥᱮ  ᱠᱞᱟᱭᱮᱱᱴ ᱠᱚ ᱟᱥᱚᱜᱼᱟ ᱡᱮ ᱡᱚᱠᱷᱚᱱ ᱩᱱᱤᱭ ᱠᱚᱞᱟ ᱩᱱᱠᱩ ᱟᱠᱚᱣᱟᱜ ᱥᱤᱴ ᱨᱮᱠᱚ ᱫᱩᱲᱩᱵ ᱢᱟ ᱾,Santali,sad
5607,مےٚ چھےٚ خونس گرٛکھ لگان ییٚلہ تم قومی سلامتی ہنٛدس ناوس پیٹھ اظہارٕچ آزٲدی دباوان چھ۔,Kashmiri,anger
1762,ꯔꯤꯐꯟ ꯈꯨꯠꯁꯤꯟꯅꯔꯛꯅꯕ ꯁꯦꯟ ꯆꯥꯒꯦ ꯍꯥꯏꯕ ꯏꯟꯀꯝ ꯇꯦꯛꯁꯀꯤ ꯃꯤꯑꯣꯏꯁꯤꯡ ꯑꯁꯤ ꯃꯤꯑꯣꯏꯕꯒꯤ ꯋꯥꯈꯟ ꯆꯦꯟꯗꯕꯁꯤꯡꯅꯤ ꯫,Manipuri,disgust
9854,یہ چھ عجیب ز مٲہرین ڈاکٹر یِم بہترین ہسپتالو پیٹھ چِھ، چھنہٕ میانِہ کَلہٕ دادِیُک علاج ہیکان ژھٲنڑِتھ۔,Kashmiri,surprise
7268,ᱤᱧ ᱡᱚᱠᱷᱚᱱ ᱦᱮᱢᱞᱤᱭᱟᱜ ᱠᱷᱮᱞᱱᱟ ᱫᱳᱠᱟᱱᱤᱧ ᱥᱮᱱᱚᱜᱼᱟ ᱩᱱ ᱚᱠᱛᱚ ᱤᱧ ᱡᱩᱣᱟᱹᱱ ᱟᱨ ᱯᱷᱩᱨᱛᱤ ᱜᱤᱧ ᱟᱹᱭᱠᱟᱣᱟ  ᱾,Santali,happy
6379,یہٕ چھ ناقابل یقین۔ مےٚ اوس اکہ گٲنٹہٕ برٛونہہ کھینُک آرڈر دیتمت، تہٕ بہٕ چھس وٕنہ فاقے۔ تہٕ ییٚلہ مےٚ چیک کرنہٕ خٲطرٕ فون کوٚر، تہندۍ سٹافن ووٚن ز یہ چھ وتہِ کانٛہہ حقیقی وضاحت دنہٕ ورٲے۔ کُنہ ہوٹلس پزٕ نہٕ پنٛنین مہمانن سۭتۍ یتھ سلوک کرن۔,Kashmiri,anger
11890,ꯑꯩꯍꯥꯛꯀꯤ ꯏꯃꯨꯡ ꯃꯅꯨꯡꯅ ꯑꯩꯉꯣꯟꯗ ꯊꯥꯖꯕ ꯀꯌꯥ ꯊꯝꯕꯅ ꯃꯔꯝ ꯑꯣꯏꯗꯨꯅ ꯑꯩꯍꯥꯛꯀꯤ ꯄꯨꯛꯅꯤꯡ ꯋꯥꯕꯒꯤ ꯄꯣꯠꯂꯨꯝ ꯑꯁꯤꯅ ꯐꯨꯡꯒꯠꯄ ꯐꯥꯎꯋꯤ ꯫,Manipuri,sad
5783,ہوٹلک عملہ چھ واریاہ بدتمیز۔ ہُمۍ ووٚن ز بہٕ چھس مشٲدۍ ال ہش۔,Kashmiri,sad
7915,ꯆꯦ ꯆꯥꯡꯁꯤꯡꯁꯤꯗ ꯑꯩꯍꯥꯛꯅ ꯆꯥꯅꯗꯕꯁꯤꯡ ꯐꯪꯈꯤꯕ ꯑꯁꯤꯅ ꯑꯩꯍꯥꯛ ꯁꯥꯎꯅꯤꯡꯈꯤ꯫,Manipuri,disgust
7439,ᱱᱚᱶᱟ ᱰᱟᱨᱠ ᱪᱚᱠᱞᱮᱴ ᱫᱚ ᱴᱨᱟᱯᱷᱚᱞ ᱨᱮᱭᱟᱜ ᱵᱟᱹᱲᱛᱤᱭ ᱡᱟᱸᱜᱮᱫᱟᱨᱟᱢᱟ  ᱾,Santali,happy
11316,ꯀꯔꯤꯒꯨꯝꯕ ꯑꯩꯍꯥꯛꯀꯤ ꯇꯤꯝꯒꯤ ꯃꯤꯑꯣꯏꯁꯤꯡꯒꯤ ꯍꯣꯠꯅꯖꯃꯟ ꯑꯁꯤ ꯈꯪꯕꯤꯗ꯭ꯔꯕꯗꯤ ꯃꯈꯣꯏ ꯆꯠꯈ꯭ꯔꯅꯤ ꯍꯥꯏꯅ ꯄꯥꯈꯠꯂꯦ ꯫,Manipuri,fear
7879,"ꯍꯦꯂꯣ ꯃꯦꯝ, ꯑꯩ ꯍꯥꯟꯅ ꯃꯐꯝ ꯑꯁꯤꯗ ꯂꯥꯛꯈꯤꯕꯅꯤ꯫ ꯐꯝꯐꯝ ꯑꯗꯨ ꯑꯩꯒꯤꯅꯤ꯫",Manipuri,anger
4889,ᱤᱧ ᱵᱷᱟᱨᱚᱛ ᱨᱮᱱ ᱛᱷᱟᱹᱱᱤᱛ ᱢᱟᱦᱟᱡᱚᱱ ᱠᱚ ᱵᱟᱹᱧ ᱥᱟᱦᱟᱣ ᱫᱟᱲᱮᱭᱟ ᱠᱚᱣᱟ ᱡᱟᱦᱟᱭ ᱫᱚ ᱢᱟᱱᱚᱵᱤᱠ ᱟᱹᱠᱤᱞ ᱵᱮᱜᱚᱨ ᱡᱟᱨᱯᱟᱣᱟᱱ ᱛᱩᱢᱟᱹᱞ ᱠᱟᱹᱭᱫᱩᱥ ᱵᱮᱣᱦᱟᱨ ᱠᱟᱛᱮ ᱾,Santali,disgust
10255,ꯑꯥꯍ! ꯑꯔꯣꯏꯕꯗ ꯑꯩ ꯆꯦꯟꯅꯥꯏꯒꯤ ꯇꯤꯀꯦꯠ ꯐꯪꯈꯤ ꯫ ꯐꯝꯐꯝ ꯈꯔꯈꯛꯇꯃꯛ ꯍꯥꯡꯕ ꯎꯔꯦ ꯫ ꯑꯗꯣꯝꯒꯤ ꯃꯇꯦꯡ ꯑꯁꯤ ꯌꯥꯝꯅ ꯀꯥꯟꯅꯕ ꯑꯣꯏꯔꯦ ꯁꯔ ꯫,Manipuri,surprise
633,ᱟᱞᱮᱭᱟᱜ ᱰᱟᱦᱟᱨ ᱟᱲᱮᱨᱮ ᱵᱮᱱᱟᱣ ᱫᱩᱨᱤᱵ ᱠᱚ ᱰᱟᱢᱯ ᱠᱚᱨᱟᱣ ᱞᱟᱹᱜᱤᱫ ᱫᱳᱠᱟᱱ ᱥᱟᱞᱟᱜ ᱤᱧᱟᱹᱜ ᱢᱚᱪᱟ ᱢᱚᱪᱟ ᱛᱟᱯᱟᱢ ᱦᱩᱭ ᱞᱮᱱᱟ ᱾,Santali,anger
651,ᱱᱩᱝᱠᱩ ᱦᱮᱠᱟᱨ ᱠᱚ ᱡᱟᱦᱟᱭ ᱫᱚ ᱮᱴᱟᱜ ᱠᱚᱣᱟᱜ ᱠᱟᱹᱣᱰᱤᱠᱚ ᱪᱷᱤᱱᱜᱟᱹᱣ ᱮᱫ ᱠᱟᱱ ᱩᱝᱠᱩ ᱵᱤᱪᱟᱹᱨ ᱵᱮᱜᱚᱨᱜᱮ ᱢᱚᱦᱚᱨ ᱢᱮᱴᱟᱣ ᱠᱚ ᱞᱟᱹᱜᱛᱤᱭᱟ ᱾ ᱩᱝᱠᱩ ᱫᱚ ᱫᱩᱥᱤ ᱠᱟᱱᱟᱠᱚ ᱾ (ᱜᱟᱛᱮ ᱒),Santali,anger
10207,ᱧᱮᱧᱮᱞᱤᱭᱟᱹ ᱡᱚᱠᱷᱚᱱ ᱤᱧᱟᱹᱜ ᱜᱟᱹᱰᱤ ᱯᱟᱨᱠᱤᱝ ᱞᱟᱦᱟᱨᱮ ᱟᱡᱟᱜ ᱜᱟᱹᱰᱤᱭ ᱛᱤᱸᱜᱩ ᱞᱮᱫᱟ ᱩᱱᱫᱚ ᱤᱧᱤᱧ ᱟᱹᱲᱤᱥ ᱞᱮᱱᱟ ᱾,Santali,anger
8,ᱟᱲᱮᱯᱟᱥᱮ ᱨᱮᱭᱟᱜ ᱵᱮᱠᱟᱨᱤ ᱠᱷᱚᱱ ᱱᱚᱶᱟ ᱠᱨᱳᱭᱮᱥᱮᱹᱱᱴ ᱨᱮᱭᱟᱜ ᱡᱷᱟᱠᱩᱱᱤ ᱫᱚ ᱮᱠᱟᱞᱜᱮ   ᱥᱚᱨᱚᱜᱼᱟᱱᱟᱜ ᱾,Santali,happy
5983,بہٕ چھس نہٕ بسہٕ ذریعہٕ سفر کرنہٕ خٲطرٕ ٹکٹ جٲری کرنہٕ کس عملس متعلق سوچتھ بےچینی محسوس کرنہ رُس روزتھ ہیکان، مےٚ چھےٚ امید ز أسۍ پیٚیہ نہٕ زیچھن لٲنن منٛز پیٲرتھ وق ضایع کرن۔,Kashmiri,fear
2787,ꯁꯣꯔꯣꯛꯇ ꯈꯠꯅꯕꯒꯤ ꯊꯧꯗꯣꯛ ꯑꯃꯗ ꯀꯥꯔ ꯗ꯭ꯔꯥꯏꯚꯔ ꯑꯗꯨꯅ ꯑꯇꯣꯞꯄ ꯃꯤꯑꯣꯏ ꯑꯃꯥꯗ ꯈꯨꯠ ꯊꯥꯈꯤ ꯃꯔꯝꯗꯤ ꯑꯇꯣꯞꯄ ꯃꯤꯑꯣꯏ ꯑꯗꯨꯅ ꯃꯍꯥꯛꯀꯤ ꯀꯥꯔ ꯑꯗꯨꯗꯒꯤ ꯍꯦꯟꯒꯠꯅ ꯊꯧꯈꯤꯕꯒꯤꯅꯤ ꯫,Manipuri,anger
2690,ꯅꯍꯥꯛꯅ ꯂꯥꯟꯒꯩ ꯂꯥꯟꯊꯣꯛꯂꯕ ꯃꯇꯨꯡ ꯑꯩꯍꯥꯛꯅ ꯃꯗꯨ ꯂꯥꯜꯂꯦꯅ ꯍꯥꯔꯛꯄ ꯃꯇꯝꯗ ꯑꯩꯉꯣꯟꯗ ꯂꯥꯎꯕꯒꯤ ꯅꯇꯤꯛ ꯂꯩꯔꯤꯅꯦ꯫,Manipuri,disgust
6364,ᱤᱧ ᱫᱚ ᱟᱨᱴ ᱠᱞᱟᱥᱤᱧ ᱠᱩᱥᱤᱭᱟᱜᱼᱟ ᱾ ᱟᱞᱮ ᱫᱚ ᱟᱞᱮᱞᱮ ᱠᱩᱥᱤᱭᱟᱜ ᱡᱟᱦᱟᱱ ᱨᱚᱝ ᱛᱮᱜᱮ ᱞᱮ ᱟᱸᱠ ᱫᱟᱲᱮᱭᱟᱜᱼᱟ ᱾,Santali,happy
4841,ꯅꯍꯥꯛꯅ ꯐꯣꯟꯗ ꯂꯥꯏꯆꯨꯕ ꯌꯥꯝꯅ ꯍꯦꯜꯂꯦ ꯑꯗꯨꯅ ꯑꯩꯍꯥꯛꯅ ꯃꯗꯨ ꯂꯧꯁꯤꯜꯂꯅꯤ ꯫,Manipuri,anger
2963,ꯑꯩꯅ ꯃꯍꯥꯛꯄꯨ ꯂꯝꯕꯤꯗ ꯆꯠꯄ ꯌꯥꯍꯟꯅꯕ ꯂꯦꯞꯈꯤꯕ ꯃꯇꯨꯡꯗ ꯑꯄꯤꯛꯄ ꯖꯥꯄꯥꯅꯤꯖ ꯃꯆꯥ ꯑꯗꯨꯅ ꯑꯩꯉꯣꯟꯗ ꯃꯀꯣꯛ ꯅꯣꯟꯈꯤꯕ ꯃꯇꯝꯗ ꯑꯩ ꯌꯥ ꯀꯥꯔꯒ ꯂꯩꯍꯧꯈꯤ ꯫,Manipuri,surprise
3629,یٗتھٖیے جنگلس انیہ گٕٹۍ نال ولہِ، اكھ كھوژوٗن یینہٕ وول احساس چھٗ دِلس منز بیہان ۔,Kashmiri,fear
8382,ᱤᱧ ᱨᱟᱹᱜᱤ ᱞᱮᱱᱟ ᱡᱮ ᱟᱢ ᱤᱧᱟᱹᱜ ᱫᱟᱱᱟᱝ ᱨᱮ ᱱᱚᱝᱟ ᱠᱤᱪᱷᱩᱢ ᱞᱟᱹᱭᱟ ᱡᱟᱦᱟᱸ ᱫᱚ ᱟᱞᱟᱝ ᱢᱤᱫ ᱥᱟᱶᱛᱮ ᱞᱟᱝ ᱯᱟᱨᱚᱢ ᱟᱹᱜᱩ ᱟᱠᱟᱫᱟ ᱾,Santali,anger
5803,ᱜᱟᱛᱮ ᱠᱚ ᱥᱟᱞᱟᱜ ᱢᱚᱧᱪᱚ ᱨᱮ ᱯᱚᱥᱪᱤᱢᱟ ᱮᱱᱮᱪ ᱟᱹᱲᱛᱤᱭ ᱚᱠᱛᱚ ᱤᱧᱨᱮᱱ ᱜᱤᱫᱽᱨᱟᱹᱣᱟᱜ ᱢᱚᱱᱚᱡᱳᱜᱽ ᱨᱮᱭᱟᱜ ᱚᱵᱷᱟᱵᱽ ᱟᱨ ᱛᱷᱤᱨ ᱵᱟᱝ ᱛᱟᱦᱮᱱ ᱧᱮᱞᱛᱮ ᱥᱟᱹᱨᱤᱜᱮ ᱫᱩᱠᱤᱧ ᱧᱟᱢ ᱟᱠᱟᱫᱟ ᱾,Santali,sad
3730,ꯃꯐꯝ ꯑꯁꯤꯒꯤ ꯂꯝꯕꯤꯗ ꯌꯣꯟꯕ ꯑꯆꯥ ꯑꯊꯛ ꯑꯁꯤ ꯃꯨꯝꯕꯥꯏꯒꯤ ꯌꯥꯝꯅ  ꯍꯥꯎꯕ ꯑꯆꯥ ꯑꯊꯛ ꯑꯃꯅꯤ ꯫,Manipuri,happy
3147,"ᱦᱮᱭ, ᱤᱧ ᱫᱚ ᱱᱟᱹᱞᱤ ᱠᱷᱚᱱ ᱵᱚᱞ ᱨᱟᱠᱟᱵ ᱫᱚ ᱵᱟᱹᱧ ᱪᱟᱞᱟᱜ ᱠᱟᱱᱟ ᱾ ᱚᱱᱟ ᱫᱚ ᱟᱹᱰᱤᱜᱮ ᱥᱚ ᱠᱟᱱᱟ ᱾",Santali,disgust
8591,"ᱟᱫᱤᱯᱩᱨᱩᱥ' ᱪᱚᱞᱚᱛ ᱪᱤᱛᱟᱹᱨ ᱨᱮᱭᱟᱜ ᱴᱤᱠᱤᱴ ᱠᱤᱨᱤᱧ ᱛᱟᱭᱚᱢ, ᱡᱚᱠᱷᱚᱱ ᱚᱲᱟᱜᱦᱚᱲ ᱱᱚᱣᱟᱠᱚ ᱧᱮᱞᱟ ᱩᱱ ᱟᱢ ᱥᱮᱨᱮᱧ ᱥᱟᱢᱟᱝ ᱨᱮᱢ ᱯᱟᱲᱟᱜᱼᱟ ᱾ ᱟᱢ ᱞᱟᱹᱜᱤᱫ ᱤᱧ ᱫᱩᱠᱤᱧ ᱵᱩᱡᱷᱟᱹᱣ ᱮᱫᱟ ᱾",Santali,sad
1612,ꯇꯥꯔꯦꯁ ꯑꯁꯤ ꯃꯐꯝ ꯁꯤꯟꯕ ꯊꯨꯡꯅ ꯍꯥꯔ ꯑꯃꯁꯨꯡ ꯇꯤꯜꯁꯤꯡꯗꯒꯤ ꯃꯅꯝ ꯌꯥꯝꯅ ꯁꯥꯊꯤꯅ ꯅꯝꯊꯤ ꯫,Manipuri,disgust
7746,ꯆꯞ ꯃꯥꯟꯅꯕ ꯗꯦꯂꯤꯕꯔꯤ ꯑꯗꯨꯒꯤꯗꯃꯛ ꯑꯩꯉꯣꯟꯗꯒꯤ ꯑꯅꯤꯔꯛ ꯁꯦꯟ ꯂꯧꯔꯦ ꯍꯥꯏꯕ ꯈꯪꯂꯛꯄ ꯃꯇꯝꯗ ꯑꯩꯍꯥꯛ ꯌꯥꯝꯅ ꯉꯛꯈꯤ ꯫,Manipuri,surprise
1588,واہ، أمۍ نوۍ سافٹ ویئر اپڈیٹن کٔر تمام سیاپہٕ ٹھیک۔ لیپ ٹاپ چھ بالکل نوو آلہٕ باسان۔,Kashmiri,surprise
7251,ꯑꯩꯒꯤ ꯂꯣꯏꯅꯕꯤꯕꯨ ꯀꯔꯦꯝꯅꯒꯅꯨ! ꯅꯍꯥꯛꯀꯤ ꯋꯥꯉꯥꯡ ꯁꯥꯉꯥꯡꯗꯣ ꯐꯖꯅ ꯉꯥꯡꯉꯨ!,Manipuri,anger
1974,ᱤᱧ ᱮᱢ ᱟᱨ ᱴᱤ ᱮᱥ ᱥᱴᱮᱥᱚᱱ ᱠᱷᱚᱱ ᱤᱧ ᱩᱰᱩᱠ ᱟᱠᱟᱱᱟ ᱟᱨ ᱤᱧ ᱥᱟᱢᱟᱝ ᱨᱮ ᱡᱚᱵᱽᱨᱟ ᱯᱮᱨᱮᱡ ᱰᱟᱦᱟᱨ ᱧᱮᱞ ᱠᱟᱛᱤᱧ ᱞᱟᱸᱜᱟ ᱪᱟᱵᱟᱭᱮᱱᱟ ᱾,Santali,disgust
7698,ᱤᱧ ᱱᱚᱣᱟ ᱤᱫᱤ ᱠᱟᱛᱮᱧ ᱟᱹᱲᱤᱥᱚᱜᱼᱟ ᱡᱮ ᱱᱚᱣᱟ ᱫᱚᱠᱟᱱ ᱥᱟᱨᱟᱼᱜᱷᱟᱹᱲᱤ ᱜᱮ ᱢᱤᱫᱛᱟᱝ ᱥᱮᱨᱮᱧ ᱜᱮᱠᱚ ᱪᱟᱹᱞᱩᱭᱟ ᱾,Santali,disgust
6132,ᱤᱧ ᱯᱩᱲᱥᱤ ᱨᱮᱭᱟᱜ ᱡᱤᱢ ᱨᱮᱭᱟᱜ ᱥᱟᱯᱟᱯ ᱠᱚ ᱵᱟᱝ ᱡᱚᱴᱮᱫ ᱥᱟᱱᱟᱧ ᱠᱟᱱ ᱛᱟᱦᱮᱸᱜ ᱪᱮᱫᱟᱜ ᱥᱮ ᱚᱱᱟ ᱫᱚ ᱟᱹᱰᱤ ᱵᱟᱹᱲᱤᱡ ᱵᱷᱟᱵᱽᱛᱮ ᱞᱟᱴᱟᱜᱼᱞᱟᱴᱟᱜ ᱛᱟᱦᱮᱸᱠᱟᱱᱟ ᱾,Santali,disgust
4048,"ᱜᱟᱹᱦᱤᱨ ᱵᱤᱨ ᱛᱟᱞᱟᱨᱮ ᱵᱤᱥᱟᱱ ᱵᱤᱧ ᱠᱚᱣᱟᱜ ᱵᱷᱩᱜᱟᱹᱜ ᱨᱮ ᱛᱚᱦᱚᱫ ᱠᱟᱛᱮᱜ ᱤᱧᱤᱧ ᱛᱷᱤᱨ ᱩᱛᱟᱹᱨᱮᱱᱟ, ᱤᱧᱟᱹᱜ ᱥᱟᱦᱮᱸᱫ ᱦᱚᱴᱚᱜ ᱨᱮ ᱟᱴᱚᱠᱮᱱᱟ ᱾",Santali,fear
6687,مےٚ کھوٚت ڈاکٹر سنٛد شرارت ییٚلہ تٔمہِ  میٛانہ ہشہ ہٕنٛز ژمہ ہٕنٛد مسلہٕ خٲطرٕ تشخیص ورٲے غٲر ضٔروٗری ادوٲیات تجویز کٔرِ۔,Kashmiri,anger
2606,ꯃꯃꯥꯟꯅꯕꯁꯤꯡꯅ ꯄ꯭ꯔꯦꯁꯔ ꯄꯤꯔꯐꯧꯕ ꯄꯥꯔꯇꯤ ꯆꯨꯞꯄ ꯌꯨ ꯒ꯭ꯂꯥꯁ ꯑꯃꯗꯒꯤ ꯍꯦꯟꯅ ꯄꯥꯏꯗꯕ ꯅꯨꯄꯥ ꯅꯍꯥ ꯑꯗꯨ ꯑꯩꯅ ꯏꯀꯥꯢ ꯈꯨꯝꯅꯔꯝꯃꯤ꯫,Manipuri,happy
745,"ᱵᱟᱨᱦᱮ ᱨᱮ ᱦᱩᱰᱩᱨ ᱵᱤᱡᱞᱤ ᱥᱟᱰᱮᱭᱮᱱᱟ, ᱟᱨ ᱤᱧ ᱫᱚ ᱛᱷᱟᱨ ᱛᱷᱟᱨᱟᱣ ᱟᱛᱮᱫ ᱤᱧᱟᱜ ᱠᱚᱢᱵᱚᱞ ᱞᱟᱛᱟᱨ ᱨᱮᱧ ᱵᱚᱞᱚᱭᱮᱱᱟ ᱾",Santali,fear
7359,ᱥᱚᱨᱠᱟᱨᱟᱜ ᱥᱟᱥᱚᱱᱛᱟᱹᱨᱤᱭᱟᱱᱟᱜ ᱠᱟᱹᱢᱤ ᱦᱚᱨᱟ ᱫᱚ ᱟᱡᱽᱨᱮᱱ ᱱᱟᱜᱟᱨᱤᱭᱟᱹ ᱠᱚᱣᱟᱜ ᱢᱚᱱᱮ ᱨᱮ ᱥᱚᱱᱛᱨᱟᱥ ᱮ ᱜᱷᱟᱹᱞ ᱞᱮᱫᱟ ᱾,Santali,fear
3553,مےٚ كھو٘ت  پیرسس منٛز ریلوے کلرکس پیٹھ سخ شرارت ییٚلہ تٔمہِ  مےٚ سۭتۍ  انگریزی پٲٹھۍ  کتھ کرنس  انکار کوٚر۔,Kashmiri,anger
3275,کوریر سروس ہُند پس معیار چھ مےٚ یہ کورئیر دوبارٕ استعمال کرنس بےٚ سۄکھ کران۔,Kashmiri,fear
4865,"ꯍꯦ, ꯐꯖꯩꯌꯦ! ꯃꯆꯨ ꯑꯁꯤꯗ ꯅꯍꯥꯛꯅ ꯕꯥꯏꯛ ꯑꯃ ꯂꯩꯒꯅꯤ ꯍꯥꯏꯅ ꯑꯩ ꯁꯨꯡꯈꯟ ꯈꯜꯂꯨꯗꯦ꯫",Manipuri,surprise
2926,انہِ گٕٹہِ ییمہِ جنگلہِ وتھ  وجہِ سوٗ باسیو٘ نہٕ ختم گژھن وول ۔,Kashmiri,fear
2414,توٚہۍ چھو مےٚ خوفزدہ کران ییٚلہ تو٘ہہ شرات چھو کھسان تہٕ پانس أنٛدۍ پٔکۍ لکن ہُند پروا کرنہٕ ورٲے چِھو چیز اورٕ یورٕ چھکٕنۍ ہیوان۔,Kashmiri,fear
781,بنٛک لاکرُک کرایہ  دنہٕ پتہٕ تہ چھ یتھ کٹھس دم تہٕ بیٚیہ چھس تیُتھ پھکھ یوان ز انٛدر اژنس چھم نہٕ منٕے کران۔,Kashmiri,disgust
412,بہٕ چُھس پننِۍ گاڑِۍ  چھلنس پیٹھ واریاہ مایوس ۔,Kashmiri,sad
9917,ᱠᱟᱹᱢᱤᱭᱟᱹ ᱠᱚᱣᱟᱜ ᱵᱮᱜᱷᱚᱴᱚᱱ ᱨᱮᱭᱟᱜ ᱠᱷᱚᱵᱚᱨᱛᱮ ᱟᱯᱷᱤᱥ ᱨᱮ ᱫᱩᱠᱷ ᱨᱮᱭᱟᱜ ᱩᱢᱩᱞ ᱟᱲᱜᱳ ᱦᱮᱡ ᱟᱠᱟᱱᱟ ᱾,Santali,sad
8208,ᱱᱚᱣᱟ ᱧᱮᱞ ᱫᱚ ᱦᱟᱦᱟᱲᱟᱜ ᱟᱱᱟᱜ ᱜᱮᱭᱟ ᱡᱮ ᱤᱧᱟᱹᱜ ᱯᱟᱨᱚᱢᱟᱠᱟᱱ ᱵᱮᱥᱤᱜᱤᱞᱠᱚ ᱤᱧᱟᱹᱜ ᱪᱤᱱᱛᱟᱹ ᱨᱮᱭᱟᱜ ᱛᱷᱟᱨ ᱨᱮ ᱪᱮᱫ ᱞᱮᱠᱟᱭ ᱥᱮᱞᱮᱫ ᱟᱠᱟᱱᱟ ᱾ ᱯᱚᱨᱟᱢᱚᱥ ᱫᱚ ᱫᱚᱲᱦᱟ ᱧᱟᱢ ᱨᱮᱭᱟᱜ ᱠᱟᱹᱴᱷᱤ ᱠᱟᱱᱟ ᱾,Santali,surprise
4009,ᱥᱩᱭᱡᱟᱨᱞᱮᱱᱰ ᱨᱮᱭᱟᱜ ᱢᱤᱫᱴᱟᱝ ᱵᱩᱨᱩ ᱪᱮᱛᱟᱱ ᱨᱮ ᱟᱞᱮ ᱵᱷᱟᱨᱚᱛ ᱨᱮᱭᱟᱜ ᱡᱚᱢᱟᱜ ᱞᱮ ᱛᱚᱞᱟᱥ ᱧᱟᱢ ᱟᱠᱟᱫᱟ ᱾,Santali,surprise
6277,ꯑꯩꯈꯣꯏꯅ ꯂꯣꯛꯈꯤꯕ ꯃꯔꯥꯡ ꯀꯥꯏꯕ ꯃꯍꯩ ꯃꯔꯣꯡ ꯑꯁꯤ ꯑꯩꯈꯣꯏꯒꯤ ꯐꯥꯔꯝꯗ ꯊꯕꯛ ꯇꯧꯕ ꯀꯥꯡꯕꯨꯒꯤ ꯀꯠꯊꯣꯛꯄ ꯑꯃꯁꯨꯡ ꯂꯤꯡꯖꯦꯜ ꯃꯥꯟꯅꯅ ꯊꯕꯛ ꯇꯧꯕꯒꯤ ꯈꯨꯗꯝꯅꯤ꯫ ꯃꯁꯤꯒꯤ ꯃꯇꯥꯡꯗ ꯈꯟꯕ ꯃꯇꯝꯗ ꯑꯩ ꯃꯥꯏꯄꯥꯛꯄ ꯐꯥꯎꯏ꯫,Manipuri,happy
4609,ꯆꯍꯤ ꯈꯔꯒꯤ ꯃꯃꯥꯡꯗ ꯖꯦ. ꯑꯦꯟ. ꯌꯨ. ꯗ ꯊꯣꯛꯈꯤꯕ ꯊꯧꯗꯣꯛꯁꯤꯡꯒꯤ ꯃꯇꯥꯡꯗ ꯑꯣꯟꯅ ꯇꯩꯅꯕ ꯄꯥꯎꯒꯤ ꯄꯥꯎꯗꯝ ꯑꯃ ꯄꯤꯈꯤꯕ ꯄꯥꯎꯃꯤꯁꯤꯡ ꯑꯗꯨꯗ ꯑꯩ ꯌꯥꯝꯅ ꯁꯥꯎꯈꯤ꯫,Manipuri,anger
10047,بہٕ چُھس تۄہِہ تہٕ پانس مایوس کرنس کھوژان ۔,Kashmiri,fear
7294,ᱤᱧ ᱫᱚ ᱱᱚᱣᱟ ᱠᱷᱮᱞ ᱵᱟᱹᱧ ᱠᱷᱮᱞᱮᱫᱟ ᱾ ᱱᱚᱣᱟ ᱵᱳᱨᱰ ᱜᱮᱢ ᱠᱷᱮᱞᱳᱰ ᱢᱩᱪᱟᱹᱫ ᱦᱚᱲᱴᱟᱜ ᱫᱚ ᱟᱨ ᱵᱟᱧᱪᱟᱣ ᱵᱟᱹᱱᱩᱭᱟ ᱾,Santali,fear
11644,مےٚ چھُ سیٹھاہ راحت یہ بوزتھ ز ایونٹ منیجر چھ تقریبہ کس حفاظتس ترجیح دوان تہٕ أمس چھ اکھ مکمل رسک مینجمنٹ پلان۔,Kashmiri,happy
10330,وۄں گو سیٹھاہ پریتھ صبح پتۍ ہٗشار روزُن رسویہ منز پاں دۄبس نش ، شٗكر امہِ آلٕكہِ ٹھیكھ كٲم نہٕ كرنٗك ! بہ کرٕ فرج میكنِكس فون ۔,Kashmiri,anger
4742,ᱟᱠᱚᱨᱥᱚᱱ ᱨᱮ ᱦᱤᱲᱤᱡ ᱰᱟᱦᱟᱨ ᱩᱫᱩᱜ ᱠᱷᱟᱹᱛᱤᱨ ᱤᱧ ᱛᱷᱟᱹᱱᱤᱭᱚ ᱦᱚᱲ ᱠᱚ ᱪᱮᱛᱟᱱᱤᱧ ᱟᱹᱲᱤᱥ ᱞᱮᱱᱟ ᱾,Santali,anger
7006,ꯂꯧꯎꯁꯤꯡꯎꯒꯤ ꯁꯤꯟꯃꯤꯁꯤꯡꯅ ꯈꯪꯍꯟꯂꯝꯗꯅ ꯀꯨꯝꯍꯩꯁꯤꯡꯒꯤꯗꯃꯛꯇ ꯅꯠꯇ꯭ꯔꯒ ꯀꯔꯤꯒꯨꯝꯕ ꯃꯈꯣꯏꯗ ꯁꯦꯜ ꯍꯦꯟꯅ ꯄꯤꯔꯕꯗꯤ ꯑꯇꯣꯞꯄ ꯂꯝ ꯃꯄꯨꯁꯤꯡꯒꯤꯗꯃꯛꯇ ꯊꯕꯛ ꯇꯧꯔꯛꯄ ꯆꯠꯈꯤꯕ ꯑꯗꯨꯗ ꯑꯩ ꯌꯥꯝꯅ ꯁꯥꯎꯅꯤꯡꯏ ꯫ ꯃꯗꯨꯗꯒꯤ ꯂꯧꯐꯝꯁꯤꯡ ꯑꯗꯨ ꯌꯦꯡꯁꯤꯟꯕ ꯉꯝꯗꯦ꯫,Manipuri,anger
10392,ꯊꯧꯔꯝ ꯑꯁꯤ ꯃꯤꯑꯣꯏ ꯑꯃ ꯍꯦꯛ ꯐꯪꯕ ꯃꯇꯝꯗ ꯍꯧꯕ ꯃꯊꯧ ꯇꯥꯈꯤꯕ ꯑꯃꯁꯨꯡ ꯑꯩꯍꯥꯛ ꯌꯥꯎꯗꯅ ꯊꯧꯔꯝ ꯑꯗꯨ ꯃꯈꯥ ꯆꯠꯊꯅꯕ ꯊꯧꯔꯥꯡ ꯇꯧꯈꯤꯕ ꯑꯗꯨꯗ ꯑꯩꯍꯥꯛꯅ ꯄꯥꯈꯠꯄ ꯐꯥꯎꯈꯤ ꯫,Manipuri,fear
3818,ᱧᱮᱧᱮᱞᱤᱭᱟᱹ ᱠᱚᱣᱟᱜ ᱢᱮᱫ ᱥᱟᱢᱟᱝ ᱨᱮ ᱱᱟᱯᱟᱭ ᱩᱫᱩᱜ ᱥᱚᱫᱚᱨ ᱞᱟᱹᱜᱤᱫ ᱛᱮ ᱡᱟᱦᱟᱸ ᱪᱟᱯ ᱚᱱᱟ ᱤᱧ ᱮ ᱩᱢᱡᱷᱟᱹᱣ ᱟᱠᱟᱫᱤᱧᱟᱹ ᱾,Santali,fear
5043,ꯄ꯭ꯔꯦꯃꯥꯅ ꯗꯥꯏꯕꯤꯡ ꯕꯣꯔꯗꯇ ꯆꯣꯡꯊꯅꯕ ꯁꯦꯝ ꯁꯥꯗꯨꯅ ꯂꯦꯞꯈꯤꯕ ꯃꯇꯝꯗ ꯃꯍꯥꯛꯀꯤ ꯈꯣꯡꯁꯤꯡ ꯅꯤꯛꯈꯤ ꯫,Manipuri,fear
10114,مےٚ پیوٚو از غلطی سببہٕ فون پتھر تہٕ تتھ پھٹ سکریٖن۔,Kashmiri,sad
5281,سٗہ کتھہٕ کٔنہِ ہیکہِ میٲنیہ كارِ  تیزی سان بٗتھہِ یِتھ  تہٕ مےٚ برٛۄنٛہہ پکنہٕ نِشہِ رٗكٲوِتھ ؟,Kashmiri,anger
5067,ꯃꯗꯨ ꯀꯔꯤꯅꯣ ꯍꯥꯏꯕꯗꯨ ꯑꯩ ꯈꯪꯗꯕꯅ ꯃꯣꯜ ꯑꯗꯨꯗ ꯂꯩꯔꯤꯕ ꯅꯞꯅꯞ ꯂꯥꯎꯕ ꯑꯃꯣꯠꯄ ꯑꯗꯨꯒꯤ ꯃꯅꯥꯛꯇ ꯑꯩ ꯆꯪꯂꯣꯏ꯫,Manipuri,disgust
5572,بہٕ چھس ییمِہ ضیافت کِہ مزٕ سۭتۍ واریاہ ناخوش مگر یہ چھ میٲنۍ پسندیدٕ ضیافت۔,Kashmiri,sad
11329,ᱤᱧ ᱦᱤᱡᱩᱜ ᱠᱟᱱ ᱠᱚᱨᱯᱳᱨᱮᱴ ᱨᱚᱡᱽᱜᱟᱨ ᱨᱮᱭᱟᱜ ᱢᱩᱲᱥᱩᱢᱨᱮ ᱵᱟᱡᱟᱨ ᱠᱚᱢᱚᱜ ᱨᱮᱭᱟᱜ ᱤᱫᱤ ᱠᱟᱛᱮ ᱵᱮᱡᱟᱨᱤᱧ ᱟᱴᱠᱟᱨ ᱮᱫᱟ ᱾,Santali,fear
6862,مےٚ چھ کھران ز یہ سٹور کتھ پٲٹھۍ چھ پرٛیتھ ساتہٕ اکُے گیون بجاوان۔,Kashmiri,disgust
8684,ꯑꯈꯥꯛ ꯑꯔꯥꯎ ꯌꯥꯎꯕ ꯅꯣꯡꯂꯩ ꯅꯨꯡꯁꯤꯠ ꯑꯃꯗ ꯄꯟꯕꯒꯤ ꯈꯟꯕꯗ ꯑꯩ ꯀꯤꯖꯩ꯫,Manipuri,fear
1445,ᱡᱚᱠᱷᱚᱱ ᱠᱟᱨᱞ ᱞᱩᱭᱤᱥ ᱟᱜ ᱟᱹᱭᱩᱨᱛᱮ ᱩᱱᱤᱭᱟᱜ ᱔x᱑00 ᱠᱳᱣᱟᱴᱟᱨ ᱚᱞᱚᱢᱯᱤᱠ ᱨᱮᱠᱚ ᱡᱤᱛᱠᱟᱹᱨ ᱮᱱᱠᱷᱟᱱ ᱟᱢᱨᱤᱠᱟ ᱨᱮᱱ ᱦᱚᱲ ᱠᱚᱣᱟᱜ ᱠᱟᱞᱠᱟᱞᱟᱣ  ᱥᱴᱮᱰᱤᱭᱟᱢ ᱨᱮ ᱟᱸᱡᱚᱢ ᱮᱱᱟ ᱾,Santali,happy
1248,ꯀꯁꯇꯃꯔꯁꯤꯡꯅ ꯑꯩꯈꯣꯏꯒꯤ ꯊꯧꯃꯤꯁꯤꯡꯒꯤ ꯍꯩꯖ ꯁꯤꯡꯖꯕ ꯑꯁꯤꯗ ꯊꯥꯅꯗꯕ ꯃꯑꯣꯡ ꯎꯠꯄ ꯑꯃꯁꯨꯡ ꯃꯈꯣꯏꯗ ꯂꯦꯞꯄ ꯂꯩꯇꯅ ꯋꯥ ꯄꯪꯍꯪꯗ ꯍꯪꯕ ꯑꯁꯤ ꯌꯥꯝꯅ ꯅꯨꯡꯉꯥꯏꯖꯗꯦ ꯫,Manipuri,sad
11549,خوفناک؟ کیازِ؟ کیٛاہ یہ چھےٚ تیوٗت قۭمتی؟,Kashmiri,fear
